,channelId,channelTitle,videoId,vidoeTitle,description,link,time,year,month,day
0,UC16niRr50-MSBwiO3YDb3RA,BBC News,TEWsyvEQ_Vg,Another new vaccine is said to be 88% effective against severe Covid - BBC News,Another new vaccine against coronavirus has been shown to be effective in major trials. The latest Janssen vaccine requires just ...,https://www.youtube.com/watch?v=TEWsyvEQ_Vg,2021-01-29T22:23:01Z,2021,1,29
1,UC16niRr50-MSBwiO3YDb3RA,BBC News,N-6cYx3OBSo,How women played a major role in Yemen&#39;s Arab Spring - BBC News,Yemen was one of the first countries to be caught up in the Arab Spring uprisings which swept the Middle East and North Africa 10 ...,https://www.youtube.com/watch?v=N-6cYx3OBSo,2021-01-29T14:30:03Z,2021,1,29
2,UC16niRr50-MSBwiO3YDb3RA,BBC News,rh4WEXNmLaI,Is university worth the money in lockdown? - BBC News,"With little face-to-face teaching due to the pandemic, students in England give their views on what it feels like to pay more than ...",https://www.youtube.com/watch?v=rh4WEXNmLaI,2021-01-29T12:15:01Z,2021,1,29
3,UC16niRr50-MSBwiO3YDb3RA,BBC News,HqoUa2SH9Ss,The story behind the US inauguration&#39;s sign language Pledge of Allegiance - BBC News,"Fire Captain Andrea Hall of South Fulton, Georgia, explained that her late father was deaf. She is bilingual - an English speaker ...",https://www.youtube.com/watch?v=HqoUa2SH9Ss,2021-01-29T08:41:08Z,2021,1,29
4,UC16niRr50-MSBwiO3YDb3RA,BBC News,PpSpsKiGidk,Coronavirus: What’s behind vaccine-hesitancy? - BBC Newsnight,Black MPs from across the parties in the UK have joined together in a video encouraging people to get the coronavirus vaccine.,https://www.youtube.com/watch?v=PpSpsKiGidk,2021-01-29T01:13:17Z,2021,1,29
