,channelId,channelTitle,videoId,vidoeTitle,description,link,time,year,month,day
0,UC16niRr50-MSBwiO3YDb3RA,BBC News,5A7gO1jblek,Coronavirus:  28-year-old pregnant nurse is latest NHS worker to lose her life - BBC News,A pregnant NHS nurse is one of the latest victims of the pandemic. Mary Agyapong worked at the Luton and Dunstable University Hospital. Colleagues said she ...,https://www.youtube.com/watch?v=5A7gO1jblek,2020-04-15T22:05:24Z,2020,4,15
1,UC16niRr50-MSBwiO3YDb3RA,BBC News,78STut8itus,Coronavirus: concern over deaths in care homes - govt promises more tests  - BBC News,The government has promised more testing for coronavirus in care homes in England after serious concerns about the number of deaths of residents. Ministers ...,https://www.youtube.com/watch?v=78STut8itus,2020-04-15T21:38:49Z,2020,4,15
2,UC16niRr50-MSBwiO3YDb3RA,BBC News,tOT_HO-KHYc,Italy’s coronavirus lockdown puts restaurants out of business - BBC News,"As the lockdown in Italy enters its sixth week, some restaurants and bars are already going out of business. The Italian government has told the BBC that it may ...",https://www.youtube.com/watch?v=tOT_HO-KHYc,2020-04-15T19:48:51Z,2020,4,15
3,UC16niRr50-MSBwiO3YDb3RA,BBC News,fiXeOn7KA9U,Life on Estonia&#39;s &#39;corona island&#39; - BBC News,A European island off the coast of Estonia has been labelled by locals as 'corona island' after becoming the hotspot for the virus and being placed into strict ...,https://www.youtube.com/watch?v=fiXeOn7KA9U,2020-04-15T13:52:43Z,2020,4,15
4,UC16niRr50-MSBwiO3YDb3RA,BBC News,_T4GHeIwyXw,Coronavirus: The Japanese musician Yoshiki on #SING4LIFE - BBC News,"The Japanese musician Yoshiki talking to BBC's Outside Source's Kasia Madera About #SING4LIFE the song Featuring Bono, will.i.am, Jennifer Hudson and ...",https://www.youtube.com/watch?v=_T4GHeIwyXw,2020-04-15T12:32:32Z,2020,4,15
5,UC16niRr50-MSBwiO3YDb3RA,BBC News,QeBeJkQkDvg,Coronavirus: The situation in Europe - BBC News,"After Spain allowed work to resume at construction sites and factories on Monday, now Italy and Austria are allowing some retail businesses to restart, on a very ...",https://www.youtube.com/watch?v=QeBeJkQkDvg,2020-04-15T11:58:33Z,2020,4,15
6,UC16niRr50-MSBwiO3YDb3RA,BBC News,RSZoDTvgEr8,Coronavirus: Is there a link between the Severity of Covid-19 and Air pollution - BBC News,A recent Harvard analysis is the first study to show a statistical link between COVID-19 deaths and other diseases associated with long-term exposure to fine ...,https://www.youtube.com/watch?v=RSZoDTvgEr8,2020-04-15T11:55:58Z,2020,4,15
