,channelId,channelTitle,videoId,vidoeTitle,description,link,time,year,month,day
0,UC16niRr50-MSBwiO3YDb3RA,BBC News,BB2ZAnzFGYQ,Saudi court commutes Khashoggi death sentences - BBC News,A court in Saudi Arabia has commuted the death sentences handed to five people convicted over the 2018 murder of Jamal ...,https://www.youtube.com/watch?v=BB2ZAnzFGYQ,2020-09-07T15:12:28Z,2020,9,7
1,UC16niRr50-MSBwiO3YDb3RA,BBC News,C24HAGcI8Dw,Russia&#39;s Navalny out of coma after poisoning - BBC News,"Doctors treating Russian opposition figure Alexei Navalny say he is out of an induced coma and his condition, since being ...",https://www.youtube.com/watch?v=C24HAGcI8Dw,2020-09-07T15:10:27Z,2020,9,7
2,UC16niRr50-MSBwiO3YDb3RA,BBC News,qj_ZUdWpA4o,Tel Aviv: Drone filmed dropping suspected cannabis over city - BBC News,"A quadcopter has been recorded releasing a payload of little bags, which Israeli police suspect contained ""a dangerous drug"", ...",https://www.youtube.com/watch?v=qj_ZUdWpA4o,2020-09-07T14:40:31Z,2020,9,7
3,UC16niRr50-MSBwiO3YDb3RA,BBC News,GbqvF_rddcg,California wildfires: Fires rage across thousands of acres - BBC News,"Officials have blamed a gender reveal party for one of several wildfires raging in the US state of California. A ""smoke-generating ...",https://www.youtube.com/watch?v=GbqvF_rddcg,2020-09-07T13:55:49Z,2020,9,7
4,UC16niRr50-MSBwiO3YDb3RA,BBC News,JeP5x_hsAfY,Jacob Blake pleads not guilty to sexual assault - BBC News,"Jacob Blake, the Wisconsin man whose shooting by police triggered protests in the US, has pleaded not guilty to criminal charges ...",https://www.youtube.com/watch?v=JeP5x_hsAfY,2020-09-07T09:07:23Z,2020,9,7
5,UC16niRr50-MSBwiO3YDb3RA,BBC News,Q438IqeHJxo,What&#39;s behind the unequal threat of Covid - BBC News,Covid-19 is already the third-leading cause of death for African Americans this year. But why has the virus hit this community ...,https://www.youtube.com/watch?v=Q438IqeHJxo,2020-09-07T09:06:49Z,2020,9,7
