,channelId,channelTitle,videoId,vidoeTitle,description,link,time,year,month,day
0,UC16niRr50-MSBwiO3YDb3RA,BBC News,gbuA2iujI2A,Coronavirus: Boris Johnson warns NHS in danger of being overwhelmed – BBC News,The UK's Prime Minister has warned the National Health Service (NHS) will be overwhelmed unless the British people act together to slow the spread of ...,https://www.youtube.com/watch?v=gbuA2iujI2A,2020-03-21T23:03:53Z,2020,3,21
1,UC16niRr50-MSBwiO3YDb3RA,BBC News,beYlKvGOxqI,Coronavirus: The global response to another huge rise in cases – BBC News,"Around the world governments are battling to keep pace with the spread of the coronavirus. In Italy nearly 800 people have died within the last 24 hours, ...",https://www.youtube.com/watch?v=beYlKvGOxqI,2020-03-21T22:39:20Z,2020,3,21
2,UC16niRr50-MSBwiO3YDb3RA,BBC News,G3v6tDzY7EI,Coronavirus: Almost 800 more dead in Italy - BBC News,Deaths continue to spiral in Italy. Official figures show 793 have died of Covid-19 in the last 24 hours - another daily record. In total 4825 people have now died ...,https://www.youtube.com/watch?v=G3v6tDzY7EI,2020-03-21T18:27:28Z,2020,3,21
3,UC16niRr50-MSBwiO3YDb3RA,BBC News,p7SNkfzEeKM,Coronavirus: UK Shoppers told to buy responsibly - BBC News,"Shoppers in the UK have been told to ""be responsible"" and think of others such as NHS workers, after panic-buying amid the coronavirus outbreak. Environment ...",https://www.youtube.com/watch?v=p7SNkfzEeKM,2020-03-21T15:07:04Z,2020,3,21
4,UC16niRr50-MSBwiO3YDb3RA,BBC News,VgPZtTeEG5k,Coronavirus: Inside an Italian ICU - BBC News,"Overwhelmed by coronavirus cases, one hospital is putting some new arrivals in tents. Please subscribe HERE http://bit.ly/1rbfUog.",https://www.youtube.com/watch?v=VgPZtTeEG5k,2020-03-21T11:15:38Z,2020,3,21
5,UC16niRr50-MSBwiO3YDb3RA,BBC News,A2kiXc5XEdU,How do I know if I have coronavirus? - BBC News,"People who are showing particular symptoms are being told to self-isolate in order to stop the coronavirus from spreading further. In the UK, if you have a fever ...",https://www.youtube.com/watch?v=A2kiXc5XEdU,2020-03-21T10:10:19Z,2020,3,21
