,channelId,channelTitle,videoId,vidoeTitle,description,link,time,year,month,day
0,UC16niRr50-MSBwiO3YDb3RA,BBC News,E00731OeWCA,Mars rover begins search for alien life on Red Planet - BBC News,"NASA has successfully landed a new rover on Mars, in the most ambitious mission yet to the planet. After a seven month journey ...",https://www.youtube.com/watch?v=E00731OeWCA,2021-02-18T22:36:08Z,2021,2,18
1,UC16niRr50-MSBwiO3YDb3RA,BBC News,jlSWqJwtGoE,Big fall in Covid cases in England but infections still high among under-25s - BBC News,Scientists say there's been a strong decline in the number of covid infections in England since the latest lockdown began.,https://www.youtube.com/watch?v=jlSWqJwtGoE,2021-02-18T22:23:55Z,2021,2,18
2,UC16niRr50-MSBwiO3YDb3RA,BBC News,kOSSG9sg4CQ,Dog inherits $5 million from deceased owner - BBC News,"Lulu the border collie was left $5 million (£3.6 million) after her owner died last year. Bill Dorris left the dog in the care of his friend, ...",https://www.youtube.com/watch?v=kOSSG9sg4CQ,2021-02-18T18:30:03Z,2021,2,18
3,UC16niRr50-MSBwiO3YDb3RA,BBC News,CVr1GdNdMX8,Australia vs Facebook and Google - what&#39;s the row about? - BBC News,"People have been responding to Facebook blocking its users in Australia from sharing news, in response to a proposed law ...",https://www.youtube.com/watch?v=CVr1GdNdMX8,2021-02-18T16:19:40Z,2021,2,18
4,UC16niRr50-MSBwiO3YDb3RA,BBC News,71aiidHKVhk,Robinhood CEO to testify before Congress - BBC News,The Robinhood app has made investing on your phone as easy as playing a game. Now US lawmakers want to grill the app's ...,https://www.youtube.com/watch?v=71aiidHKVhk,2021-02-18T13:03:55Z,2021,2,18
5,UC16niRr50-MSBwiO3YDb3RA,BBC News,fQGBGzBh7ck,How Afghanistan police train for Taliban attacks and suicide bombers - BBC News,The future of Nato's 10000 troops in Afghanistan is high on the agenda of this week's remote meeting of the alliance's defence ...,https://www.youtube.com/watch?v=fQGBGzBh7ck,2021-02-18T09:55:58Z,2021,2,18
6,UC16niRr50-MSBwiO3YDb3RA,BBC News,NyLpyCl4xE8,Labour Party: Keir Starmer sets out his long-term vision for the economy - BBC Newsnight,"A year on from Sir Keir Starmer's leadership victory, what is the Labour Party's new policy vision for the economy? Please ...",https://www.youtube.com/watch?v=NyLpyCl4xE8,2021-02-18T00:26:26Z,2021,2,18
