,channelId,channelTitle,videoId,vidoeTitle,description,link,time,year,month,day
0,UC16niRr50-MSBwiO3YDb3RA,BBC News,HTAMZI0CVss,Coronavirus: Should we be vaccinating children? - BBC Newsnight,What are the ethics behind the science of vaccinating children? Please subscribe HERE http://bit.ly/1rbfUog Israel's Prime Minister ...,https://www.youtube.com/watch?v=HTAMZI0CVss,2021-04-21T23:09:06Z,2021,4,21
1,UC16niRr50-MSBwiO3YDb3RA,BBC News,4jL0CG68554,Putin warns West of “rapid and harsh” response from Russia if it crosses “red lines” - BBC News,"President Putin has warned countries in the West not to cross what he called a “red line” with Russia, stating that it would trigger ...",https://www.youtube.com/watch?v=4jL0CG68554,2021-04-21T21:28:29Z,2021,4,21
2,UC16niRr50-MSBwiO3YDb3RA,BBC News,EbM7jdyAms8,George Floyd murder: President Biden announces investigation of Minneapolis policing - BBC News,Within hours of the conviction of a former US police officer for the murder of an African-American man a full federal investigation ...,https://www.youtube.com/watch?v=EbM7jdyAms8,2021-04-21T21:16:17Z,2021,4,21
3,UC16niRr50-MSBwiO3YDb3RA,BBC News,7_Dyxx0Dxno,India&#39;s second Covid wave  - BBC News,"Warning: this report contains distressing scenes from the start. India is being ravaged by a second wave of the Covid-19, which is ...",https://www.youtube.com/watch?v=7_Dyxx0Dxno,2021-04-21T18:16:59Z,2021,4,21
4,UC16niRr50-MSBwiO3YDb3RA,BBC News,zYvi7Rf2YNo,European Super League &#39;cannot now proceed&#39; - BBC News,"One of the architects of the breakaway European Super League (ESL), the chairman of Juventus Andrea Agnelli, has admitted the ...",https://www.youtube.com/watch?v=zYvi7Rf2YNo,2021-04-21T15:06:46Z,2021,4,21
5,UC16niRr50-MSBwiO3YDb3RA,BBC News,fmdxL_ZCeig,Chauvin guilty verdict: &#39;Finally we can breathe&#39; - BBC News,"At a hair salon in Minneapolis, the guilty verdict against Derek Chauvin was greeted with relief and tears. ""We can start the healing ...",https://www.youtube.com/watch?v=fmdxL_ZCeig,2021-04-21T14:16:20Z,2021,4,21
6,UC16niRr50-MSBwiO3YDb3RA,BBC News,vbQIH_sK_zg,"Chauvin conviction over George Floyd&#39;s death giant step forward, says Biden - BBC News","US President Joe Biden has said the conviction of a former police officer in the killing of George Floyd ""can be a giant step forward ...",https://www.youtube.com/watch?v=vbQIH_sK_zg,2021-04-21T12:46:40Z,2021,4,21
7,UC16niRr50-MSBwiO3YDb3RA,BBC News,_C8wbYRuq1Q,New Australia-New Zealand travel bubble reunites many families - BBC News,Emotional families reunited as quarantine-free travel between Australia and New Zealand began. Travellers from Sydney heading ...,https://www.youtube.com/watch?v=_C8wbYRuq1Q,2021-04-21T09:30:02Z,2021,4,21
8,UC16niRr50-MSBwiO3YDb3RA,BBC News,mxwW5gmSFJg,Surfer&#39;s &#39;shock&#39; reunion with long-lost board - BBC News,"After losing his favourite surfboard four years ago, Australian Danny Griffiths was shocked to find it had been discovered some ...",https://www.youtube.com/watch?v=mxwW5gmSFJg,2021-04-21T08:15:56Z,2021,4,21
