,channelId,channelTitle,videoId,vidoeTitle,description,link,time,year,month,day
0,UC16niRr50-MSBwiO3YDb3RA,BBC News,t28nnviKar4,New evidence of Uighur forced labour in China’s cotton industry - BBC News,"Hundreds of thousands of people from ethnic minorities, including the Uighur community, are being forced by the Chinese ...",https://www.youtube.com/watch?v=t28nnviKar4,2020-12-14T22:48:46Z,2020,12,14
1,UC16niRr50-MSBwiO3YDb3RA,BBC News,VcPZ-Ex5mIU,Millions more enter Tier 3 in England as mutant Covid strain emerges  - BBC News,"Millions more people in England will be living in the highest Tier 3 areas of coronavirus restrictions, following a sharp new rise in ...",https://www.youtube.com/watch?v=VcPZ-Ex5mIU,2020-12-14T22:31:05Z,2020,12,14
2,UC16niRr50-MSBwiO3YDb3RA,BBC News,0mPja8g7axY,Australia storms: Dog rescued from sea of foam - BBC News,"A woman in Byron Bay had to rescue her dog, who was lost under a sea of foam, as wild weather batters Australia's east coast.",https://www.youtube.com/watch?v=0mPja8g7axY,2020-12-14T17:15:00Z,2020,12,14
3,UC16niRr50-MSBwiO3YDb3RA,BBC News,VuBPWbMSKf0,US election 2020: What is the electoral college? - BBC News,"Voters in the US have already made their choice, but it's members of the electoral college who meet today to pick the next ...",https://www.youtube.com/watch?v=VuBPWbMSKf0,2020-12-14T13:48:55Z,2020,12,14
4,UC16niRr50-MSBwiO3YDb3RA,BBC News,-eDPC7CYVks,US election: Can you explain the electoral college in 10 seconds? - BBC News,One of the least understood parts of the US democratic process is happening on Monday - the electoral college is formally voting ...,https://www.youtube.com/watch?v=-eDPC7CYVks,2020-12-14T12:45:21Z,2020,12,14
5,UC16niRr50-MSBwiO3YDb3RA,BBC News,opAOcl0Vpb4,Geminid meteor shower dazzles night skies - BBC News,The Geminid meteor shower happens every year in December when the Earth passes through the debris of an asteroid.,https://www.youtube.com/watch?v=opAOcl0Vpb4,2020-12-14T10:59:38Z,2020,12,14
6,UC16niRr50-MSBwiO3YDb3RA,BBC News,MSjqi2Zw9JY,Covid vaccine: How does a vaccine get approved? - BBC News,The NHS is carrying out the biggest mass vaccination campaign in its history with a jab that protects against Covid-19.,https://www.youtube.com/watch?v=MSjqi2Zw9JY,2020-12-14T10:50:25Z,2020,12,14
