,channelId,channelTitle,videoId,vidoeTitle,description,link,time,year,month,day
0,UC16niRr50-MSBwiO3YDb3RA,BBC News,F5L-7p3v4GI,Coronavirus: outbreak &quot;not yet at peak&quot; and lockdown may last another month - BBC News,The government has said the UK is still not past the peak of the coronavirus outbreak and the number of deaths will rise in the coming days. It says the lockdown ...,https://www.youtube.com/watch?v=F5L-7p3v4GI,2020-04-13T21:43:34Z,2020,4,13
1,UC16niRr50-MSBwiO3YDb3RA,BBC News,H-4vGjHuV-I,Coronavirus: Pope Francis delivers mass behind closed doors - BBC News,Pope Francis has celebrated Easter Sunday with a mass held behind closed doors at a deserted St Peter's Basilica in the Vatican. He called for global solidarity ...,https://www.youtube.com/watch?v=H-4vGjHuV-I,2020-04-13T19:37:15Z,2020,4,13
2,UC16niRr50-MSBwiO3YDb3RA,BBC News,lYmxWub99vg,Coronavirus: Don&#39;t expect changes to UK lockdown this week - Raab - BBC News,"The government does not expect to make changes to coronavirus lockdown restrictions this week, Dominic Raab has said. The foreign secretary said the UK's ...",https://www.youtube.com/watch?v=lYmxWub99vg,2020-04-13T18:37:37Z,2020,4,13
3,UC16niRr50-MSBwiO3YDb3RA,BBC News,4XgHmQ7d_M8,Coronavirus: Ecuador struggles to bury its victims - BBC News,"Warning: Contains some upsetting scenes. A week after images of bodies on the streets of Ecuador hit the headlines, many families are still waiting to bury their ...",https://www.youtube.com/watch?v=4XgHmQ7d_M8,2020-04-13T16:45:31Z,2020,4,13
4,UC16niRr50-MSBwiO3YDb3RA,BBC News,jrWYQDJEO3Q,Coronavirus: Spain begins to ease lockdown to revive economy - BBC News,"Spain, one of the countries worst hit by the coronavirus, is beginning to ease strict lockdown measures that have brought its economy to a standstill. People in ...",https://www.youtube.com/watch?v=jrWYQDJEO3Q,2020-04-13T16:19:03Z,2020,4,13
5,UC16niRr50-MSBwiO3YDb3RA,BBC News,fKD92U6-JkA,Coronavirus: Thirteen die at Stanley care home - BBC News,Thirteen residents of a County Durham care home have now died after displaying symptoms of coronavirus. Managers at Stanley Park care home in Stanley said ...,https://www.youtube.com/watch?v=fKD92U6-JkA,2020-04-13T15:49:00Z,2020,4,13
6,UC16niRr50-MSBwiO3YDb3RA,BBC News,JmYaUPlsIH8,Coronavirus: Italian tenor Bocelli sings at Milan&#39;s empty cathedral - BBC News,Italian tenor Andrea Bocelli performed an online concert at Milan's empty cathedral with a message of hope to those in lockdown around the globe because of ...,https://www.youtube.com/watch?v=JmYaUPlsIH8,2020-04-13T13:42:23Z,2020,4,13
