,channelId,channelTitle,videoId,vidoeTitle,description,link,time,year,month,day
0,UC16niRr50-MSBwiO3YDb3RA,BBC News,jc6s8mogmds,Cummings: What happened and what impact will it have? - BBC Newsnight,Contains some strong language * Boris Johnson's former chief adviser Dominic Cummings has made a series of explosive claims ...,https://www.youtube.com/watch?v=jc6s8mogmds,2021-05-26T23:23:17Z,2021,5,26
1,UC16niRr50-MSBwiO3YDb3RA,BBC News,qU5UD5LLy08,Belarus President Lukashenko defends forcing passenger plane to land to arrest journalist - BBC News,"The president of Belarus, Alexander Lukashenko, has defended his decision to force a Ryanair plane to land in Minsk in order to ...",https://www.youtube.com/watch?v=qU5UD5LLy08,2021-05-26T21:49:08Z,2021,5,26
2,UC16niRr50-MSBwiO3YDb3RA,BBC News,RHMm_rNx0oM,Severe cyclone makes landfall on India coast - BBC News,Cyclone Yaas has started making landfall on India's east coast. Winds of 140km/h (87mph) gusting to 155km/h (96mph) and ...,https://www.youtube.com/watch?v=RHMm_rNx0oM,2021-05-26T15:31:28Z,2021,5,26
3,UC16niRr50-MSBwiO3YDb3RA,BBC News,fhRPjCO1ysw,Belarusian President defends decision to divert Ryanair flight- BBC News,"Belarusian President Alexander Lukashenko spoke publicly on Wednesday to defend his actions, insisting that the bomb threat ...",https://www.youtube.com/watch?v=fhRPjCO1ysw,2021-05-26T15:29:01Z,2021,5,26
4,UC16niRr50-MSBwiO3YDb3RA,BBC News,zyKu7DxzcR4,Whatsapp sues Indian government over privacy rules - BBC News,WhatsApp is suing the Indian government over new digital rules that will force the messaging service to violate privacy protections ...,https://www.youtube.com/watch?v=zyKu7DxzcR4,2021-05-26T14:21:39Z,2021,5,26
5,UC16niRr50-MSBwiO3YDb3RA,BBC News,joCUKnooWyo,Why China is crushing Hong Kong dissent - BBC News,"Hong Kong was rocked by mass violent anti-government protests in 2019 Now, the city is transformed - and not in the way ...",https://www.youtube.com/watch?v=joCUKnooWyo,2021-05-26T09:47:53Z,2021,5,26
