,channelId,channelTitle,videoId,vidoeTitle,description,link,time,year,month,day
0,UC16niRr50-MSBwiO3YDb3RA,BBC News,FtB5FZLbAjo,Trump thanks supporters in Twitter video - BBC News,"Donald Trump, who has now arrived at hospital, has posted a video on Twitter thanking people for their ""tremendous support"".",https://www.youtube.com/watch?v=FtB5FZLbAjo,2020-10-02T23:01:37Z,2020,10,2
1,UC16niRr50-MSBwiO3YDb3RA,BBC News,ovXN5H-rLtY,750 students in Northumbria test positive in biggest university coronavirus outbreak - BBC News,"More than 750 students have tested positive for the coronavirus, at Northumbria University in Newcastle. Almost all of them have ...",https://www.youtube.com/watch?v=ovXN5H-rLtY,2020-10-02T21:45:31Z,2020,10,2
2,UC16niRr50-MSBwiO3YDb3RA,BBC News,r7c_FoTgu1g,Donald Trump flown to hospital from White House with coronavirus infection  - BBC News,"Donald Trump has been taken to a military medical centre near Washington from the White House, after testing positive for ...",https://www.youtube.com/watch?v=r7c_FoTgu1g,2020-10-02T21:37:17Z,2020,10,2
3,UC16niRr50-MSBwiO3YDb3RA,BBC News,5YWqQmVQE7o,Trump coronavirus sickness throws White House race into turmoil - BBC News,"The race for the White House has been thrown into turmoil, after the revelation that Donald Trump and his wife Melania, have both ...",https://www.youtube.com/watch?v=5YWqQmVQE7o,2020-10-02T21:36:07Z,2020,10,2
4,UC16niRr50-MSBwiO3YDb3RA,BBC News,XyRERDUcUkE,Trump experiencing &#39;mild symptoms&#39; - BBC News,US President Donald Trump has said he and First Lady Melania Trump have tested positive for coronavirus and are now ...,https://www.youtube.com/watch?v=XyRERDUcUkE,2020-10-02T15:00:56Z,2020,10,2
5,UC16niRr50-MSBwiO3YDb3RA,BBC News,bZVzfBPRFOI,US president and Melania Trump tested after his close aide was confirmed to have Covid-19 - BBC News,US President Donald Trump has said he and First Lady Melania Trump have tested positive for coronavirus and are now ...,https://www.youtube.com/watch?v=bZVzfBPRFOI,2020-10-02T09:26:47Z,2020,10,2
6,UC16niRr50-MSBwiO3YDb3RA,BBC News,UlJNaxJoBWU,Balrampur: Anger grows after new India &#39;gang rape&#39; death - BBC News,The death of a second Dalit woman in a few days after an alleged gang rape has shocked and angered India. The 22-year-old ...,https://www.youtube.com/watch?v=UlJNaxJoBWU,2020-10-02T09:03:45Z,2020,10,2
7,UC16niRr50-MSBwiO3YDb3RA,BBC News,lRpockDWU-M,Covid: Donald Trump and Melania test positive - BBC News,US President Donald Trump has said he and First Lady Melania Trump have tested positive for coronavirus and are now ...,https://www.youtube.com/watch?v=lRpockDWU-M,2020-10-02T08:48:52Z,2020,10,2
8,UC16niRr50-MSBwiO3YDb3RA,BBC News,F1KWeBypwvw,Avoiding war in the Armenia-Azerbaijan conflict - BBC News,"Despite calls for a ceasefire from the US, Russia and France - fighting between Armenia and Azerbaijan over the disputed region ...",https://www.youtube.com/watch?v=F1KWeBypwvw,2020-10-02T08:39:05Z,2020,10,2
