,channelId,channelTitle,videoId,vidoeTitle,description,link,time,year,month,day
0,UC16niRr50-MSBwiO3YDb3RA,BBC News,iuABFgkhZCU,Care workers not entitled to minimum wage while they sleep on shift says Supreme Court - BBC News,The supreme court has ruled that care workers across the UK who have to sleep at their workplace in case they are needed are ...,https://www.youtube.com/watch?v=iuABFgkhZCU,2021-03-19T22:33:55Z,2021,3,19
1,UC16niRr50-MSBwiO3YDb3RA,BBC News,KK0bpJ_gPN8,Europe braces for third wave of Covid as cases surge - BBC News,Continental Europe is preparing for a third wave of coronavirus amid a surge in new cases and a shortage of vaccines that can ...,https://www.youtube.com/watch?v=KK0bpJ_gPN8,2021-03-19T22:14:20Z,2021,3,19
2,UC16niRr50-MSBwiO3YDb3RA,BBC News,gg2w0AJzUG4,Football&#39;s child sex abuse scandal: Review finds &#39;institutional failings&#39; - BBC News,"""Significant institutional failings"" by the Football Association meant it ""did not do enough to keep children safe"" - according to the ...",https://www.youtube.com/watch?v=gg2w0AJzUG4,2021-03-19T20:55:53Z,2021,3,19
3,UC16niRr50-MSBwiO3YDb3RA,BBC News,qKfOA0_ds50,Gay rights in South Korea&#39;s military highlighted - BBC News,"In South Korea, gay soldiers can serve, but they can be punished for consensual sex. This law is currently under review by the ...",https://www.youtube.com/watch?v=qKfOA0_ds50,2021-03-19T19:54:06Z,2021,3,19
4,UC16niRr50-MSBwiO3YDb3RA,BBC News,TgBxVl2UYSg,Sharing power with the Taliban? Former Afghanistan President Hamid Karzai interview - BBC News,The former President of Afghanistan Hamid Karzai has told the BBC he welcomes US proposals for the creation of a new ...,https://www.youtube.com/watch?v=TgBxVl2UYSg,2021-03-19T15:30:04Z,2021,3,19
