,channelId,channelTitle,videoId,vidoeTitle,description,link,time,year,month,day
0,UC16niRr50-MSBwiO3YDb3RA,BBC News,o0A3aI6HyTE,Boris Johnson heads for Brussels after “No Deal” warning - BBC News,Boris Johnson is travelling to Brussels for a meeting over dinner with the EU Commission President in an attempt to unblock talks ...,https://www.youtube.com/watch?v=o0A3aI6HyTE,2020-12-08T22:38:39Z,2020,12,8
1,UC16niRr50-MSBwiO3YDb3RA,BBC News,F8Mcu581XsY,Historic moment as woman aged 90 gets first clinically-approved Covid vaccine - BBC News,90-year-old Margaret Keenan has become the first person in the UK to receive the Pfizer vaccination. It meant the UK became the ...,https://www.youtube.com/watch?v=F8Mcu581XsY,2020-12-08T22:29:49Z,2020,12,8
2,UC16niRr50-MSBwiO3YDb3RA,BBC News,wLQJ_Tj2rAw,"&#39;Grow up, mask up&#39;: Covid tensions in US hotspot of North Dakota - BBC News","North Dakota is the US state with the highest rate of Covid cases per capita since the pandemic began, according to data from ...",https://www.youtube.com/watch?v=wLQJ_Tj2rAw,2020-12-08T18:00:25Z,2020,12,8
3,UC16niRr50-MSBwiO3YDb3RA,BBC News,6dU_I0zYeBQ,"Oxford/AstraZeneca Covid vaccine &#39;safe and effective&#39;, study shows - BBC News","The Oxford/AstraZeneca Covid vaccine is safe and effective, giving good protection, researchers have confirmed. Most in the ...",https://www.youtube.com/watch?v=6dU_I0zYeBQ,2020-12-08T16:27:48Z,2020,12,8
4,UC16niRr50-MSBwiO3YDb3RA,BBC News,cuZS190c7mg,The farmers hunting down swarms of locusts - BBC News,"Locusts have been ravaging East Africa all year and now, they are in Southern Africa. The region is dealing with its biggest locust ...",https://www.youtube.com/watch?v=cuZS190c7mg,2020-12-08T14:30:07Z,2020,12,8
5,UC16niRr50-MSBwiO3YDb3RA,BBC News,mP3bgW-dS40,&#39;Odd radio circles&#39; in the sky a ‘genuine mystery’ - BBC News,"A new high-powered telescope in the Australian outback has led astronomers to an intriguing new discovery. ""Odd radio circles"" ...",https://www.youtube.com/watch?v=mP3bgW-dS40,2020-12-08T13:00:12Z,2020,12,8
6,UC16niRr50-MSBwiO3YDb3RA,BBC News,jKR_cz_ugQU,"Christchurch massacre &#39;unpreventable&#39;, says inquiry - BBC News","An inquiry into the Christchurch massacre has found a series of failures ahead of the 2019 attack, but concluded the tragedy was ...",https://www.youtube.com/watch?v=jKR_cz_ugQU,2020-12-08T11:00:12Z,2020,12,8
7,UC16niRr50-MSBwiO3YDb3RA,BBC News,U9IZfFHQ7oY,"Woman, 90, first to receive Covid vaccine in UK rollout - BBC News",A 90-year-old woman has become the first person to be given a Covid jab as part of the mass vaccination programme being rolled ...,https://www.youtube.com/watch?v=U9IZfFHQ7oY,2020-12-08T08:51:59Z,2020,12,8
8,UC16niRr50-MSBwiO3YDb3RA,BBC News,UUQocpJqfaI,Can Boris Johnson salvage a post-Brexit trade deal? - BBC Newsnight,Boris Johnson will head to Brussels after a call with Ursula von der Leyen fails to break the deadlock on a post-Brexit trade deal.,https://www.youtube.com/watch?v=UUQocpJqfaI,2020-12-08T00:30:44Z,2020,12,8
