,channelId,channelTitle,videoId,vidoeTitle,description,link,time,year,month,day
0,UC16niRr50-MSBwiO3YDb3RA,BBC News,0SZtJkMrwy8,Puberty blocking drugs - children “unlikely to be able to give informed consent” - BBC News,The High Court in England has ruled that children under 16 - who say they want to change gender - are unlikely to be able to give ...,https://www.youtube.com/watch?v=0SZtJkMrwy8,2020-12-01T22:36:33Z,2020,12,1
1,UC16niRr50-MSBwiO3YDb3RA,BBC News,KPf3msZLZdM,"Debenhams set to close with 12,000 job losses - BBC News","Debenhams, one of the biggest names on the high street, is set to close with 12000 staff expected to lose their jobs. It's the second ...",https://www.youtube.com/watch?v=KPf3msZLZdM,2020-12-01T22:19:08Z,2020,12,1
2,UC16niRr50-MSBwiO3YDb3RA,BBC News,EI-wz9IGfcw,Eritrea refugees in Ethiopia ‘run out of food’ - BBC News,"Thousands of Eritrean refugees in Ethiopia's conflict-hit northern region of Tigray have run out of food, the UN's refugee agency, ...",https://www.youtube.com/watch?v=EI-wz9IGfcw,2020-12-01T18:00:02Z,2020,12,1
3,UC16niRr50-MSBwiO3YDb3RA,BBC News,9ygEY6S3Yyc,UN climate change goal now &#39;within reach&#39; - BBC News,"The goals of the UN Paris climate agreement are getting ""within reach"", new analysis suggests. The Climate Action Tracker group ...",https://www.youtube.com/watch?v=9ygEY6S3Yyc,2020-12-01T16:30:00Z,2020,12,1
4,UC16niRr50-MSBwiO3YDb3RA,BBC News,MXn2lnJx6Ms,Fears vaccine misinformation could affect take-up - BBC News,"With a number of potential vaccines for Covid-19 now imminent, there are increasing concerns that misinformation online could ...",https://www.youtube.com/watch?v=MXn2lnJx6Ms,2020-12-01T15:00:06Z,2020,12,1
5,UC16niRr50-MSBwiO3YDb3RA,BBC News,Tgdog3Slfds,&#39;This is War&#39;: Poland’s battle for abortion - BBC News,Huge protests have erupted in Poland as the government attempts to ban nearly all abortions. We spent a night on the streets with ...,https://www.youtube.com/watch?v=Tgdog3Slfds,2020-12-01T13:30:02Z,2020,12,1
6,UC16niRr50-MSBwiO3YDb3RA,BBC News,-qeMgSVViHc,The story of Britain&#39;s Black Power movement - BBC News,"In the 1960s, Farrukh Dhondy and Leila Hassan Howe became activists in Britain's Black Power movement. With racial tensions ...",https://www.youtube.com/watch?v=-qeMgSVViHc,2020-12-01T12:00:00Z,2020,12,1
7,UC16niRr50-MSBwiO3YDb3RA,BBC News,Z4EJp5tdY00,Coronavirus: What will it take to convince the UK to get vaccinated? - BBC Newsnight,What are the logistical challenges of vaccinating huge swathes of the population and how do you persuade those who are ...,https://www.youtube.com/watch?v=Z4EJp5tdY00,2020-12-01T00:21:21Z,2020,12,1
