,channelId,channelTitle,videoId,vidoeTitle,description,link,time,year,month,day
0,UC16niRr50-MSBwiO3YDb3RA,BBC News,DfFyBT5tpqw,Coronavirus warning: up to 6 months before UK returns to normal - BBC News,The government's senior medical advisers are warning that it could take six months before stringent coronavirus restrictions are lifted. The Prime Minister Boris ...,https://www.youtube.com/watch?v=DfFyBT5tpqw,2020-03-29T23:12:33Z,2020,3,29
1,UC16niRr50-MSBwiO3YDb3RA,BBC News,0Yo1v6UMac8,Coronavirus: Up to 6 months before life &#39;returns to normal&#39; says government - BBC News,"It could be up to six months before life in the UK returns to ""normal"", England's deputy chief medical officer has said. Speaking at the government's daily ...",https://www.youtube.com/watch?v=0Yo1v6UMac8,2020-03-29T18:35:51Z,2020,3,29
2,UC16niRr50-MSBwiO3YDb3RA,BBC News,9xemFKlw1Tg,"Coronavirus: Italy deaths climb above 10,000 - BBC News",Italy recorded 756 new deaths in the past 24 hours - bringing the total to 10779. Please subscribe HERE http://bit.ly/1rbfUog Italy recorded a further 756 new ...,https://www.youtube.com/watch?v=9xemFKlw1Tg,2020-03-29T16:33:46Z,2020,3,29
3,UC16niRr50-MSBwiO3YDb3RA,BBC News,wdrlWpihxeg,Raving to the BBC News theme tune - BBC News,"Have you seen the kitchen 'remix' of the BBC News theme tune yet? We got together its creator, Rachel Leary, whose video has been viewed millions of times ...",https://www.youtube.com/watch?v=wdrlWpihxeg,2020-03-29T12:36:06Z,2020,3,29
4,UC16niRr50-MSBwiO3YDb3RA,BBC News,wPM58DQH0gQ,Coronavirus social distancing advice: What two metres looks like - BBC News,"The UK government is advising people stay home and only go out if they need to fetch food or medicine, to go to work if it's essential or to exercise. Even when ...",https://www.youtube.com/watch?v=wPM58DQH0gQ,2020-03-29T11:46:55Z,2020,3,29
