,channelId,channelTitle,videoId,vidoeTitle,description,link,time,year,month,day
0,UC16niRr50-MSBwiO3YDb3RA,BBC News,LcvmtZTZi6c,Coronavirus: UK government unveils aid for self-employed - BBC News,"Self-employed workers will be able to apply for a grant of up to £2500 a month to help them cope with the financial impact of coronavirus, the chancellor has ...",https://www.youtube.com/watch?v=LcvmtZTZi6c,2020-03-26T18:44:12Z,2020,3,26
1,UC16niRr50-MSBwiO3YDb3RA,BBC News,VrDVU9l5XhM,Viral dad on the trials of working from home - BBC News,Families across the world are having to spend more time at home to try to contain the spread of coronavirus. The BBC spoke to Professor Robert Kelly and his ...,https://www.youtube.com/watch?v=VrDVU9l5XhM,2020-03-26T13:41:37Z,2020,3,26
2,UC16niRr50-MSBwiO3YDb3RA,BBC News,UIJ6Gefld_A,Coronavirus: A quarter of the world’s population in lockdown - BBC News,Prime Minister Narendra Modi has told India's population of 1.3 billion people to stay at home. The lockdown is currently planned for 3 weeks. More than 2.6 ...,https://www.youtube.com/watch?v=UIJ6Gefld_A,2020-03-26T11:52:06Z,2020,3,26
3,UC16niRr50-MSBwiO3YDb3RA,BBC News,O8M7QAl1sFA,Coronavirus delays Russian vote on Putin staying in power - BBC News,"Russian President Vladimir Putin has postponed a vote on constitutional change that would allow him to stay in power, because of coronavirus concerns.",https://www.youtube.com/watch?v=O8M7QAl1sFA,2020-03-26T11:40:54Z,2020,3,26
4,UC16niRr50-MSBwiO3YDb3RA,BBC News,pXopk-mrLH8,How staying at home can stop coronavirus - BBC News,Governments around the world are encouraging people to stay at home to protect health services and save lives. Among the new measures being brought in the ...,https://www.youtube.com/watch?v=pXopk-mrLH8,2020-03-26T11:33:53Z,2020,3,26
