,channelId,channelTitle,videoId,vidoeTitle,description,link,time,year,month,day
0,UC16niRr50-MSBwiO3YDb3RA,BBC News,OAijpT8naZk,Coronavirus: UK government says 1 in 5 workers could be off –BBC News,The UK government has unveiled detailed plans for what measures it would take in the event of a widespread outbreak of Coronavirus. It considers a scenario in ...,https://www.youtube.com/watch?v=OAijpT8naZk,2020-03-03T22:59:11Z,2020,3,3
1,UC16niRr50-MSBwiO3YDb3RA,BBC News,VeF6LwcR6RY,China economy: Why it matters to you - BBC News,"China is one of the world's biggest economies. It makes all sorts of products and sells them all over the world, from iPhones to air conditioners, and many ...",https://www.youtube.com/watch?v=VeF6LwcR6RY,2020-03-03T13:46:46Z,2020,3,3
2,UC16niRr50-MSBwiO3YDb3RA,BBC News,E-l4lYpHatY,Delhi riots: &#39;My brother died after police beating’ - BBC News,Naeem says his brother Faizan died after he was beaten by police during religious rioting in Delhi last week. Video of the incident has gone viral. More than 40 ...,https://www.youtube.com/watch?v=E-l4lYpHatY,2020-03-03T11:27:34Z,2020,3,3
3,UC16niRr50-MSBwiO3YDb3RA,BBC News,fnrpUGOxTaw,Coronavirus: World in &#39;uncharted territory&#39; - BBC News,There are a total of 90936 confirmed cases worldwide - although more than half of those (47995) have already recovered. The biggest numbers are still by far in ...,https://www.youtube.com/watch?v=fnrpUGOxTaw,2020-03-03T07:15:19Z,2020,3,3
4,UC16niRr50-MSBwiO3YDb3RA,BBC News,wHIvRysWRWY,Coronavirus: How is Iran responding to the outbreak? - BBC News,"Image copyrightAFP/GETTY IMAGES Iran has been scrambling to control the outbreak of the coronavirus this week, but the spread of online misinformation is ...",https://www.youtube.com/watch?v=wHIvRysWRWY,2020-03-03T06:48:19Z,2020,3,3
