,channelId,channelTitle,videoId,vidoeTitle,description,link,time,year,month,day
0,UC16niRr50-MSBwiO3YDb3RA,BBC News,9gb6KJYFJiw,Coronavirus: &#39;You must stay at home&#39; UK public told - BBC News,Strict new curbs on life in the UK to tackle the spread of coronavirus have been announced by the British Prime Minister. People must now stay at home except ...,https://www.youtube.com/watch?v=9gb6KJYFJiw,2020-03-23T23:01:39Z,2020,3,23
1,UC16niRr50-MSBwiO3YDb3RA,BBC News,HlEFrbLeDks,Coronavirus: PM announcing strict new curbs on life in UK - BBC News,The prime minister is announcing strict new curbs on life in the UK to tackle the spread of coronavirus. From this evening people must stay at home except for ...,https://www.youtube.com/watch?v=HlEFrbLeDks,2020-03-23T20:48:03Z,2020,3,23
2,UC16niRr50-MSBwiO3YDb3RA,BBC News,2F3KHb_1bkw,Coronavirus: More myths to ignore - BBC News,Holding your breath and drinking cow urine? Reality Check's Chris Morris busts more health myths about Covid-19 being shared online. Please subscribe ...,https://www.youtube.com/watch?v=2F3KHb_1bkw,2020-03-23T16:53:11Z,2020,3,23
3,UC16niRr50-MSBwiO3YDb3RA,BBC News,L1DqkGQ-aXw,Coronavirus: India observes 14-hour curfew - BBC News,More than a billion people in India have been asked to stay indoors for 14-hours to try to combat the coronavirus pandemic. When he announced the curfew last ...,https://www.youtube.com/watch?v=L1DqkGQ-aXw,2020-03-23T12:16:12Z,2020,3,23
4,UC16niRr50-MSBwiO3YDb3RA,BBC News,wXsV5XiBIxY,Coronavirus: Pressure grows on Japan and IOC to cancel Olympics - BBC News,"Canada and Australia say they will not send teams to the 2020 Olympic and Paralympic Games Earlier, Japanese PM Shinzo Abe said an Olympic ...",https://www.youtube.com/watch?v=wXsV5XiBIxY,2020-03-23T11:34:07Z,2020,3,23
