,channelId,channelTitle,videoId,vidoeTitle,description,link,time,year,month,day
0,UC16niRr50-MSBwiO3YDb3RA,BBC News,Tey05_Z8_uw,Months after Beirut’s devastating blast - still no answers - BBC News,"It is four months since a devastating explosion tore through the centre of the Lebanese capital Beirut, killing around 200 people ...",https://www.youtube.com/watch?v=Tey05_Z8_uw,2020-12-04T22:34:19Z,2020,12,4
1,UC16niRr50-MSBwiO3YDb3RA,BBC News,3R1ghAEsr8Y,Brexit trade talks paused - with less than a month to final deadline - BBC News,Talks on a post-Brexit trade deal have been paused without an agreement - less than a month before the transition period comes ...,https://www.youtube.com/watch?v=3R1ghAEsr8Y,2020-12-04T22:13:34Z,2020,12,4
2,UC16niRr50-MSBwiO3YDb3RA,BBC News,QzuxUR5X1m4,Plane makes emergency landing on US highway - BBC News,"This is the moment a light aircraft was forced to make an emergency landing on an interstate in Minnesota, US.",https://www.youtube.com/watch?v=QzuxUR5X1m4,2020-12-04T17:30:04Z,2020,12,4
3,UC16niRr50-MSBwiO3YDb3RA,BBC News,q4qUpOjGwg4,Biden to ask Americans to wear masks for 100 days - BBC News,US President-elect Joe Biden has said he will ask Americans to wear masks for his first 100 days in office to curtail the spread of ...,https://www.youtube.com/watch?v=q4qUpOjGwg4,2020-12-04T16:00:13Z,2020,12,4
4,UC16niRr50-MSBwiO3YDb3RA,BBC News,yalMXY0Qn7Y,Is Putin’s power ebbing away in Russia’s own back yard? - BBC News,"For Russian President Vladimir Putin, it's not just the coronavirus pandemic that is making 2020 a difficult year. In recent months ...",https://www.youtube.com/watch?v=yalMXY0Qn7Y,2020-12-04T14:30:03Z,2020,12,4
5,UC16niRr50-MSBwiO3YDb3RA,BBC News,EYh8sPP_SBk,China’s Covid recovery: Hopes and fears over what comes next - BBC News,"A year on from the first coronavirus case, China's restrictions on daily life have lessened significantly. But some in the country think ...",https://www.youtube.com/watch?v=EYh8sPP_SBk,2020-12-04T13:00:04Z,2020,12,4
6,UC16niRr50-MSBwiO3YDb3RA,BBC News,bXtL5b4TkUQ,Will a Covid vaccine be mandatory? - BBC News,"With a coronavirus vaccine approved in the UK, and other countries expected to follow, many are asking when they will be ...",https://www.youtube.com/watch?v=bXtL5b4TkUQ,2020-12-04T11:30:03Z,2020,12,4
7,UC16niRr50-MSBwiO3YDb3RA,BBC News,arRDFs2nezY,Why are young activists in Thailand protesting against the monarchy? - BBC Newsnight,"A student-led protest movement in Thailand is demanding reform of the monarchy — in a country where it's illegal to defame, ...",https://www.youtube.com/watch?v=arRDFs2nezY,2020-12-04T00:20:03Z,2020,12,4
