,channelId,channelTitle,videoId,vidoeTitle,description,link,time,year,month,day
0,UC16niRr50-MSBwiO3YDb3RA,BBC News,Sbc3BZCyb7k,UK warns “very large gaps” remain after Boris Johnson&#39;s Brexit talks in Brussels - BBC News,The UK has said that that “significant obstacles” to a post-Brexit trade deal remain with the EU — following emergency talks ...,https://www.youtube.com/watch?v=Sbc3BZCyb7k,2020-12-09T22:47:25Z,2020,12,9
1,UC16niRr50-MSBwiO3YDb3RA,BBC News,e1O_KStiyN4,Boris Johnson in last-ditch Brussels meeting with Brexit talks “close to failure” - BBC News,"Boris Johnson has been in Brussels setting out his conditions for a trade deal with the EU, during a dinner with the European ...",https://www.youtube.com/watch?v=e1O_KStiyN4,2020-12-09T22:30:57Z,2020,12,9
2,UC16niRr50-MSBwiO3YDb3RA,BBC News,171qMEvQBuU,Video captures world&#39;s biggest iceberg - BBC News,"The UK's Royal Air Force (RAF) has now released footage from its low-level reconnaissance flight over the giant iceberg, A68a.",https://www.youtube.com/watch?v=171qMEvQBuU,2020-12-09T19:00:00Z,2020,12,9
3,UC16niRr50-MSBwiO3YDb3RA,BBC News,UjIDN5JX-sY,India farmers protests: &#39;Delhi highways are our home for now&#39; - BBC News,"For nearly two weeks, farmers from across India have been protesting at the Delhi border against new market-friendly reforms that ...",https://www.youtube.com/watch?v=UjIDN5JX-sY,2020-12-09T17:07:12Z,2020,12,9
4,UC16niRr50-MSBwiO3YDb3RA,BBC News,MYKUqbHIfa0,What&#39;s it like moving back home (as an adult)? - BBC News,The coronavirus pandemic has led millions of young Americans to move back in with their parents. BBC reporter Zoe Thomas is ...,https://www.youtube.com/watch?v=MYKUqbHIfa0,2020-12-09T15:30:01Z,2020,12,9
5,UC16niRr50-MSBwiO3YDb3RA,BBC News,M4I5tV98beU,Biden vows 100m vaccinations for US in first 100 days - BBC News,US President-elect Joe Biden has set a goal of 100 million Covid vaccinations in his first 100 days in office. He said his first ...,https://www.youtube.com/watch?v=M4I5tV98beU,2020-12-09T14:00:17Z,2020,12,9
6,UC16niRr50-MSBwiO3YDb3RA,BBC News,JS6TeBw1j0M,Rich countries &#39;hoarding Covid vaccines&#39; - BBC News,"Rich countries are hoarding doses of Covid vaccines and people living in poor countries are set to miss out, a coalition of ...",https://www.youtube.com/watch?v=JS6TeBw1j0M,2020-12-09T13:00:06Z,2020,12,9
7,UC16niRr50-MSBwiO3YDb3RA,BBC News,qHRxHBcHX38,Why Australia&#39;s famous Byron Bay beach is disappearing - BBC News,Byron Bay on the New South Wales north coast is a surfing and tourism hotspot. But for the past six months its most popular ...,https://www.youtube.com/watch?v=qHRxHBcHX38,2020-12-09T11:32:02Z,2020,12,9
8,UC16niRr50-MSBwiO3YDb3RA,BBC News,ztZALv3XsN8,Covid vaccine: The facts and data explained - BBC Newsnight,As the world's first #Covid19 jab are administered - the fastest delivered vaccine in history - is the end of the pandemic really in ...,https://www.youtube.com/watch?v=ztZALv3XsN8,2020-12-09T00:16:45Z,2020,12,9
