,channelId,channelTitle,videoId,vidoeTitle,description,link,time,year,month,day
0,UC16niRr50-MSBwiO3YDb3RA,BBC News,8-TUHV5e5jg,“Credible evidence” that Australian soldiers unlawfully killed 39 people in Afghanistan  - BBC News,A long-awaited report says there is “credible evidence” that Australian elite soldiers unlawfully killed 39 people during the Afghan ...,https://www.youtube.com/watch?v=8-TUHV5e5jg,2020-11-19T22:50:59Z,2020,11,19
1,UC16niRr50-MSBwiO3YDb3RA,BBC News,-Ef1K5RvmcQ,Report on Priti Patel bullying claims says Home Secretary broke rules - BBC News,"A draft report into claims that the Home Secretary, Priti Patel, bullied staff concluded this summer that she had broken rules on ...",https://www.youtube.com/watch?v=-Ef1K5RvmcQ,2020-11-19T22:24:15Z,2020,11,19
2,UC16niRr50-MSBwiO3YDb3RA,BBC News,IoFJViiWUG0,Intubated Covid patient plays violin to thank Utah hospital staff - BBC News,"Music teacher Grover Wilhelmsen was in intensive care with Covid-19 for a month. Unable to speak as he was intubated, ...",https://www.youtube.com/watch?v=IoFJViiWUG0,2020-11-19T16:31:17Z,2020,11,19
3,UC16niRr50-MSBwiO3YDb3RA,BBC News,rZkHBCQADDY,Seven-time F1 World Champion Lewis Hamilton talks to BBC Breakfast - BBC News,Lewis Hamilton speaks to Sally Nugent in his first UK interview since getting his 7th F1 title. Please subscribe HERE ...,https://www.youtube.com/watch?v=rZkHBCQADDY,2020-11-19T15:23:16Z,2020,11,19
4,UC16niRr50-MSBwiO3YDb3RA,BBC News,9e8-uSyNIWs,Pompeo makes unprecedented visit to Israeli settlement in West Bank - BBC News,"Secretary of State Mike Pompeo is touring a Jewish settlement in the Israeli-occupied West Bank, marking the first such visit by a ...",https://www.youtube.com/watch?v=9e8-uSyNIWs,2020-11-19T14:06:26Z,2020,11,19
5,UC16niRr50-MSBwiO3YDb3RA,BBC News,K1Pw2zEALdo,US Elections 2020: The world&#39;s most expensive election - BBC News,The 2020 US election campaigns smashed all records - with presidential and congressional candidates spending a total of almost ...,https://www.youtube.com/watch?v=K1Pw2zEALdo,2020-11-19T11:54:40Z,2020,11,19
6,UC16niRr50-MSBwiO3YDb3RA,BBC News,lP9IT-NHTp4,Hondurans pray for protection from Hurricane Iota - BBC News,"A powerful hurricane has brought torrential rains and strong winds to Nicaragua's Caribbean coast, two weeks after another ...",https://www.youtube.com/watch?v=lP9IT-NHTp4,2020-11-19T10:36:19Z,2020,11,19
