,channelId,channelTitle,videoId,vidoeTitle,description,link,time,year,month,day
0,UC16niRr50-MSBwiO3YDb3RA,BBC News,EzZ_GwIRNHw,Coronavirus: it&#39;s social distancing for the pandas and chimps at Edinburgh Zoo - BBC News,"Like most attractions across the UK, zoos have had to close during the coronavirus pandemic. Edinburgh Zoo is under strict lockdown. And while the keepers are ...",https://www.youtube.com/watch?v=EzZ_GwIRNHw,2020-04-25T21:55:19Z,2020,4,25
1,UC16niRr50-MSBwiO3YDb3RA,BBC News,fVtzVF2G-Bk,Coronavirus: Boris Johnson returns to work as UK passes “tragic and terrible milestone” - BBC News,More than 20000 people have now died in hospital in the UK after becoming infected with coronavirus. The government described it as “a tragic and terrible ...,https://www.youtube.com/watch?v=fVtzVF2G-Bk,2020-04-25T21:27:06Z,2020,4,25
2,UC16niRr50-MSBwiO3YDb3RA,BBC News,xM_S7qaYDiU,Captain Tom tops the charts at the age of 99 - BBC News,Captain Tom Moore has become the oldest artist to reach the top spot of BBC Radio 1's The Official Chart. His rendition of You'll Never Walk Alone is the ...,https://www.youtube.com/watch?v=xM_S7qaYDiU,2020-04-25T15:53:55Z,2020,4,25
3,UC16niRr50-MSBwiO3YDb3RA,BBC News,PwMj72TsSBU,Colombia: Saving rare species in jungles once protected by war - BBC News,Deforestation has skyrocketed in Colombia since the peace deal of 2016. BBC Security correspondent Frank Gardner joins a team of scientists from the Royal ...,https://www.youtube.com/watch?v=PwMj72TsSBU,2020-04-25T14:20:42Z,2020,4,25
4,UC16niRr50-MSBwiO3YDb3RA,BBC News,h6xA_wawB6E,coronavirus:  Rohingya refugees stranded at Sea - BBC News,"The UN has issued an urgent appeal to save hundreds of stranded Rohingya refugees, including children, who have been adrift at sea for weeks/months.",https://www.youtube.com/watch?v=h6xA_wawB6E,2020-04-25T11:50:40Z,2020,4,25
