,channelId,channelTitle,videoId,vidoeTitle,description,link,time,year,month,day
0,UC16niRr50-MSBwiO3YDb3RA,BBC News,hbX1YtsiLmk,Coronavirus - record UK deaths approach levels seen in Italy and Spain - BBC News,"The UK has recorded its highest daily number of deaths from coronavirus. 938 more people died in hospital with the virus in the last 24 hours, close to the worst ...",https://www.youtube.com/watch?v=hbX1YtsiLmk,2020-04-08T22:18:26Z,2020,4,8
1,UC16niRr50-MSBwiO3YDb3RA,BBC News,iOLhOL71RPI,Coronavirus: Learn how Wuhan dealt with the lockdown  - BBC News,"The Chinese city of Wuhan, where the coronavirus pandemic originated, is finally lifting its 11-week quarantine as infections and deaths have tailed off. As they ...",https://www.youtube.com/watch?v=iOLhOL71RPI,2020-04-08T18:22:41Z,2020,4,8
2,UC16niRr50-MSBwiO3YDb3RA,BBC News,6P7zkVLbxWc,Coronavirus: What happens in an intensive care unit? - BBC News,Intensive care units (ICUs) are specialist wards within a hospital that look after people who are very ill. They're equipped with a lot of highly technical monitoring ...,https://www.youtube.com/watch?v=6P7zkVLbxWc,2020-04-08T14:40:35Z,2020,4,8
3,UC16niRr50-MSBwiO3YDb3RA,BBC News,gW-u1XdYLDs,Coronavirus: &#39;Gaza has no resources to fight this virus&#39; - BBC News,"In Gaza, people are bracing for a coronavirus outbreak as more than 10 cases of infection have been confirmed in the small enclave. Everything is shut ...",https://www.youtube.com/watch?v=gW-u1XdYLDs,2020-04-08T13:05:53Z,2020,4,8
4,UC16niRr50-MSBwiO3YDb3RA,BBC News,Eji5EXsQNn4,Coronavirus: US records highest death toll in single day - BBC News,The US recorded the most coronavirus deaths in a single day with more than 1800 fatalities reported on Tuesday. It brings the total number of deaths in the ...,https://www.youtube.com/watch?v=Eji5EXsQNn4,2020-04-08T09:53:09Z,2020,4,8
5,UC16niRr50-MSBwiO3YDb3RA,BBC News,cq_po94-EGQ,Coronavirus: Quarantined Italian village turned into human laboratory - BBC News,"Could a tiny hilltop village in Italy help us solve some of the mysteries around coronavirus? Last week, the village of Nerola, was suddenly declared a red zone, ...",https://www.youtube.com/watch?v=cq_po94-EGQ,2020-04-08T08:58:37Z,2020,4,8
6,UC16niRr50-MSBwiO3YDb3RA,BBC News,6MBVHWFpiEo,Coronavirus: Why are people experiencing more vivid dreams? - BBC News,BBC's Outside source speaks to Psychology Professor Mark Blagrove about people experiencing more vivid dreams during lockdown Please subscribe HERE ...,https://www.youtube.com/watch?v=6MBVHWFpiEo,2020-04-08T08:33:41Z,2020,4,8
