,channelId,channelTitle,videoId,vidoeTitle,description,link,time,year,month,day
0,UC16niRr50-MSBwiO3YDb3RA,BBC News,lbL2FbZX4U4,The Queen praises “love and care” in current crisis as she honours VE Day - BBC News,"The Queen has expressed her respect and gratitude for the men and women who secured victory in the Second World War, 75 years ago on VE Day.",https://www.youtube.com/watch?v=lbL2FbZX4U4,2020-05-08T22:16:34Z,2020,5,8
1,UC16niRr50-MSBwiO3YDb3RA,BBC News,KEA6Jkpf4GU,Coronavirus: Russian hospital staff &#39;working without masks&#39; - BBC News,"As coronavirus spreads more widely in Russia's provinces, hospitals - often old and ill-equipped - have become infection ""hot spots"". The number of medical ...",https://www.youtube.com/watch?v=KEA6Jkpf4GU,2020-05-08T14:46:52Z,2020,5,8
2,UC16niRr50-MSBwiO3YDb3RA,BBC News,inC3wnNK-Qk,India coronavirus: Massive repatriation operation begins - BBC News,More than 300 Indians stranded by the coronavirus lockdown have arrived home on flights from Dubai in the United Arab Emirates (UAE). Passengers arrived in ...,https://www.youtube.com/watch?v=inC3wnNK-Qk,2020-05-08T10:48:19Z,2020,5,8
3,UC16niRr50-MSBwiO3YDb3RA,BBC News,gsqAmuL8uek,Coronavirus: US unemployment claims hit 33.3 million amid virus - BBC News,A further 3.2 million Americans sought unemployment benefits last week as the economic toll from the coronavirus pandemic continued to mount. The new ...,https://www.youtube.com/watch?v=gsqAmuL8uek,2020-05-08T10:31:54Z,2020,5,8
4,UC16niRr50-MSBwiO3YDb3RA,BBC News,JsZNh2nMfKg,Coronavirus: Paris restrictions to stay as France reopens - BBC News,"Measures to curb the spread of coronavirus will be kept in place in Paris when the lockdown is eased in other parts of France, its PM says. Edouard Philippe said ...",https://www.youtube.com/watch?v=JsZNh2nMfKg,2020-05-08T10:21:08Z,2020,5,8
