,channelId,channelTitle,videoId,vidoeTitle,description,link,time,year,month,day
0,UC16niRr50-MSBwiO3YDb3RA,BBC News,y-7UG0jORoA,Child migrants detained in US in “cold and filthy conditions” - BBC News,Across the United States almost 20000 migrant children are being held in detention camps after entering the country illegally.,https://www.youtube.com/watch?v=y-7UG0jORoA,2021-05-23T21:30:51Z,2021,5,23
1,UC16niRr50-MSBwiO3YDb3RA,BBC News,oqHOUPiTw_o,Outrage as Ryanair plane “hijacked” by Belarus to arrest dissident journalist - BBC News,"Belarus has been accused of hijacking a European passenger plane and engaging in “state terrorism”, after it forced a Ryanair ...",https://www.youtube.com/watch?v=oqHOUPiTw_o,2021-05-23T21:20:15Z,2021,5,23
2,UC16niRr50-MSBwiO3YDb3RA,BBC News,HwopuxJMPe0,Why Iranians have been queueing for chicken - BBC News,Iran's government has been defiant about the US sanctions reinstated by then-President Donald Trump in 2018 when he ...,https://www.youtube.com/watch?v=HwopuxJMPe0,2021-05-23T15:15:00Z,2021,5,23
3,UC16niRr50-MSBwiO3YDb3RA,BBC News,Rz3WcZjcZgE,Inside Russia&#39;s Arctic military base - BBC News,Russia now has a military base at the top of the world – on the remote archipelago of Franz Josef Land. As global warming ...,https://www.youtube.com/watch?v=Rz3WcZjcZgE,2021-05-23T14:00:08Z,2021,5,23
4,UC16niRr50-MSBwiO3YDb3RA,BBC News,kIFKJ9WVMyA,Italy wins Eurovision - BBC News,Italy has won the Eurovision Song Contest in Rotterdam with the song Zittie e Buoni. Måneskin singer Damiano David shouted ...,https://www.youtube.com/watch?v=kIFKJ9WVMyA,2021-05-23T12:00:32Z,2021,5,23
