,channelId,channelTitle,videoId,vidoeTitle,description,link,time,year,month,day
0,UC16niRr50-MSBwiO3YDb3RA,BBC News,hp0uHz6PrOM,Boris Johnson defends refusing free meals to vulnerable children - BBC News,Boris Johnson has defended his refusal to extend free school meals vouchers for children in Englandover the half-term holiday.,https://www.youtube.com/watch?v=hp0uHz6PrOM,2020-10-26T22:28:00Z,2020,10,26
1,UC16niRr50-MSBwiO3YDb3RA,BBC News,yy6KJVOFX6c,Hospitals under pressure again as Covid admissions rise sharply - BBC News,"As coronavirus cases rise sharply, hospitals are once again under pressure throughout the UK and NHS staff are having to juggle ...",https://www.youtube.com/watch?v=yy6KJVOFX6c,2020-10-26T22:20:03Z,2020,10,26
2,UC16niRr50-MSBwiO3YDb3RA,BBC News,WD9Y5yyQ2h4,US election 2020: President Trump casts his vote - BBC News,"President Donald Trump has voted early in the US election, while on a campaign visit in Florida. It marks the first time an ...",https://www.youtube.com/watch?v=WD9Y5yyQ2h4,2020-10-26T12:05:08Z,2020,10,26
3,UC16niRr50-MSBwiO3YDb3RA,BBC News,qqNvViNcQdE,Police attack anti-Lukashenko protesters with stun grenades in Belarus - BBC News,"Mass protests continued in Belarus, as the opposition threatened a mass walkout by workers if President Alexander Lukashenko ...",https://www.youtube.com/watch?v=qqNvViNcQdE,2020-10-26T11:59:35Z,2020,10,26
4,UC16niRr50-MSBwiO3YDb3RA,BBC News,rrug35nWddk,Coronavirus: &#39;I caught Covid at my uncle&#39;s funeral&#39; - BBC News,"Binu, a construction worker in the southern Indian state of Kerala, sorely regrets attending his uncle's funeral. He caught Covid-19 ...",https://www.youtube.com/watch?v=rrug35nWddk,2020-10-26T08:13:52Z,2020,10,26
5,UC16niRr50-MSBwiO3YDb3RA,BBC News,CRF1JOqlgjc,"Elderly couple, married for 60 years, reunited after 215 days apart - BBC News",An elderly couple's tearful reunion after 215 days apart has been captured on camera in Florida. Joseph was hospitalised in ...,https://www.youtube.com/watch?v=CRF1JOqlgjc,2020-10-26T08:09:37Z,2020,10,26
