,channelId,channelTitle,videoId,vidoeTitle,description,link,time,year,month,day
0,UC16niRr50-MSBwiO3YDb3RA,BBC News,aWwWfuSj3Iw,Rescuers in Beirut search for dozens missing after massive explosion- BBC News,Rescue workers have been searching for dozens of people still missing after the massive explosion in Beirut. At least 135 people ...,https://www.youtube.com/watch?v=aWwWfuSj3Iw,2020-08-05T23:47:44Z,2020,8,5
1,UC16niRr50-MSBwiO3YDb3RA,BBC News,cqF4kQBAB9w,Axios interview: Trump coronavirus claims fact-checked - BBC News,Trump Axios interview coronavirus claims fact-checked #BBCOS #BBCOutsideSource Please subscribe HERE ...,https://www.youtube.com/watch?v=cqF4kQBAB9w,2020-08-05T17:49:02Z,2020,8,5
2,UC16niRr50-MSBwiO3YDb3RA,BBC News,8CEXh6jgGCY,Aerial footage shows aftermath of Beirut blast - BBC News,Footage captured by drone shows the scale of the destruction after the explosion. Please subscribe HERE http://bit.ly/1rbfUog.,https://www.youtube.com/watch?v=8CEXh6jgGCY,2020-08-05T14:48:38Z,2020,8,5
3,UC16niRr50-MSBwiO3YDb3RA,BBC News,j1iwI2ZwENg,Beirut explosion: Moment blast hit BBC bureau - BBC News,"BBC Arabic reporter Maryem Taoumi was interviewing Faisal Al-Aseel, project manager at the Moroccan Agency for Sustainable ...",https://www.youtube.com/watch?v=j1iwI2ZwENg,2020-08-05T12:43:04Z,2020,8,5
4,UC16niRr50-MSBwiO3YDb3RA,BBC News,nLdmDRI_E3w,India PM Modi leads temple rituals at divisive holy site,Indian PM Narendra Modi has laid the foundation stone for a Hindu temple in the northern city of Ayodhya. Hindu mobs ...,https://www.youtube.com/watch?v=nLdmDRI_E3w,2020-08-05T12:15:33Z,2020,8,5
5,UC16niRr50-MSBwiO3YDb3RA,BBC News,SYhcrXYA6tM,Rare footage of former model held for “re-education” in China’s detention system - BBC News,The BBC has obtained rare footage from inside China's secretive system of mass incarceration in the far western region of ...,https://www.youtube.com/watch?v=SYhcrXYA6tM,2020-08-05T11:02:54Z,2020,8,5
6,UC16niRr50-MSBwiO3YDb3RA,BBC News,jywfUQxxUJM,Test and trace system “not a failure” insists head of service in England - BBC News,"The Head of England's test and trace system for coronavirus has denied that it is a failure, after more heavy criticism. As schools ...",https://www.youtube.com/watch?v=jywfUQxxUJM,2020-08-05T10:40:27Z,2020,8,5
7,UC16niRr50-MSBwiO3YDb3RA,BBC News,CCRMz0397n0,Beirut blast: Frantic search for survivors of deadly explosion - BBC News,Rescue workers in Lebanon are searching for more than a hundred people who are missing after a huge explosion devastated ...,https://www.youtube.com/watch?v=CCRMz0397n0,2020-08-05T08:25:05Z,2020,8,5
8,UC16niRr50-MSBwiO3YDb3RA,BBC News,5-W4rFYj78A,Education suffers in Kashmir&#39;s &#39;endless&#39; lockdown,Students in Indian-administered Kashmir have missed most of their school year due to the fact that the troubled region has been ...,https://www.youtube.com/watch?v=5-W4rFYj78A,2020-08-05T07:48:30Z,2020,8,5
