,channelId,channelTitle,videoId,vidoeTitle,description,link,time,year,month,day
0,UC16niRr50-MSBwiO3YDb3RA,BBC News,1arhL5eHLLM,Northern Ireland violence: What&#39;s happening and why? - BBC Newsnight,"On the streets of Northern Ireland, sectarian rioting has been erupting since the end of March 2021. But what's behind the tensions ...",https://www.youtube.com/watch?v=1arhL5eHLLM,2021-04-12T23:10:50Z,2021,4,12
1,UC16niRr50-MSBwiO3YDb3RA,BBC News,UuicikCwMjk,Princes William and Harry pay tributes to their grandfather the Duke of Edinburgh - BBC News,Prince William and Prince Harry have paid separate tributes to their grandfather the Duke of Edinburgh. William described Prince ...,https://www.youtube.com/watch?v=UuicikCwMjk,2021-04-12T21:24:13Z,2021,4,12
2,UC16niRr50-MSBwiO3YDb3RA,BBC News,KANuFlelQ5k,Yuri Gagarin: The first man in space - BBC News,"It's sixty years since the first human blasted into space. For the Soviet Union, Yuri Gagarin's single orbit of the Earth was a huge ...",https://www.youtube.com/watch?v=KANuFlelQ5k,2021-04-12T19:00:09Z,2021,4,12
3,UC16niRr50-MSBwiO3YDb3RA,BBC News,VnLEaQKUZAE,&#39;My BMI wasn&#39;t low enough to get help&#39; - BBC News,"As a teenager, Victoria Spence says she fell into a ""deep, dark hole"" about her own body image. This led to her developing an ...",https://www.youtube.com/watch?v=VnLEaQKUZAE,2021-04-12T16:45:03Z,2021,4,12
4,UC16niRr50-MSBwiO3YDb3RA,BBC News,dTZKpwR9Too,Iran vows revenge for &#39;Israeli&#39; attack on nuclear site - BBC News,"The Iranian foreign minister has said his country will ""take revenge"" for an attack on an underground nuclear site, which it has ...",https://www.youtube.com/watch?v=dTZKpwR9Too,2021-04-12T15:32:00Z,2021,4,12
5,UC16niRr50-MSBwiO3YDb3RA,BBC News,dbnsP56O5go,"Chinese Covid vaccines &#39;don&#39;t have high protection rates&#39;, official says - BBC News","China's top disease control official has said the country's vaccines offer low protection against coronavirus, in a rare admission of ...",https://www.youtube.com/watch?v=dbnsP56O5go,2021-04-12T14:24:31Z,2021,4,12
6,UC16niRr50-MSBwiO3YDb3RA,BBC News,I2peL8OdvT0,Tear gas fired at protesters after police shoot black man near Minneapolis – BBC NEWS,Tear gas has been fired and a curfew imposed amid angry protests after police fatally shot a black man when a car was pulled ...,https://www.youtube.com/watch?v=I2peL8OdvT0,2021-04-12T12:22:41Z,2021,4,12
