,channelId,channelTitle,videoId,vidoeTitle,description,link,time,year,month,day
0,UC16niRr50-MSBwiO3YDb3RA,BBC News,1zZ3MG8OR3E,UK government cuts overseas aid - breaking election promise - BBC News,The Chancellor Rishi Sunak has announced that the UK is to cut the amount of money it gives in overseas aid from 0.7% to 0.5% ...,https://www.youtube.com/watch?v=1zZ3MG8OR3E,2020-11-25T23:14:23Z,2020,11,25
1,UC16niRr50-MSBwiO3YDb3RA,BBC News,rEAA5twFhyM,UK Chancellor warns of “economic emergency” with worst downturn for 300 years - BBC News,The extent of the economic and financial crisis facing the UK has been spelled out by the chancellor Rishi Sunak. He told MPs that ...,https://www.youtube.com/watch?v=rEAA5twFhyM,2020-11-25T22:36:12Z,2020,11,25
2,UC16niRr50-MSBwiO3YDb3RA,BBC News,vYf5WIEl0wE,Diego Maradona: Argentina legend dies aged 60 - BBC News,"Football legend Diego Maradona, one of the greatest players of all time, has died at the age of 60. The former Argentina attacking ...",https://www.youtube.com/watch?v=vYf5WIEl0wE,2020-11-25T21:07:34Z,2020,11,25
3,UC16niRr50-MSBwiO3YDb3RA,BBC News,zlAMoe2unME,Meghan: Duchess of Sussex tells of miscarriage &#39;pain and grief&#39; - BBC News,"The Duchess of Sussex has revealed she had a miscarriage in July, writing in an article of feeling ""an almost unbearable grief"".",https://www.youtube.com/watch?v=zlAMoe2unME,2020-11-25T13:58:05Z,2020,11,25
4,UC16niRr50-MSBwiO3YDb3RA,BBC News,_0Ijm-g1N9Y,Covid Lockdown: A generation of teenage girls and women subjected to domestic violence - BBC News,"According to UN Women and UNICEF, for every three months of confinement, an estimated 15 million additional women around ...",https://www.youtube.com/watch?v=_0Ijm-g1N9Y,2020-11-25T13:12:11Z,2020,11,25
5,UC16niRr50-MSBwiO3YDb3RA,BBC News,_ty3X2q-aMA,Police probed after black woman punched during arrest - BBC Newsnight,A warning – the report contains scenes which some may find distressing. ** Newsnight investigates the increase of Use of Force ...,https://www.youtube.com/watch?v=_ty3X2q-aMA,2020-11-25T12:59:44Z,2020,11,25
6,UC16niRr50-MSBwiO3YDb3RA,BBC News,hWMsAP8Mlsw,Biden: US doesn&#39;t want guarded border on Ireland - BBC News,"President-elect Joe Biden has said America does not want a ""guarded border"" between the Republic of Ireland and Northern ...",https://www.youtube.com/watch?v=hWMsAP8Mlsw,2020-11-25T12:05:55Z,2020,11,25
7,UC16niRr50-MSBwiO3YDb3RA,BBC News,QyLl9ods4AE,Carrie Lam: HK has become a &#39;gaping hole&#39; in China&#39;s National Security- BBC News,Hong Kong's chief Executive Carrie Lam delivered her delayed annual statement. She said the pro democracy protests and ...,https://www.youtube.com/watch?v=QyLl9ods4AE,2020-11-25T10:14:18Z,2020,11,25
8,UC16niRr50-MSBwiO3YDb3RA,BBC News,VP4OTvfng0U,Scotland first in world to make period products free - BBC News,Scotland has become the first country in the world to make period products free for all. MSPs unanimously approved the Period ...,https://www.youtube.com/watch?v=VP4OTvfng0U,2020-11-25T09:20:42Z,2020,11,25
