,channelId,channelTitle,videoId,vidoeTitle,description,link,time,year,month,day
0,UC16niRr50-MSBwiO3YDb3RA,BBC News,eZGcDeTWR28,More than 100 people including children shot dead in Myanmar,"More than 100 people are reported to have been killed by security forces in Myanmar, on the deadliest day since last month's ...",https://www.youtube.com/watch?v=eZGcDeTWR28,2021-03-27T22:13:08Z,2021,3,27
1,UC16niRr50-MSBwiO3YDb3RA,BBC News,Bk8Lzhpot1c,Anti-government protests rock Senegal - BBC News,Senegal has been experiencing what many say is the worst civil unrest in more than a decade. Thousands of young people took ...,https://www.youtube.com/watch?v=Bk8Lzhpot1c,2021-03-27T18:45:00Z,2021,3,27
2,UC16niRr50-MSBwiO3YDb3RA,BBC News,f9pNr59y5WI,Dozens killed as Myanmar army shoots civilians in &#39;deadliest day&#39; - BBC News,"Dozens of people have been killed by the army in Myanmar, on the deadliest day since last month's military coup in the country.",https://www.youtube.com/watch?v=f9pNr59y5WI,2021-03-27T17:44:38Z,2021,3,27
3,UC16niRr50-MSBwiO3YDb3RA,BBC News,2LZSQ7wiB2o,SpaceX rocket debris lights up US sky - BBC News,"Lights streaking across US skies on Thursday night stunned onlookers - but this wasn't a meteor shower, it was SpaceX rocket ...",https://www.youtube.com/watch?v=2LZSQ7wiB2o,2021-03-27T13:00:18Z,2021,3,27
4,UC16niRr50-MSBwiO3YDb3RA,BBC News,O09YJrcx9WQ,Child migrants: The challenges facing Biden at the US-Mexico border - BBC News,"An increase in migrants at the southern US border, and an already backlogged demand for asylum, are testing Joe Biden's ...",https://www.youtube.com/watch?v=O09YJrcx9WQ,2021-03-27T11:00:05Z,2021,3,27
