,channelId,channelTitle,videoId,vidoeTitle,description,link,time,year,month,day
0,UC16niRr50-MSBwiO3YDb3RA,BBC News,TiRGBAjFjlI,Hundreds missing after devastating fire in world’s biggest refugee camp - BBC News,More than 400 people are missing and 15 confirmed dead after a fire at a huge refugee camp in Bangladesh. Tens of thousands ...,https://www.youtube.com/watch?v=TiRGBAjFjlI,2021-03-23T22:38:10Z,2021,3,23
1,UC16niRr50-MSBwiO3YDb3RA,BBC News,60og05aCA_M,UK remembers Covid dead as Boris Johnson admits mistakes in dealing with pandemic - BBC News,Lights have shone around the UK in memory of all those who have lost their lives in the past year. Buildings were lit up and ...,https://www.youtube.com/watch?v=60og05aCA_M,2021-03-23T22:25:53Z,2021,3,23
2,UC16niRr50-MSBwiO3YDb3RA,BBC News,MVLpBvtNmJE,The women killed for working at a TV station - BBC News,Women make up a significant number of those killed in a deadly campaign of targeted attacks on civil society in Afghanistan by ...,https://www.youtube.com/watch?v=MVLpBvtNmJE,2021-03-23T21:09:58Z,2021,3,23
3,UC16niRr50-MSBwiO3YDb3RA,BBC News,5iSd8OBYOMM,Japanese cherry blossom festival hit by Covid restrictions - BBC News,Japan's cherry trees began their annual bloom nearly two weeks ahead of schedule. Cherry blossom - also known as Sakura - is ...,https://www.youtube.com/watch?v=5iSd8OBYOMM,2021-03-23T16:18:12Z,2021,3,23
4,UC16niRr50-MSBwiO3YDb3RA,BBC News,JnoJPl_Cqj8,"Ten people killed in grocery store shooting in Colorado, US  - BBC News","A gunman has killed 10 people, including a police officer, following an hours-long stand-off at a grocery store in the US state of ...",https://www.youtube.com/watch?v=JnoJPl_Cqj8,2021-03-23T16:07:40Z,2021,3,23
5,UC16niRr50-MSBwiO3YDb3RA,BBC News,kyQwK3rPd1o,Minute&#39;s silence held on lockdown anniversary for UK Covid deaths - BBC News,A minute's silence has been held across the UK to remember the victims of the coronavirus pandemic. Tuesday marks the first ...,https://www.youtube.com/watch?v=kyQwK3rPd1o,2021-03-23T12:21:28Z,2021,3,23
6,UC16niRr50-MSBwiO3YDb3RA,BBC News,9uv5kxS1asg,Sturgeon-Salmond saga: What next for Scotland? - BBC Newsnight,Nicola Sturgeon has been cleared of breaching the ministerial code over her involvement in the Alex Salmond saga. Please ...,https://www.youtube.com/watch?v=9uv5kxS1asg,2021-03-23T00:15:38Z,2021,3,23
