,channelId,channelTitle,videoId,vidoeTitle,description,link,time,year,month,day
0,UC16niRr50-MSBwiO3YDb3RA,BBC News,UdITzEqWSw0,Coronavirus: Virgin Atlantic to cut thousands of jobs and end Gatwick operations - BBC News,Virgin Atlantic has announced plans to cut more than 3000 jobs in the UK and to end its operation at Gatwick Airport. The company blamed what it called the ...,https://www.youtube.com/watch?v=UdITzEqWSw0,2020-05-05T21:58:59Z,2020,5,5
1,UC16niRr50-MSBwiO3YDb3RA,BBC News,5EiT3eGf0Jk,Coronavirus:  UK records most deaths in Europe - BBC News,"The United Kingdom has recorded Europe's highest number of deaths inked to coronavirus. It has overtaken Italy, and is second only to the United States in total ...",https://www.youtube.com/watch?v=5EiT3eGf0Jk,2020-05-05T21:34:10Z,2020,5,5
2,UC16niRr50-MSBwiO3YDb3RA,BBC News,OjgN_acftWU,Coronavirus: Thanking healthcare workers worldwide - BBC News,From a flower drop to a star performance - a look at some of the ways that people have expressed thanks to the workers on the frontline against Covid-19.,https://www.youtube.com/watch?v=OjgN_acftWU,2020-05-05T13:05:15Z,2020,5,5
3,UC16niRr50-MSBwiO3YDb3RA,BBC News,XvQYwBGZt0Q,Coronavirus lockdown: different routes back to normal life - BBC News,"Across the world, countries are embarking on enormous experiments in ending coronavirus lockdown measures - and others are looking on nervously, asking ...",https://www.youtube.com/watch?v=XvQYwBGZt0Q,2020-05-05T11:00:14Z,2020,5,5
4,UC16niRr50-MSBwiO3YDb3RA,BBC News,Sildhgd5jtc,Coronavirus: Can wearing masks stop the spread of viruses? - BBC News,Masks will be compulsory on public transport in Spain from Monday as the country moves to gradually relax its tough lockdown. Other countries have brought in ...,https://www.youtube.com/watch?v=Sildhgd5jtc,2020-05-05T10:32:38Z,2020,5,5
