,channelId,channelTitle,videoId,vidoeTitle,description,link,time,year,month,day
0,UC16niRr50-MSBwiO3YDb3RA,BBC News,hh8QOh1aXRM,Claims of rape and torture of Uighur women in China provoke global condemnation - BBC News,There's been international condemnation after the BBC reported claims that women in so-called re-education camps for China's ...,https://www.youtube.com/watch?v=hh8QOh1aXRM,2021-02-04T22:44:54Z,2021,2,4
1,UC16niRr50-MSBwiO3YDb3RA,BBC News,EXNWq_wXubo,UK economy faces tough months ahead says Bank of England - BBC News,The Bank of England says the UK economy is in for another tough few months but it believes that the impact of coronavirus ...,https://www.youtube.com/watch?v=EXNWq_wXubo,2021-02-04T22:23:47Z,2021,2,4
2,UC16niRr50-MSBwiO3YDb3RA,BBC News,UaFaPGYnoa8,What young Burmese fear about the Myanmar coup - BBC News,"For decades Myanmar was tightly controlled by its military, and only in recent years did the country begin to open up to the outside ...",https://www.youtube.com/watch?v=UaFaPGYnoa8,2021-02-04T19:15:01Z,2021,2,4
3,UC16niRr50-MSBwiO3YDb3RA,BBC News,aXIWMAumzpI,First successful face and double hand transplant - BBC News,"Doctors in New York have performed the world's first successful face and double hand transplant. Joe DiMeo, 22, underwent the ...",https://www.youtube.com/watch?v=aXIWMAumzpI,2021-02-04T19:14:35Z,2021,2,4
4,UC16niRr50-MSBwiO3YDb3RA,BBC News,f5X7TKgG9ow,The exiles: Hong Kong at a crossroads - BBC News,Hong Kong pro-democracy protesters with British national overseas (BNO) passports now face a stark choice. Do they take the ...,https://www.youtube.com/watch?v=f5X7TKgG9ow,2021-02-04T16:30:06Z,2021,2,4
5,UC16niRr50-MSBwiO3YDb3RA,BBC News,L49dfNK_vkE,Myanmar leader Aung San Suu Kyi charged after army coup - BBC News,Police in Myanmar have filed several charges against the elected civilian leader Aung San Suu Kyi following Monday's military ...,https://www.youtube.com/watch?v=L49dfNK_vkE,2021-02-04T14:37:12Z,2021,2,4
6,UC16niRr50-MSBwiO3YDb3RA,BBC News,NLue6YyHc5k,Unmasked: The new leader of ‘Islamic State’ and how he came to power - BBC News,The new leader of the so-called Islamic State may have been in power for two years now but how much do we know about him?,https://www.youtube.com/watch?v=NLue6YyHc5k,2021-02-04T12:28:06Z,2021,2,4
7,UC16niRr50-MSBwiO3YDb3RA,BBC News,UdcJaLd62TY,South Korea&#39;s &#39;hidden&#39; migrant workers - BBC News,"Authorities in South Korea have pledged to improve conditions for the country's 200000 migrant workers, after a woman from ...",https://www.youtube.com/watch?v=UdcJaLd62TY,2021-02-04T09:19:18Z,2021,2,4
8,UC16niRr50-MSBwiO3YDb3RA,BBC News,g-ZsaQquIeg,Brexit: UK PM prepared to suspend parts of the Brexit trade deal - BBC Newsnight,"Prime Minister Boris Johnson has called for ""urgent action"" from the EU amid rising tensions over post-Brexit checks at Northern ...",https://www.youtube.com/watch?v=g-ZsaQquIeg,2021-02-04T00:39:01Z,2021,2,4
