,channelId,channelTitle,videoId,vidoeTitle,description,link,time,year,month,day
0,UC16niRr50-MSBwiO3YDb3RA,BBC News,c15A1tjEbj8,Is the three-tier Covid-19 system enough to tackle England’s rising infection rate? - BBC Newsnight,"UK Prime Minister Boris Johnson has described the new Covid-19 three-level alert system for England as a ""balanced package"", ...",https://www.youtube.com/watch?v=c15A1tjEbj8,2020-10-12T23:46:48Z,2020,10,12
1,UC16niRr50-MSBwiO3YDb3RA,BBC News,Au9jnBumTVQ,More Covid-19 patients now in hospital than at start of first lockdown - BBC News,There are now more Covid-19 patients in UK hospitals than there were on the day of lockdown in March. At one hospital on ...,https://www.youtube.com/watch?v=Au9jnBumTVQ,2020-10-12T21:34:35Z,2020,10,12
2,UC16niRr50-MSBwiO3YDb3RA,BBC News,eZC1Duldw6c,Pubs closed and household mixing banned under new Tier 3 system - BBC News,The Prime Minister has imposed a new coronavirus alert system on England to try to stop the virus spiralling out of control. The 3 ...,https://www.youtube.com/watch?v=eZC1Duldw6c,2020-10-12T21:31:56Z,2020,10,12
3,UC16niRr50-MSBwiO3YDb3RA,BBC News,o1yNvWYfRtE,Johnson details three-tier Covid rules for England - BBC News,"Boris Johnson tells the Commons there will be a new three-level alert system for England - medium, high and very high Liverpool ...",https://www.youtube.com/watch?v=o1yNvWYfRtE,2020-10-12T16:16:40Z,2020,10,12
4,UC16niRr50-MSBwiO3YDb3RA,BBC News,gDBpRBpdXA4,South Africa: Is &#39;black tax&#39; help or a burden? - BBC News,"In South Africa they call it ""black tax”, where young black professionals are often expected to support their families financially ...",https://www.youtube.com/watch?v=gDBpRBpdXA4,2020-10-12T12:24:03Z,2020,10,12
5,UC16niRr50-MSBwiO3YDb3RA,BBC News,l0Tbo6SN7zg,US election: Spanish ads target Latino voters - BBC News,The 2020 election marks the first time that Latinos will be the largest racial or ethnic minority in the US electorate. So it is no ...,https://www.youtube.com/watch?v=l0Tbo6SN7zg,2020-10-12T11:02:58Z,2020,10,12
6,UC16niRr50-MSBwiO3YDb3RA,BBC News,SAqMvo7M5lo,Covid UK restrictions: Saturday night street scenes - BBC News,"All pubs, bars, restaurants and other hospitality venues in England are required to close at 10pm to try and contain a surge of new ...",https://www.youtube.com/watch?v=SAqMvo7M5lo,2020-10-12T08:06:59Z,2020,10,12
7,UC16niRr50-MSBwiO3YDb3RA,BBC News,NAV3CmA5rBU,Covid: India&#39;s coronavirus outbreak in 200 seconds - BBC News,"As India has more than 7 million confirmed cases, the BBC looks at how the country has responded to the pandemic. Video by ...",https://www.youtube.com/watch?v=NAV3CmA5rBU,2020-10-12T07:36:44Z,2020,10,12
