,channelId,channelTitle,videoId,vidoeTitle,description,link,time,year,month,day
0,UC16niRr50-MSBwiO3YDb3RA,BBC News,tatQjglz50A,Plan to deploy Royal Navy to UK fishing waters “irresponsible and “undignified” - BBC News,Senior Conservatives have strongly criticised plans by Boris Johnson to deploy Royal Navy ships to protect British waters in the ...,https://www.youtube.com/watch?v=tatQjglz50A,2020-12-12T22:28:50Z,2020,12,12
1,UC16niRr50-MSBwiO3YDb3RA,BBC News,jA09hr_ntMQ,NHS Trusts warn Christmas easing risks third wave of Covid infections - BBC News,NHS Trusts are warning that the relaxing of coronavirus restrictions over Christmas risks a third wave of infections. NHS Providers ...,https://www.youtube.com/watch?v=jA09hr_ntMQ,2020-12-12T22:16:43Z,2020,12,12
2,UC16niRr50-MSBwiO3YDb3RA,BBC News,eegBsVp1aSY,The couple who got married in PPE - BBC News,A couple in India decided to get married even after the bride tested positive for coronavirus on the wedding day. A video shared ...,https://www.youtube.com/watch?v=eegBsVp1aSY,2020-12-12T13:00:08Z,2020,12,12
3,UC16niRr50-MSBwiO3YDb3RA,BBC News,TJBHJmQ4c1U,Tiny possum species found alive after bushfires - BBC News,"Bushfires destroyed almost half the bushland on Australia's Kangaroo Island last summer, devastating animal habitats. Ecologists ...",https://www.youtube.com/watch?v=TJBHJmQ4c1U,2020-12-12T11:00:11Z,2020,12,12
4,UC16niRr50-MSBwiO3YDb3RA,BBC News,H2zhwzXIQYI,Brexit trade deal: What’s going on?  - BBC Newsnight,Boris Johnson and the EU have both warned they are unlikely to reach a post-Brexit trade deal by Sunday 12 December. Please ...,https://www.youtube.com/watch?v=H2zhwzXIQYI,2020-12-12T00:28:09Z,2020,12,12
