,channelId,channelTitle,videoId,vidoeTitle,description,link,time,year,month,day
0,UC16niRr50-MSBwiO3YDb3RA,BBC News,uh2G7rz3xmU,Japan warns fans not to cheer during Olympics to prevent Covid surge - BBC News,Thousands of fans will be allowed into venues to watch the Tokyo Olympic Games but they will be told not to cheer or even speak ...,https://www.youtube.com/watch?v=uh2G7rz3xmU,2021-06-21T21:51:12Z,2021,6,21
1,UC16niRr50-MSBwiO3YDb3RA,BBC News,tgHXejIynnU,New evidence of Uyghur children separated from their families in China - BBC News,The BBC has been investigating the plight of thousands of children believed to have been separated from their parents as a result ...,https://www.youtube.com/watch?v=tgHXejIynnU,2021-06-21T21:34:08Z,2021,6,21
2,UC16niRr50-MSBwiO3YDb3RA,BBC News,gufBkk3Le5o,US warship tested with powerful explosion - BBC News,The United States Navy has been carrying out 'Full Ship Shock Trials' off the country's east coast. The 40000lb (18143kg) ...,https://www.youtube.com/watch?v=gufBkk3Le5o,2021-06-21T17:58:24Z,2021,6,21
3,UC16niRr50-MSBwiO3YDb3RA,BBC News,FuFeMY2mkok,"Up to 10,000 Japanese fans at Tokyo 2020 events - BBC News","Up to 10000 Japanese fans will be permitted at Tokyo 2020 Olympic venues, despite warnings from health bosses. Overseas ...",https://www.youtube.com/watch?v=FuFeMY2mkok,2021-06-21T13:50:01Z,2021,6,21
4,UC16niRr50-MSBwiO3YDb3RA,BBC News,UOFwc3LWuDw,Weightlifter to be first transgender Olympic athlete at Tokyo 2020 - BBC News,New Zealand weightlifter Laurel Hubbard has become the first transgender athlete picked to compete at an Olympics. Officials ...,https://www.youtube.com/watch?v=UOFwc3LWuDw,2021-06-21T12:06:53Z,2021,6,21
5,UC16niRr50-MSBwiO3YDb3RA,BBC News,SeMPbsPHdhU,Wariness and welcome for Ebrahim Raisi after Iranian election - BBC News,"Ebrahim Raisi, the hardline former head of the country's judiciary, has won Iran's presidential election as expected, with a ...",https://www.youtube.com/watch?v=SeMPbsPHdhU,2021-06-21T10:00:09Z,2021,6,21
6,UC16niRr50-MSBwiO3YDb3RA,BBC News,TeWCRE9bh6g,&#39;World&#39;s oldest&#39; alligator celebrates 85th birthday - BBC News,"From surviving World War Two to becoming a hit on TikTok, Muja the alligator has been through a lot. The 85-year-old reptile at ...",https://www.youtube.com/watch?v=TeWCRE9bh6g,2021-06-21T08:04:44Z,2021,6,21
