,channelId,channelTitle,videoId,vidoeTitle,description,link,time,year,month,day
0,UC16niRr50-MSBwiO3YDb3RA,BBC News,IeIZ-aya7dY,Boris Johnson “optimistic” he can set out plan to ease lockdown in England  - BBC News,The Prime Minister Boris Johnson has said he is optimistic he will be able to set out plans for a cautious easing of restrictions in ...,https://www.youtube.com/watch?v=IeIZ-aya7dY,2021-02-13T22:20:15Z,2021,2,13
1,UC16niRr50-MSBwiO3YDb3RA,BBC News,DKGAXTe7HXk,Donald Trump acquitted of inciting insurrection in impeachment trial - BBC News,The former US president Donald Trump has been acquitted of inciting insurrection after last month's storming of the US Capitol ...,https://www.youtube.com/watch?v=DKGAXTe7HXk,2021-02-13T22:15:44Z,2021,2,13
2,UC16niRr50-MSBwiO3YDb3RA,BBC News,FU1tj8J5ajM,Anti-Putin protester&#39;s arrest video &#39;leaked to scare people&#39; - BBC News,Vladimir Putin opponent Alexei Navalny's arrest has sparked unprecedented street protests in Russia. With the Kremlin ...,https://www.youtube.com/watch?v=FU1tj8J5ajM,2021-02-13T17:24:11Z,2021,2,13
3,UC16niRr50-MSBwiO3YDb3RA,BBC News,JnQPtQNiJGg,Myanmar coup: What led to the military seizing power? - BBC News,"When the military seized power through a coup in Myanmar, many around the world were caught by surprise. The Southeast ...",https://www.youtube.com/watch?v=JnQPtQNiJGg,2021-02-13T14:23:28Z,2021,2,13
4,UC16niRr50-MSBwiO3YDb3RA,BBC News,O8Y-_N7NWDA,How video games helped me come to terms with depression - BBC News,"Despite there being an estimated 2.5 billion active gamers around the world, there is a lot of confusion and debate around the ...",https://www.youtube.com/watch?v=O8Y-_N7NWDA,2021-02-13T09:52:19Z,2021,2,13
5,UC16niRr50-MSBwiO3YDb3RA,BBC News,xDfdl6ZpD7g,"Covid UK: As virus cases drop, how can we safely ease restrictions? - BBC Newsnight",Data suggests levels of covid are going down in all four nations of the United Kingdom. But how can we exit lockdown safely?,https://www.youtube.com/watch?v=xDfdl6ZpD7g,2021-02-13T00:27:20Z,2021,2,13
