,channelId,channelTitle,videoId,vidoeTitle,description,link,time,year,month,day
0,UCIRYBXDze5krPDzAEOxFGVA,Guardian News,dpgYX3dQNBc,"Joe Biden a &#39;breath of fresh air&#39;, says Boris Johnson after meeting","Boris Johnson described the US president as a 'breath of fresh air' after their first in-person meeting in Cornwall, where the G7 ...",https://www.youtube.com/watch?v=dpgYX3dQNBc,2021-06-10T21:15:19Z,2021,6,10
1,UCIRYBXDze5krPDzAEOxFGVA,Guardian News,WsDAf5bauz0,&#39;We both married way above our station&#39;: Boris Johnson meets Biden in Cornwall,Boris Johnson and Joe Biden exchanged pleasantries as they met for the first time as their countries' leaders in Cornwall before ...,https://www.youtube.com/watch?v=WsDAf5bauz0,2021-06-10T18:17:18Z,2021,6,10
2,UCIRYBXDze5krPDzAEOxFGVA,Guardian News,SS2q0C91kII,Solar eclipse 2021: crescent sun wows skygazers across northern hemisphere,"Observers in north America and Europe were able to witness a morning solar eclipse, as the moon passed between the Earth and ...",https://www.youtube.com/watch?v=SS2q0C91kII,2021-06-10T15:49:56Z,2021,6,10
3,UCIRYBXDze5krPDzAEOxFGVA,Guardian News,_fizY-rvCas,Hancock: no evidence PPE shortages led to health and social care workers dying of Covid,Matt Hancock played down the practice of discharging hospital patients into care homes without Covid tests during a joint hearing ...,https://www.youtube.com/watch?v=_fizY-rvCas,2021-06-10T15:15:22Z,2021,6,10
4,UCIRYBXDze5krPDzAEOxFGVA,Guardian News,CSJi2-qc2qs,Matt Hancock questioned on government handling of Covid-19 pandemic – watch live,"Subscribe to Guardian News on YouTube ▻ http://bit.ly/guardianwiressub The Guardian publishes independent journalism, made ...",https://www.youtube.com/watch?v=CSJi2-qc2qs,2021-06-10T13:11:02Z,2021,6,10
5,UCIRYBXDze5krPDzAEOxFGVA,Guardian News,xANgRmhdO4o,"Northern Ireland protocol &#39;has to be implemented&#39;, says Ursula von der Leyen",EU leaders have stressed the Northern Ireland protocol must be implemented fully by Boris Johnson to respect the 'rule of law' ...,https://www.youtube.com/watch?v=xANgRmhdO4o,2021-06-10T10:58:10Z,2021,6,10
6,UCIRYBXDze5krPDzAEOxFGVA,Guardian News,LVqBcMjfPkM,Coronavirus: WHO gives update on Covid-19 pandemic in Europe – watch live,"The World Health Organization hosts a news conference on Covid-19 in Europe with Dr Hans Kluge, the WHO regional director ...",https://www.youtube.com/watch?v=LVqBcMjfPkM,2021-06-10T09:35:58Z,2021,6,10
7,UCIRYBXDze5krPDzAEOxFGVA,Guardian News,Har4hXn8N2k,Biden calls for democracies to stand together as he marks first overseas trip as president,"Joe Biden marked his first overseas trip as US president, telling a crowd of US troops and their families at RAF Mildenhall the ""the ...",https://www.youtube.com/watch?v=Har4hXn8N2k,2021-06-10T04:25:10Z,2021,6,10
8,UCIRYBXDze5krPDzAEOxFGVA,Guardian News,UuEM3W9CUEw,Bear gets stuck up Arizona power pole,A bear in southern Arizona caused a brief power outage after it climbed up a power pole and became stuck. The utility company in ...,https://www.youtube.com/watch?v=UuEM3W9CUEw,2021-06-10T02:58:14Z,2021,6,10
