,channelId,channelTitle,videoId,vidoeTitle,description,link,time,year,month,day
0,UCIRYBXDze5krPDzAEOxFGVA,Guardian News,j1kJCJWIDeM,Alexandra Burke says music industry told her to bleach her skin,The singer Alexandra Burke has spoken out for the first time about her experiences of racism in the British music industry.,https://www.youtube.com/watch?v=j1kJCJWIDeM,2020-06-20T14:48:18Z,2020,6,20
1,UCIRYBXDze5krPDzAEOxFGVA,Guardian News,dSs4nk6gwwE,&#39;Tipping point&#39;: Greta Thunberg hails Black Lives Matter protests,"Reflecting on the protests that have swept the globe in recent weeks, the Swedish climate activist told the BBC: 'It feels like we ...",https://www.youtube.com/watch?v=dSs4nk6gwwE,2020-06-20T14:18:59Z,2020,6,20
2,UCIRYBXDze5krPDzAEOxFGVA,Guardian News,n1OV86I-CEU,&#39;The pandemic is accelerating&#39;: WHO warns of dangerous coronavirus phase,The World Health Organization has announced the coronavirus pandemic is accelerating and more than 150000 cases of ...,https://www.youtube.com/watch?v=n1OV86I-CEU,2020-06-20T12:39:35Z,2020,6,20
3,UCIRYBXDze5krPDzAEOxFGVA,Guardian News,PFhH9tK_fzI,Protesters topple statue of Confederate general in Washington DC,Protesters in Washington DC climbed up a bronze statue of Brig Gen Albert Pike and brought it down with ropes before setting it ...,https://www.youtube.com/watch?v=PFhH9tK_fzI,2020-06-20T11:06:19Z,2020,6,20
4,UCIRYBXDze5krPDzAEOxFGVA,Guardian News,QI5hiczFpg4,Researchers capture drone footage of African &#39;tree lions&#39; in conservation study,Researcher Alexander Braczkowski spent a year monitoring and filming lions in the Queen Elizabeth conservation area in ...,https://www.youtube.com/watch?v=QI5hiczFpg4,2020-06-20T04:21:03Z,2020,6,20
