,channelId,channelTitle,videoId,vidoeTitle,description,link,time,year,month,day
0,UCIRYBXDze5krPDzAEOxFGVA,Guardian News,dcx6_2LmcG4,Joe Biden attends community meeting in Kenosha Wisconsin – watch live,"Joe Biden attends a community meeting in Kenosha, Wisconsin, the site of ant-racism protests following the wounding of Jacob ...",https://www.youtube.com/watch?v=dcx6_2LmcG4,2020-09-03T21:55:22Z,2020,9,3
1,UCIRYBXDze5krPDzAEOxFGVA,Guardian News,T3QO0k4FyV4,Daniel Prude: video released of police using ‘spit hood’ on black man who died of asphyxiation,Footage released by the family of Daniel Prude shows a group of police officers placing a hood over the unarmed black man's ...,https://www.youtube.com/watch?v=T3QO0k4FyV4,2020-09-03T20:56:05Z,2020,9,3
2,UCIRYBXDze5krPDzAEOxFGVA,Guardian News,YJ34KN8xh00,Dwayne &#39;the Rock&#39; Johnson says he and his family caught Covid-19,"The pro-wrestler turned Hollywood actor said in a message posted on Instagram that he, his wife and their two young children had ...",https://www.youtube.com/watch?v=YJ34KN8xh00,2020-09-03T15:06:42Z,2020,9,3
3,UCIRYBXDze5krPDzAEOxFGVA,Guardian News,i0U_isEsPMk,Coronavirus UK: Nicola Sturgeon gives update after new quarantine rules announced – watch live,The first minister of Scotland Nicola Sturgeon gives a briefing on Covid-19 after new quarantine rules were announced for people ...,https://www.youtube.com/watch?v=i0U_isEsPMk,2020-09-03T13:16:37Z,2020,9,3
4,UCIRYBXDze5krPDzAEOxFGVA,Guardian News,UPJoWDvt4Rg,Anti-government protesters clash with Bulgarian police in Sofia,Protesters were met by police in riot gear outside parliament in Sofia in the largest demonstration in two months of ...,https://www.youtube.com/watch?v=UPJoWDvt4Rg,2020-09-03T09:03:31Z,2020,9,3
5,UCIRYBXDze5krPDzAEOxFGVA,Guardian News,Bu57KjvcbtM,California lawmaker Buffy Wicks brings newborn baby to state assembly floor for vote,California politician Buffy Wicks was forced to bring her newbown baby on the state assembly floor after she was denied a proxy ...,https://www.youtube.com/watch?v=Bu57KjvcbtM,2020-09-03T05:54:31Z,2020,9,3
6,UCIRYBXDze5krPDzAEOxFGVA,Guardian News,IxQSwBezQWA,Nancy Pelosi says she was &#39;set up&#39; in hair salon mask dispute,House speaker Nancy Pelosi says she was 'set up' after she was photographed in a San Francisco hair salon without a face ...,https://www.youtube.com/watch?v=IxQSwBezQWA,2020-09-03T00:58:36Z,2020,9,3
