,channelId,channelTitle,videoId,vidoeTitle,description,link,time,year,month,day
0,UCIRYBXDze5krPDzAEOxFGVA,Guardian News,VPnfn3n9h2A,Joe Biden holds press conference with Japanese prime minister Yoshihide Suga – watch live,Joe Biden and Japanese Prime Minister Yoshihide Suga hold a news conference at the White House.,https://www.youtube.com/watch?v=VPnfn3n9h2A,2021-04-16T22:02:10Z,2021,4,16
1,UCIRYBXDze5krPDzAEOxFGVA,Guardian News,wZZjyabZoBQ,Helen McCrory: looking back at the life of the &#39;fearless&#39; star,"The actor, best known for her roles in the films The Queen and the Harry Potter franchise, as well as TV series including Peaky ...",https://www.youtube.com/watch?v=wZZjyabZoBQ,2021-04-16T21:03:01Z,2021,4,16
2,UCIRYBXDze5krPDzAEOxFGVA,Guardian News,NeeKzLwDIw4,Hong Kong pro-democracy activists are handed suspended sentences,A group of high-profile activists including the media mogul Jimmy Lai have been sentenced to jail terms of up to 18 months for ...,https://www.youtube.com/watch?v=NeeKzLwDIw4,2021-04-16T12:20:30Z,2021,4,16
3,UCIRYBXDze5krPDzAEOxFGVA,Guardian News,e4oLorUZb-E,How the UK government sidestepped the data on coronavirus,"This time last year, NHS bosses asked doctors and nurses to 'wear aprons' and work without protective full-length gowns when ...",https://www.youtube.com/watch?v=e4oLorUZb-E,2021-04-16T11:38:05Z,2021,4,16
4,UCIRYBXDze5krPDzAEOxFGVA,Guardian News,wiy1MU32AN0,Chicago mayor urges calm as police release footage of Adam Toledo&#39;s killing,At a press conference before the release of footage – which appears to show a Chicago police officer fatally shooting 13-year-old ...,https://www.youtube.com/watch?v=wiy1MU32AN0,2021-04-16T10:25:15Z,2021,4,16
5,UCIRYBXDze5krPDzAEOxFGVA,Guardian News,sq96z3pFKh4,Indianapolis: police hold news conference after fatal shooting at Fedex facility,"At least eight people have been shot and killed at a FedEx facility in Indianapolis and the suspected gunman killed himself, police ...",https://www.youtube.com/watch?v=sq96z3pFKh4,2021-04-16T09:51:56Z,2021,4,16
6,UCIRYBXDze5krPDzAEOxFGVA,Guardian News,1OlkLNU9wcs,WHO briefing on the latest Covid-19 developments – watch live,The World Health Organization holds a news conference on the latest developments in the Covid-19 pandemic with a focus on ...,https://www.youtube.com/watch?v=1OlkLNU9wcs,2021-04-16T09:27:50Z,2021,4,16
7,UCIRYBXDze5krPDzAEOxFGVA,Guardian News,EMJoErAxpJM,Beijing skies turn yellow as sand and dust engulf Chinese capital,The skies over Beijing turned yellow and air pollution soared to severe levels as a giant cloud of sand and dust particles rolled ...,https://www.youtube.com/watch?v=EMJoErAxpJM,2021-04-16T07:35:51Z,2021,4,16
8,UCIRYBXDze5krPDzAEOxFGVA,Guardian News,cil0B9pMfAA,Adam Toledo ‘did not have a gun in his hand’ says family lawyer,"Adam Toledo, a 13-year old boy shot and killed by a Chicago police officer, was not carrying a gun, his family's lawyer has said, ...",https://www.youtube.com/watch?v=cil0B9pMfAA,2021-04-16T07:06:29Z,2021,4,16
