,channelId,channelTitle,videoId,vidoeTitle,description,link,time,year,month,day
0,UCIRYBXDze5krPDzAEOxFGVA,Guardian News,02edAmpl6BM,"EU &#39;recognise they made a mistake&#39; in move to block Covid vaccine exports, says Gove",Michael Gove says European commission recognised they made an error by seeking to trigger a Brexit deal clause to prevent ...,https://www.youtube.com/watch?v=02edAmpl6BM,2021-01-30T18:34:32Z,2021,1,30
1,UCIRYBXDze5krPDzAEOxFGVA,Guardian News,JVzacxDHa_k,Scuffles between police and gilet jaunes during protest over new security bill,Demonstrators marched through Paris on Saturday to protest against the global security bill. Scuffles broke out between police ...,https://www.youtube.com/watch?v=JVzacxDHa_k,2021-01-30T17:40:44Z,2021,1,30
2,UCIRYBXDze5krPDzAEOxFGVA,Guardian News,5h39s762iww,Thousands march in Poland against abortion curbs,Thousands have protested for a third consecutive night in Warsaw and other parts of Poland after the country's rightwing ...,https://www.youtube.com/watch?v=5h39s762iww,2021-01-30T15:48:05Z,2021,1,30
3,UCIRYBXDze5krPDzAEOxFGVA,Guardian News,qfOKFG_X1iE,Fauci: children in US will &#39;hopefully&#39; get Covid vaccine in late spring and early summer,"Children in the US will “hopefully” start to be vaccinated against Covid-19 by late spring or early summer, said Dr Anthony Fauci.",https://www.youtube.com/watch?v=qfOKFG_X1iE,2021-01-30T13:41:04Z,2021,1,30
4,UCIRYBXDze5krPDzAEOxFGVA,Guardian News,EajNbxJaCks,EU gives itself power to block Covid vaccine exports,The European commission has announced that it will tighten the export rules of vaccines produced in the 27 EU countries.,https://www.youtube.com/watch?v=EajNbxJaCks,2021-01-30T10:47:37Z,2021,1,30
