,channelId,channelTitle,videoId,vidoeTitle,description,link,time,year,month,day
0,UCIRYBXDze5krPDzAEOxFGVA,Guardian News,nZomv6zNfXs,Nasa reveals new colour images of Mars from Perseverance rover,"Adam Steltzner, the chief engineer on the Perseverance project, said his team was 'overwhelmed with excitement and joy' as he ...",https://www.youtube.com/watch?v=nZomv6zNfXs,2021-02-19T21:12:19Z,2021,2,19
1,UCIRYBXDze5krPDzAEOxFGVA,Guardian News,Qfl1ViZeOa8,Nasa holds briefing after Perseverance rover lands on Mars – watch live,Nasa officials hold a news briefing after the Perseverance rover successfully touched down on Mars.,https://www.youtube.com/watch?v=Qfl1ViZeOa8,2021-02-19T19:32:29Z,2021,2,19
2,UCIRYBXDze5krPDzAEOxFGVA,Guardian News,fuvShKVB9Ag,MI6 chief apologises for past treatment of LGBT people in secret service,The new head of MI6 has apologised publicly to officers who were thrown out of the spy agency before 1991 when it operated a ...,https://www.youtube.com/watch?v=fuvShKVB9Ag,2021-02-19T16:51:52Z,2021,2,19
3,UCIRYBXDze5krPDzAEOxFGVA,Guardian News,Wjc8UME4EvU,Texans struggle after deadly winter storm: &#39;We have no water&#39;,Millions of Texans are facing water shortages after a winter storm caused pipes to burst and treatment plants to back up. Officials ...,https://www.youtube.com/watch?v=Wjc8UME4EvU,2021-02-19T15:41:16Z,2021,2,19
4,UCIRYBXDze5krPDzAEOxFGVA,Guardian News,pEoc8CadbgM,"Australian politicians &#39;frightened&#39; of &#39;Murdoch media beast’, says Kevin Rudd",The former Australian prime minister Kevin Rudd has declared that Australian politicians are frightened of Rupert Murdoch.,https://www.youtube.com/watch?v=pEoc8CadbgM,2021-02-19T10:56:27Z,2021,2,19
5,UCIRYBXDze5krPDzAEOxFGVA,Guardian News,2ezxPBQvkGk,Ted Cruz on decision to fly to Mexico as Texas freezes: &#39;It was obviously a mistake&#39;,"Texas senator Ted Cruz has sparked outcry after he was spotted flying to the balmier destination of Cancún, Mexico as millions of ...",https://www.youtube.com/watch?v=2ezxPBQvkGk,2021-02-19T09:27:47Z,2021,2,19
6,UCIRYBXDze5krPDzAEOxFGVA,Guardian News,7MOhfT7HjR8,House committee holds hearing on GameStop investors and stock market volatility – watch live,The US House of Representatives financial services committee conducts a hearing on recent market volatility involving GameStop ...,https://www.youtube.com/watch?v=7MOhfT7HjR8,2021-02-19T04:58:43Z,2021,2,19
