,channelId,channelTitle,videoId,vidoeTitle,description,link,time,year,month,day
0,UCIRYBXDze5krPDzAEOxFGVA,Guardian News,F0kBpF5LsF0,Joe Biden discusses supreme court – watch live,"The Democratic presidential candidate delivers remarks on the supreme court, a day after Donald Trump nominated Amy Coney ...",https://www.youtube.com/watch?v=F0kBpF5LsF0,2020-09-27T17:08:37Z,2020,9,27
1,UCIRYBXDze5krPDzAEOxFGVA,Guardian News,EnBXStmT_ds,Frustrated Madrid residents call for new approach in Covid pandemic,Hundreds of protesters gather in Madrid's working-class neighbourhood of Vallecas demanding authorities change their handling ...,https://www.youtube.com/watch?v=EnBXStmT_ds,2020-09-27T16:41:36Z,2020,9,27
2,UCIRYBXDze5krPDzAEOxFGVA,Guardian News,nqYvl8oeLuc,Protesters in Jerusalem call for Benjamin Netanyahu to step down,Demonstrators rallied in Jerusalem demanding the resignation of the Israeli prime minister over charges of corruption and his ...,https://www.youtube.com/watch?v=nqYvl8oeLuc,2020-09-27T15:02:20Z,2020,9,27
3,UCIRYBXDze5krPDzAEOxFGVA,Guardian News,1CJPj3Q4l_k,Oliver Dowden defends university student lockdowns,"Oliver Dowden, the culture secretary, has defended the government's actions confining thousands of university students to their ...",https://www.youtube.com/watch?v=1CJPj3Q4l_k,2020-09-27T11:28:29Z,2020,9,27
4,UCIRYBXDze5krPDzAEOxFGVA,Guardian News,YTTT3Um2J9o,Trump nominates Amy Coney Barrett to US supreme court,Donald Trump has nominated appeals court judge Amy Coney Barrett to take the place of Ruth Bader Ginsburg on the US ...,https://www.youtube.com/watch?v=YTTT3Um2J9o,2020-09-27T09:35:24Z,2020,9,27
