,channelId,channelTitle,videoId,vidoeTitle,description,link,time,year,month,day
0,UCIRYBXDze5krPDzAEOxFGVA,Guardian News,kkiV0cUdSUY,Education secretary Gavin Williamson apologises after U-turn on exam grades,"The British government bowed to public pressure over its school exam grading system, ditching an algorithm that downgraded the ...",https://www.youtube.com/watch?v=kkiV0cUdSUY,2020-08-17T21:00:07Z,2020,8,17
1,UCIRYBXDze5krPDzAEOxFGVA,Guardian News,kDOobamVtAA,Mauritius oil spill: ship breaks up and remaining fuel spreads into ocean,A Japanese ship that has leaked hundreds of tonnes of fuel oil off the coast of Mauritius has broken up. The MV Wakashio ran ...,https://www.youtube.com/watch?v=kDOobamVtAA,2020-08-17T20:07:10Z,2020,8,17
2,UCIRYBXDze5krPDzAEOxFGVA,Guardian News,Ud1wXvJR2q8,Residents battle Amazon fires in Brazil&#39;s Porto Velho,"Residents in the Brazilian city of Porto Velho city were battling blazes spreading in the dry brush on 16 August, as firefighters ...",https://www.youtube.com/watch?v=Ud1wXvJR2q8,2020-08-17T18:58:15Z,2020,8,17
3,UCIRYBXDze5krPDzAEOxFGVA,Guardian News,a6iiyrScM8I,How I May Destroy You changed our lives,"Note: this piece contains accounts that may be triggering for survivors of sexual assault The drama I May Destroy You, written and ...",https://www.youtube.com/watch?v=a6iiyrScM8I,2020-08-17T18:21:14Z,2020,8,17
4,UCIRYBXDze5krPDzAEOxFGVA,Guardian News,Qi_Z1U34u9k,Belarus workers chant &#39;resign!&#39; at Lukashenko on factory visit,"The Belarusian president, Alexander Lukashenko, walked off stage to chants of 'step down' after a speech to workers at the Minsk ...",https://www.youtube.com/watch?v=Qi_Z1U34u9k,2020-08-17T13:19:03Z,2020,8,17
5,UCIRYBXDze5krPDzAEOxFGVA,Guardian News,1ojoaiyv4EU,Moment huge dust storm sweeps through Arizona,"A massive dust storm engulfed homes and highways in Arizona on Sunday, as the temperature in Phoenix soared to a record 46C ...",https://www.youtube.com/watch?v=1ojoaiyv4EU,2020-08-17T12:52:57Z,2020,8,17
6,UCIRYBXDze5krPDzAEOxFGVA,Guardian News,CzuKL3bsVG4,Thailand sees biggest protest since 2014 coup amid calls for reform,People gathered in Bangkok on Sunday for one of the biggest demonstrations against the country's military rulers since the 2014 ...,https://www.youtube.com/watch?v=CzuKL3bsVG4,2020-08-17T11:07:59Z,2020,8,17
7,UCIRYBXDze5krPDzAEOxFGVA,Guardian News,9qXQe1cCMNw,Jacinda Ardern postpones New Zealand election due to coronavirus,"Jacinda Ardern has postponed the general election by four weeks, to 17 October, but ruled out delaying it any further, as the ...",https://www.youtube.com/watch?v=9qXQe1cCMNw,2020-08-17T07:35:58Z,2020,8,17
