,channelId,channelTitle,videoId,vidoeTitle,description,link,time,year,month,day
0,UCIRYBXDze5krPDzAEOxFGVA,Guardian News,oUqC-bIUeSU,"&#39;Scott, you sound like a Dalek&#39;: MP&#39;s speech disrupted by tech malfunction","Scott Mann, the Conservative MP for North Cornwall, had called in to a Commons debate via video link, but was quickly cut off by ...",https://www.youtube.com/watch?v=oUqC-bIUeSU,2021-01-14T19:37:15Z,2021,1,14
1,UCIRYBXDze5krPDzAEOxFGVA,Guardian News,eiKmqY_RNME,Jacob Rees-Mogg says British fish are &#39;happier&#39; because of Brexit deal,The leader of the House of Commons claimed fish delayed for export because of the introduction of the post-Brexit fishing regime ...,https://www.youtube.com/watch?v=eiKmqY_RNME,2021-01-14T18:41:53Z,2021,1,14
2,UCIRYBXDze5krPDzAEOxFGVA,Guardian News,0lkdSpBUtaA,How Trump reacted to two very different impeachments,Donald Trump has become the first president in US history to be impeached twice after the bipartisan vote in the House of ...,https://www.youtube.com/watch?v=0lkdSpBUtaA,2021-01-14T17:48:32Z,2021,1,14
3,UCIRYBXDze5krPDzAEOxFGVA,Guardian News,Xjm-d1-qX3E,US House votes to impeach Donald Trump for a second time,"The House of Representatives has voted 232 to 197 to impeach US president Donald Trump for a second time, formally charging ...",https://www.youtube.com/watch?v=Xjm-d1-qX3E,2021-01-14T09:18:21Z,2021,1,14
4,UCIRYBXDze5krPDzAEOxFGVA,Guardian News,JqnwSL-rPsc,US House of Representatives debate Donald Trump impeachment – watch live,Members of the US House of Representatives are expected to debate the impeachment of Donald Trump for inciting the mob that ...,https://www.youtube.com/watch?v=JqnwSL-rPsc,2021-01-14T00:27:31Z,2021,1,14
