,channelId,channelTitle,videoId,vidoeTitle,description,link,time,year,month,day
0,UCIRYBXDze5krPDzAEOxFGVA,Guardian News,9yvNcW2lE1Q,Donald Trump: &#39;I&#39;m getting rave reviews&#39; for commuting Roger Stone&#39;s sentence,"Trump has claimed he received 'rave reviews' for commuting the prison sentence of Roger Stone, his long-time ally. Stone, 67 ...",https://www.youtube.com/watch?v=9yvNcW2lE1Q,2020-07-13T21:53:39Z,2020,7,13
1,UCIRYBXDze5krPDzAEOxFGVA,Guardian News,TgDy9p5QV4o,Donald Trump: &#39;I have a very good relationship with Anthony Fauci&#39;,"Donald Trump has rebuffed reports that the White House is briefing against Anthony Fauci, the federal government's top public ...",https://www.youtube.com/watch?v=TgDy9p5QV4o,2020-07-13T21:11:50Z,2020,7,13
2,UCIRYBXDze5krPDzAEOxFGVA,Guardian News,BiykzDObbmw,Kayleigh McEnany holds White House press briefing – watch live,White House press secretary Kayleigh McEnany holds an on-camera briefing with reporters.,https://www.youtube.com/watch?v=BiykzDObbmw,2020-07-13T19:28:10Z,2020,7,13
3,UCIRYBXDze5krPDzAEOxFGVA,Guardian News,rmMg31pLkxE,Boris Johnson: face masks should be worn in shops in England,"Boris Johnson has urged the public in England to wear masks in shops as 'extra insurance' against coronavirus, and hinted the ...",https://www.youtube.com/watch?v=rmMg31pLkxE,2020-07-13T16:46:00Z,2020,7,13
4,UCIRYBXDze5krPDzAEOxFGVA,Guardian News,4RV4ht-SG14,"Coronavirus: no return to normal &#39;for the foreseeable future&#39;, says WHO","Tedros Adhanom Ghebreyesus, the director general of the World Health Organization, has criticised the leaders of countries ...",https://www.youtube.com/watch?v=4RV4ht-SG14,2020-07-13T16:25:46Z,2020,7,13
5,UCIRYBXDze5krPDzAEOxFGVA,Guardian News,wTiLBteROGs,Pine martens: rare footage shows reintroduced animals have bred,Video shows that the first pine martens to be reintroduced to England have had kits. The native carnivores had all but vanished ...,https://www.youtube.com/watch?v=wTiLBteROGs,2020-07-13T16:19:30Z,2020,7,13
6,UCIRYBXDze5krPDzAEOxFGVA,Guardian News,HK5vwrSqtG8,World Health Organisation holds briefing on coronavirus outbreak – watch live,The World Health Organisation holds its daily briefing on the coronavirus outbreak.,https://www.youtube.com/watch?v=HK5vwrSqtG8,2020-07-13T16:04:35Z,2020,7,13
7,UCIRYBXDze5krPDzAEOxFGVA,Guardian News,sXpLy4CI39o,Poland’s incumbent president Andrzej Duda wins knife-edge election,"The Polish president, Andrzej Duda, wins another term in office after narrowly defeating his liberal opponent and mayor of ...",https://www.youtube.com/watch?v=sXpLy4CI39o,2020-07-13T11:40:54Z,2020,7,13
8,UCIRYBXDze5krPDzAEOxFGVA,Guardian News,oxDrb7qph_Q,USS Bonhomme Richard fire: US warship rocked by explosion in San Diego,"More than 20 people suffered minor injuries on Sunday after an explosion and fire on board a ship at a naval base in San Diego, ...",https://www.youtube.com/watch?v=oxDrb7qph_Q,2020-07-13T02:20:46Z,2020,7,13
