,channelId,channelTitle,videoId,vidoeTitle,description,link,time,year,month,day
0,UCIRYBXDze5krPDzAEOxFGVA,Guardian News,-lR75egQi0I,Mali soldiers celebrate after ousting president in military coup,Mali's new military rulers have vowed to restore confidence 'between governed and governors' after a coup on Tuesday that led to ...,https://www.youtube.com/watch?v=-lR75egQi0I,2020-08-19T16:06:07Z,2020,8,19
1,UCIRYBXDze5krPDzAEOxFGVA,Guardian News,S3YDJjXrpBA,China floods: footage shows Giant Buddha statue before and after torrential rainfall,Floods on the upper reaches of the Yangtze River in China forced authorities to evacuate more than 100000 people and ...,https://www.youtube.com/watch?v=S3YDJjXrpBA,2020-08-19T12:17:10Z,2020,8,19
2,UCIRYBXDze5krPDzAEOxFGVA,Guardian News,BLcYvNr6Wvw,Emotional stories and a virtual roll call backing Biden: day two at the DNC,"Democrats formally nominated Joe Biden for president during an emotional second night of their party's virtual convention, ...",https://www.youtube.com/watch?v=BLcYvNr6Wvw,2020-08-19T11:17:51Z,2020,8,19
3,UCIRYBXDze5krPDzAEOxFGVA,Guardian News,H-Rmfw_EUYk,Belarus opposition leader calls on EU not to recognise &#39;fraudulent&#39; elections,"Svetlana Tikhanovskaya, the woman heading up Belarus's opposition movement, is appealing to EU leaders to disregard the ...",https://www.youtube.com/watch?v=H-Rmfw_EUYk,2020-08-19T08:10:21Z,2020,8,19
4,UCIRYBXDze5krPDzAEOxFGVA,Guardian News,TMb3C3gQiyA,Activist Ady Barkan delivers powerful speech on protecting US healthcare,Prominent activist Ady Barkan called on voters to act in the forthcoming presidential election to safeguard the future of the US ...,https://www.youtube.com/watch?v=TMb3C3gQiyA,2020-08-19T06:58:36Z,2020,8,19
5,UCIRYBXDze5krPDzAEOxFGVA,Guardian News,SczWog_qqAw,Democratic national convention day two: Ocasio-Cortez &amp; Jill Biden among speakers – watch live,Democrats attending an online convention are expected to formally pick Joe Biden as their party's nominee to face President ...,https://www.youtube.com/watch?v=SczWog_qqAw,2020-08-19T04:15:26Z,2020,8,19
6,UCIRYBXDze5krPDzAEOxFGVA,Guardian News,UihZZq98bDA,Alexandria Ocasio-Cortez praises Bernie Sanders in DNC speech,"In a symbolic speech at the Democratic National Convention, New York congresswoman Alexandria Ocasio-Cortez praised ...",https://www.youtube.com/watch?v=UihZZq98bDA,2020-08-19T02:59:41Z,2020,8,19
7,UCIRYBXDze5krPDzAEOxFGVA,Guardian News,-x_rldlisSc,Sydney&#39;s Warragamba Dam water storage reaches full capacity,"Warragamba Dam sits on Sydney's outer western fringe, and is the city's main reservoir, supplying about 80% of its water.",https://www.youtube.com/watch?v=-x_rldlisSc,2020-08-19T01:42:25Z,2020,8,19
