,channelId,channelTitle,videoId,vidoeTitle,description,link,time,year,month,day
0,UCIRYBXDze5krPDzAEOxFGVA,Guardian News,niMqyNRzH-Q,Boris Johnson hails trade deal with Australia: &#39;This will be good news&#39;,"The UK has agreed the outline of a trade deal with Australia, with Boris Johnson promising the deal 'will benefit British farmers' ...",https://www.youtube.com/watch?v=niMqyNRzH-Q,2021-06-15T12:33:52Z,2021,6,15
1,UCIRYBXDze5krPDzAEOxFGVA,Guardian News,fOD3D-zP94o,Putin refuses to give guarantee Navalny will survive prison,"Vladimir Putin has refused to give any guarantee that the opposition leader Alexei Navalny will get out of prison alive, saying ...",https://www.youtube.com/watch?v=fOD3D-zP94o,2021-06-15T10:05:52Z,2021,6,15
2,UCIRYBXDze5krPDzAEOxFGVA,Guardian News,xt_BS63gOAE,Watch the world&#39;s most expensive working dog in action,An Australian cattle dog named Hoover now holds the title of the world's most expensive working dog after he sold for auction at ...,https://www.youtube.com/watch?v=xt_BS63gOAE,2021-06-15T07:12:16Z,2021,6,15
3,UCIRYBXDze5krPDzAEOxFGVA,Guardian News,IOJB_XhIlCY,Marjorie Taylor Greene apologises for comparing Covid-19 masks to Holocaust,Republican congresswoman Marjorie Taylor Greene apologised for comparing Covid-19 mask requirements and vaccinations to ...,https://www.youtube.com/watch?v=IOJB_XhIlCY,2021-06-15T02:25:10Z,2021,6,15
4,UCIRYBXDze5krPDzAEOxFGVA,Guardian News,kYOgdobMYSg,Biden says Putin a &#39;worthy adversary&#39; ahead of talks,Joe Biden said meeting with Vladimir Putin would be 'critical' and that he would offer to cooperate on areas of common interest if ...,https://www.youtube.com/watch?v=kYOgdobMYSg,2021-06-15T01:18:12Z,2021,6,15
