,channelId,channelTitle,videoId,vidoeTitle,description,link,time,year,month,day
0,UCIRYBXDze5krPDzAEOxFGVA,Guardian News,P3Zr08lTfnI,Coronavirus: WHO holds briefing to update on global outbreak - watch live,The World Health Organisation holds briefing on the latest worldwide developments of the coronavirus outbreak.,https://www.youtube.com/watch?v=P3Zr08lTfnI,2020-07-07T18:22:05Z,2020,7,7
1,UCIRYBXDze5krPDzAEOxFGVA,Guardian News,1WKAq2SwGmA,Bolsonaro removes mask after positive Covid-19 test to show press &#39;I&#39;m doing well&#39;,Jair Bolsonaro has said he is 'absolutely fine' after testing positive for Covid-19. The Brazilian president announced the result in a ...,https://www.youtube.com/watch?v=1WKAq2SwGmA,2020-07-07T18:15:56Z,2020,7,7
2,UCIRYBXDze5krPDzAEOxFGVA,Guardian News,blYCeH4SlEM,"Coronavirus: US &#39;still knee deep in first wave&#39;, Fauci warns","The US chief medical adviser, Dr Anthony Fauci, has said the country is 'still knee-deep in the first wave of this' when talking about ...",https://www.youtube.com/watch?v=blYCeH4SlEM,2020-07-07T16:08:38Z,2020,7,7
3,UCIRYBXDze5krPDzAEOxFGVA,Guardian News,5_Kxr_R1Pvs,Coronavirus: Matt Hancock answers questions in parliament – watch live,Government ministers are expected to answer question in parliament the day before he announces an update to his plans for the ...,https://www.youtube.com/watch?v=5_Kxr_R1Pvs,2020-07-07T13:14:11Z,2020,7,7
4,UCIRYBXDze5krPDzAEOxFGVA,Guardian News,Y99GoIiAF1E,How stop and search is failing black people,There has been renewed criticism over stop and search in the UK after research found that BAME people are 54% more likely to ...,https://www.youtube.com/watch?v=Y99GoIiAF1E,2020-07-07T10:27:40Z,2020,7,7
5,UCIRYBXDze5krPDzAEOxFGVA,Guardian News,kZ92XISDbsI,Flooding and landslides in Japan leaves scores dead on Kyushu,Rescue workers were combing through the wreckage of houses hit by flooding and landslides in Japan after extreme weather left ...,https://www.youtube.com/watch?v=kZ92XISDbsI,2020-07-07T10:03:33Z,2020,7,7
6,UCIRYBXDze5krPDzAEOxFGVA,Guardian News,vQxP5UE8dWM,"Indonesia&#39;s shark fishermen: 24 went out, 20 came back. What happened on the boat?","Crew from rural Indonesian villages, recruited by suspected traffickers, endured horrendous conditions aboard an illegal ...",https://www.youtube.com/watch?v=vQxP5UE8dWM,2020-07-07T08:52:28Z,2020,7,7
7,UCIRYBXDze5krPDzAEOxFGVA,Guardian News,hfhP7TRziDg,Coronavirus Victoria: Melbourne to re-enter stage 3 lockdown restrictions for six weeks,Metropolitan Melbourne will go into stage-three lockdown for six weeks from 11.59pm on Wednesday after the state of Victoria ...,https://www.youtube.com/watch?v=hfhP7TRziDg,2020-07-07T08:43:45Z,2020,7,7
8,UCIRYBXDze5krPDzAEOxFGVA,Guardian News,Yayl27ifXA8,"White House says US is &#39;a leader&#39; in fighting coronavirus, despite rising infections","Kayleigh McEnany says the US has been a leader in the fight against Covid-19, despite rising infections across the country.",https://www.youtube.com/watch?v=Yayl27ifXA8,2020-07-07T02:48:18Z,2020,7,7
