,channelId,channelTitle,videoId,vidoeTitle,description,link,time,year,month,day
0,UCIRYBXDze5krPDzAEOxFGVA,Guardian News,l-MPKT5q8U0,Biden urges people to get vaccinated: &#39;Do not let up now&#39;,US president Joe Biden has said that getting vaccinated is a 'patriotic duty' for everyone in the US and he urged people to ...,https://www.youtube.com/watch?v=l-MPKT5q8U0,2021-04-27T20:38:26Z,2021,4,27
1,UCIRYBXDze5krPDzAEOxFGVA,Guardian News,rfOrd-dvXZ8,US President Joe Biden addresses the nation on Covid-19 response – watch live,US President Joe Biden delivers remarks on COVID-19 response.,https://www.youtube.com/watch?v=rfOrd-dvXZ8,2021-04-27T18:54:31Z,2021,4,27
2,UCIRYBXDze5krPDzAEOxFGVA,Guardian News,f-Kp29-AjOA,Scientists find huge suspected toxic DDT dumpsite off California coast,Marine scientists say they have found what they believe to be as many as 25000 barrels that possibly contain DDT dumped off the ...,https://www.youtube.com/watch?v=f-Kp29-AjOA,2021-04-27T17:22:57Z,2021,4,27
3,UCIRYBXDze5krPDzAEOxFGVA,Guardian News,unUhZXiln7o,Thérèse Coffey says people do not care about Johnson&#39;s flat makeover,The work and pensions secretary on Tuesday tried to downplay growing controversy surrounding the funding of the refurbishment ...,https://www.youtube.com/watch?v=unUhZXiln7o,2021-04-27T13:08:09Z,2021,4,27
4,UCIRYBXDze5krPDzAEOxFGVA,Guardian News,8buPlfKxNfU,Ursula von der Leyen on &#39;sofagate&#39;: &#39;I felt hurt and I felt alone&#39;,"The European commission president, Ursula von der Leyen, said on Monday that she felt hurt and alone during a meeting with ...",https://www.youtube.com/watch?v=8buPlfKxNfU,2021-04-27T10:58:35Z,2021,4,27
5,UCIRYBXDze5krPDzAEOxFGVA,Guardian News,Ku9bWudrWAc,Fighting erupts in Myanmar near Thai border,Shots were heard and fires lit as heavy fighting broke out at a Myanmar army outpost near the eastern border with Thailand.,https://www.youtube.com/watch?v=Ku9bWudrWAc,2021-04-27T08:27:37Z,2021,4,27
6,UCIRYBXDze5krPDzAEOxFGVA,Guardian News,tbTF_IaLVhE,First supermoon of 2021 rises across the globe,"From Sydney's Bondi Beach, to Istanbul's Bosphorus and the mountains of Caracas in Venezuela, the first supermoon of 2021 has ...",https://www.youtube.com/watch?v=tbTF_IaLVhE,2021-04-27T05:25:59Z,2021,4,27
