,channelId,channelTitle,videoId,vidoeTitle,description,link,time,year,month,day
0,UCIRYBXDze5krPDzAEOxFGVA,Guardian News,ju9eJXuHQJI,Joe Biden and Kamala Harris react to the Chauvin trial verdict – watch live,Joe Biden and Kamala Harris react to the Chauvin trial verdict – watch live.,https://www.youtube.com/watch?v=ju9eJXuHQJI,2021-04-20T23:34:41Z,2021,4,20
1,UCIRYBXDze5krPDzAEOxFGVA,Guardian News,SOw8BYNpBug,Chauvin trial: Minnesota AG Keith Ellison delivers statement – watch live,Minnesota attorney general Keith Ellison will deliver a statement 20 minutes after the verdict is delivered and court concludes in ...,https://www.youtube.com/watch?v=SOw8BYNpBug,2021-04-20T22:12:19Z,2021,4,20
2,UCIRYBXDze5krPDzAEOxFGVA,Guardian News,nZK2SSpFygA,Derek Chauvin taken away in handcuffs after being found guilty of George Floyd’s murder,"Derek Chauvin has been convicted of murder for killing George Floyd by kneeling on his neck for more than nine minutes, a crime ...",https://www.youtube.com/watch?v=nZK2SSpFygA,2021-04-20T22:09:10Z,2021,4,20
3,UCIRYBXDze5krPDzAEOxFGVA,Guardian News,cJ1EurOJfKk,Cheers erupt outside courtroom as Chauvin guilty verdict is delivered,Crowds gathered outside a courtroom in Minneapolis reacted in jubilation when jurors returned a verdict of guilty on all three ...,https://www.youtube.com/watch?v=cJ1EurOJfKk,2021-04-20T22:03:14Z,2021,4,20
4,UCIRYBXDze5krPDzAEOxFGVA,Guardian News,ZZVSBlnKT-E,Chauvin trial: jury reaches verdict – watch live,"A verdict is expected in the trial of Derek Chauvin, the former Minneapolis policeman accused of killing George Floyd. Videos of ...",https://www.youtube.com/watch?v=ZZVSBlnKT-E,2021-04-20T21:35:29Z,2021,4,20
5,UCIRYBXDze5krPDzAEOxFGVA,Guardian News,VZgQiTAaJjk,Boris Johnson: government to fast-track development of drugs to &#39;stop Covid in its tracks&#39;,Boris Johnson has announced the UK government is launching a coronavirus antivirals taskforce under plans to fast-track the ...,https://www.youtube.com/watch?v=VZgQiTAaJjk,2021-04-20T17:23:12Z,2021,4,20
6,UCIRYBXDze5krPDzAEOxFGVA,Guardian News,9_0wcm3Dep4,Boris Johnson holds Covid briefing at Downing Street – watch live,Prime minister Boris Johnson and other UK government officials hold a press briefing at Downing Street. Subscribe to Guardian ...,https://www.youtube.com/watch?v=9_0wcm3Dep4,2021-04-20T16:53:56Z,2021,4,20
