,channelId,channelTitle,videoId,vidoeTitle,description,link,time,year,month,day
0,UCIRYBXDze5krPDzAEOxFGVA,Guardian News,VJ6yiVd5EF8,"Tulsa massacre survivor, 107, testifies to US Congress: &#39;I still smell smoke and see fire&#39;","Viola Fletcher, the oldest living survivor of the Tulsa, Oklahoma, massacre, was seven when a white mob attacked the city's 'Black ...",https://www.youtube.com/watch?v=VJ6yiVd5EF8,2021-05-19T23:45:14Z,2021,5,19
1,UCIRYBXDze5krPDzAEOxFGVA,Guardian News,lxXwR7-VciE,New Friends: Reunion trailer released by HBO Max,"HBO Max dropped a trailer for Friends: The Reunion on Wednesday, in advance of the one-off special to be aired next week, ...",https://www.youtube.com/watch?v=lxXwR7-VciE,2021-05-19T20:55:40Z,2021,5,19
2,UCIRYBXDze5krPDzAEOxFGVA,Guardian News,NytVupYCHQ8,Coronavirus: Matt Hancock holds Downing Street briefing – watch live,Health secretary Matt Hancock holds a news conference on Covid-19 and the vaccination programme.,https://www.youtube.com/watch?v=NytVupYCHQ8,2021-05-19T17:09:47Z,2021,5,19
3,UCIRYBXDze5krPDzAEOxFGVA,Guardian News,d_3ZxMEGm-c,Israel-Palestine crisis explained: why has the violence escalated again?,The Guardian's Jerusalem correspondent Oliver Holmes examines the series of combustible events that coincided to trigger the ...,https://www.youtube.com/watch?v=d_3ZxMEGm-c,2021-05-19T14:21:51Z,2021,5,19
4,UCIRYBXDze5krPDzAEOxFGVA,Guardian News,qCi1iP3hV8g,PMQs: Boris Johnson faces questions over Indian variant of Covid-19 – watch live,Boris Johnson takes questions in parliament as concerns mount over the spread of the Indian Covid-19 variant Subscribe to ...,https://www.youtube.com/watch?v=qCi1iP3hV8g,2021-05-19T12:27:40Z,2021,5,19
5,UCIRYBXDze5krPDzAEOxFGVA,Guardian News,RFegkSPiQj0,"PMQs: Do not visit amber list countries for holidays, says Johnson","People should only travel to amber list countries in extreme circumstances, the prime minister insisted, as he dismissed ...",https://www.youtube.com/watch?v=RFegkSPiQj0,2021-05-19T12:26:47Z,2021,5,19
6,UCIRYBXDze5krPDzAEOxFGVA,Guardian News,pcxxKVuEUQE,Nancy Pelosi calls for diplomatic boycott of 2022 Beijing Winter Olympics,"US House speaker Nancy Pelosi has called for a US diplomatic boycott of the 2022 Winter Olympics in Beijing, saying global ...",https://www.youtube.com/watch?v=pcxxKVuEUQE,2021-05-19T01:49:22Z,2021,5,19
