,channelId,channelTitle,videoId,vidoeTitle,description,link,time,year,month,day
0,UCIRYBXDze5krPDzAEOxFGVA,Guardian News,DsTyb9SOcfk,Duterte pardons US marine jailed for killing transgender woman Jennifer Laude,The Philippine president pardoned a US marine on Monday in a surprise move that will free him from imprisonment for the 2014 ...,https://www.youtube.com/watch?v=DsTyb9SOcfk,2020-09-07T18:50:51Z,2020,9,7
1,UCIRYBXDze5krPDzAEOxFGVA,Guardian News,0et7rrwddqg,Kit Malthouse makes statement on Extinction Rebellion protests – watch live,Kit Malthouse makes statement on Extinction Rebellion protests after transport secretary Grant Shapps made a statement on travel ...,https://www.youtube.com/watch?v=0et7rrwddqg,2020-09-07T17:35:37Z,2020,9,7
2,UCIRYBXDze5krPDzAEOxFGVA,Guardian News,rGNNoZiFC2A,WHO holds briefing on coronavirus outbreak – watch live,The World Health Organization holds a briefing to update on the coronavirus outbreak.,https://www.youtube.com/watch?v=rGNNoZiFC2A,2020-09-07T17:01:24Z,2020,9,7
3,UCIRYBXDze5krPDzAEOxFGVA,Guardian News,_RXvaSoJkzA,Grant Shapps announces seven Greek islands to be added to England&#39;s quarantine list,Grant Shapps on Monday outlined a new policy according to which coronavirus quarantine rules may apply to islands within ...,https://www.youtube.com/watch?v=_RXvaSoJkzA,2020-09-07T15:50:35Z,2020,9,7
4,UCIRYBXDze5krPDzAEOxFGVA,Guardian News,HMtiXUeXUSY,12-year-old girl one of hundreds arrested in huge Hong Kong protest,"Almost 300 people were arrested in Hong Kong on Sunday amid the largest street protest since 1 July, the first full day under the ...",https://www.youtube.com/watch?v=HMtiXUeXUSY,2020-09-07T13:53:10Z,2020,9,7
5,UCIRYBXDze5krPDzAEOxFGVA,Guardian News,O0SY3-MyXZk,Pyrotechnic device at gender-reveal party causes California wildfire,"A fire in California that has burned more than 7000 acres was caused by a 'pyrotechnic device used at a gender reveal party', ...",https://www.youtube.com/watch?v=O0SY3-MyXZk,2020-09-07T10:08:51Z,2020,9,7
6,UCIRYBXDze5krPDzAEOxFGVA,Guardian News,j_pWHc2riWQ,Scott Morrison dodges questions about sports rorts scandal,"Asked about the long-running sports grants controversy on Monday, the prime minister tells Guardian Australia: 'I think we're ...",https://www.youtube.com/watch?v=j_pWHc2riWQ,2020-09-07T08:43:09Z,2020,9,7
7,UCIRYBXDze5krPDzAEOxFGVA,Guardian News,QqTkib7wWNA,Violent arrest of 12-year-old girl in Hong Kong,Police in Hong Kong have come under fire over the rough arrest of a 12-year-old girl whose family says was caught in a protest ...,https://www.youtube.com/watch?v=QqTkib7wWNA,2020-09-07T07:49:16Z,2020,9,7
