,channelId,channelTitle,videoId,vidoeTitle,description,link,time,year,month,day
0,UCIRYBXDze5krPDzAEOxFGVA,Guardian News,XRP9TF1SIbQ,Minnesota governor holds news conference after protests over George Floyd killing – watch live,Minnesota Governor Tim Walz holds a news conference following violent protests over the death of George Floyd on Monday.,https://www.youtube.com/watch?v=XRP9TF1SIbQ,2020-05-29T23:42:59Z,2020,5,29
1,UCIRYBXDze5krPDzAEOxFGVA,Guardian News,iwPPqDryPO8,How the killing of George Floyd has upended America,"Cities across the US have been convulsed by protests sparked by the killing of George Floyd, a 46-year-old black man who died after being arrested and ...",https://www.youtube.com/watch?v=iwPPqDryPO8,2020-05-29T21:27:11Z,2020,5,29
2,UCIRYBXDze5krPDzAEOxFGVA,Guardian News,LUL-1Purkr8,Donald Trump announces US plans to sever all ties with WHO,Trump has announced that the US will terminate its relationship with the World Health Organization and will redirect the funds to 'other bodies'. The US president ...,https://www.youtube.com/watch?v=LUL-1Purkr8,2020-05-29T20:10:52Z,2020,5,29
3,UCIRYBXDze5krPDzAEOxFGVA,Guardian News,3Tl90MJC5yg,"Coronavirus furlough scheme to be gradually withdrawn, Sunak says","The UK chancellor, Rishi Sunak, has announced that the furlough scheme put in place during lockdown will start to change from August, when employers will be ...",https://www.youtube.com/watch?v=3Tl90MJC5yg,2020-05-29T17:43:21Z,2020,5,29
4,UCIRYBXDze5krPDzAEOxFGVA,Guardian News,3vUlSoFdKV8,CNN journalists arrested live on air while covering George Floyd protests,"CNN has reported that its correspondent Omar Jimenez, producer Bill Kirkos and photojournalist Leonel Mendez have been released from police custody after ...",https://www.youtube.com/watch?v=3vUlSoFdKV8,2020-05-29T15:34:51Z,2020,5,29
5,UCIRYBXDze5krPDzAEOxFGVA,Guardian News,X5FXIVjj-Og,Minneapolis police precinct set ablaze during George Floyd protest,A police station in Minneapolis was set alight during the third night of protests over the death of an unarmed black man in custody on Monday. A police officer ...,https://www.youtube.com/watch?v=X5FXIVjj-Og,2020-05-29T14:45:13Z,2020,5,29
6,UCIRYBXDze5krPDzAEOxFGVA,Guardian News,6jBur0Bu7L8,Coronavirus: Nicola Sturgeon eases lockdown in Scotland – watch live,"First minister for Scotland, Nicola Sturgeon, announces an easing of lockdown measures amid the coronavirus pandemic. Subscribe to Guardian News on ...",https://www.youtube.com/watch?v=6jBur0Bu7L8,2020-05-29T13:04:47Z,2020,5,29
7,UCIRYBXDze5krPDzAEOxFGVA,Guardian News,AgxcV-SG2gw,‘Are you saying Trump never lies?’: reporters quiz McEnany over White House Twitter feud,"Reporters have interrogated the White House press secretary, Kayleigh McEnany, over Donald Trump's feud with Twitter. 'The president has clearly said things ...",https://www.youtube.com/watch?v=AgxcV-SG2gw,2020-05-29T08:09:35Z,2020,5,29
8,UCIRYBXDze5krPDzAEOxFGVA,Guardian News,4CsifBYiOxU,George Floyd: riots erupt in Minneapolis as protests sweep across US,Demonstrators across the country are taking to the streets to protest the death of 46-year-old George Floyd at the hands of Minneapolis police. New York city and ...,https://www.youtube.com/watch?v=4CsifBYiOxU,2020-05-29T05:56:30Z,2020,5,29
