,channelId,channelTitle,videoId,vidoeTitle,description,link,time,year,month,day
0,UCIRYBXDze5krPDzAEOxFGVA,Guardian News,dCA-yPmJBaM,Riots erupt in Stuttgart after police drug checks,Police in the German city of Stuttgart have said that 20 people were arrested and four police officers injured after a drugs check in ...,https://www.youtube.com/watch?v=dCA-yPmJBaM,2020-06-21T17:38:35Z,2020,6,21
1,UCIRYBXDze5krPDzAEOxFGVA,Guardian News,Hvr6Ep9EBIM,Reading stabbings: Met police declare incident as terrorist attack,"The killing of three people in a stabbing rampage in a park in Reading is being treated as a terrorist attack, Met police assistant ...",https://www.youtube.com/watch?v=Hvr6Ep9EBIM,2020-06-21T12:05:28Z,2020,6,21
2,UCIRYBXDze5krPDzAEOxFGVA,Guardian News,6iVVzpQTD80,Reading stabbings: Metropolitan police give statement - watch live,Assistant commissioner Neil Basu from the Metropolitan police holds a news conference a day after stabbings at a park in ...,https://www.youtube.com/watch?v=6iVVzpQTD80,2020-06-21T11:51:42Z,2020,6,21
3,UCIRYBXDze5krPDzAEOxFGVA,Guardian News,EEJogV-xUIM,Trump calls coronavirus &#39;kung flu&#39; and says he slowed testing,"Donald Trump calls the coronavirus 'kung flu' and 'the Chinese virus' during a campaign rally in Tulsa, Oklahoma, on Saturday ...",https://www.youtube.com/watch?v=EEJogV-xUIM,2020-06-21T04:06:01Z,2020,6,21
4,UCIRYBXDze5krPDzAEOxFGVA,Guardian News,uIOWkMTHJqU,Donald Trump holds rally in Tulsa amid coronavirus fears – watch live,Oklahoma is hosting Donald Trump's first campaign rally since the coronavirus pandemic struck the United States. The indoor rally ...,https://www.youtube.com/watch?v=uIOWkMTHJqU,2020-06-21T02:44:14Z,2020,6,21
