,channelId,channelTitle,videoId,vidoeTitle,description,link,time,year,month,day
0,UCIRYBXDze5krPDzAEOxFGVA,Guardian News,O99b0Nr0m0g,Covid origins report leader says team faced difficulties accessing data,The leader of a World Health Organization mission to China to find the origins of the coronavirus has said the team felt political ...,https://www.youtube.com/watch?v=O99b0Nr0m0g,2021-03-30T20:37:49Z,2021,3,30
1,UCIRYBXDze5krPDzAEOxFGVA,Guardian News,uqA_N9Mezis,WHO chief backs calls for pandemic treaty,"The director general of the World Health Organization, Tedros Adhanom Ghebreyesus, said a pandemic treaty would help to ...",https://www.youtube.com/watch?v=uqA_N9Mezis,2021-03-30T13:05:04Z,2021,3,30
2,UCIRYBXDze5krPDzAEOxFGVA,Guardian News,eQE9npwGaG4,Refugees flee Myanmar for Thailand after airstrikes,Refugees fleeing Myanmar are attempting to reach Thailand by boat following airstrikes by Myanmar's military on parts of the ...,https://www.youtube.com/watch?v=eQE9npwGaG4,2021-03-30T11:04:44Z,2021,3,30
3,UCIRYBXDze5krPDzAEOxFGVA,Guardian News,fG1VqtZtl-w,WHO chief and president of European Council give briefing on pandemic treaty – watch live,"Tedros Adhanom Ghebreyesus, Director General of the of the World Health Organization, and the president of the European ...",https://www.youtube.com/watch?v=fG1VqtZtl-w,2021-03-30T09:37:19Z,2021,3,30
4,UCIRYBXDze5krPDzAEOxFGVA,Guardian News,OH2cH9G5jCQ,George Floyd: Opening statements begin in Derek Chauvin&#39;s trial,Former Minneapolis police officer Derek Chauvin's trial over the death of George Floyd has begun. Minnesota prosecutor Jerry ...,https://www.youtube.com/watch?v=OH2cH9G5jCQ,2021-03-30T01:13:44Z,2021,3,30
