,channelId,channelTitle,videoId,vidoeTitle,description,link,time,year,month,day
0,UCIRYBXDze5krPDzAEOxFGVA,Guardian News,0VxuU-MmQE8,Covid lockdown easing: English pubs and restaurants can open indoors from May 17,Social distancing between family and friends is to be left up to 'personal choice' from next week and gatherings of six people from ...,https://www.youtube.com/watch?v=0VxuU-MmQE8,2021-05-10T16:57:21Z,2021,5,10
1,UCIRYBXDze5krPDzAEOxFGVA,Guardian News,sg9wKjaFjfo,Israel: Footage shows moment car crashes into Palestinians after being pelters with stones,"Police published dramatic CCTV video from a road near the Old City of a white car being pelted by Palestinians with stones, ...",https://www.youtube.com/watch?v=sg9wKjaFjfo,2021-05-10T13:31:20Z,2021,5,10
2,UCIRYBXDze5krPDzAEOxFGVA,Guardian News,Na5cnzcNR30,Meghan makes her first TV appearance since her Oprah interview,The Duchess of Sussex has made her first television appearance since her interview with Oprah Winfrey. Meghan warned women ...,https://www.youtube.com/watch?v=Na5cnzcNR30,2021-05-10T09:18:01Z,2021,5,10
3,UCIRYBXDze5krPDzAEOxFGVA,Guardian News,0y3yuR1imR8,Whale freed after being stranded at lock along River Thames in London,A small whale has been freed after it became stranded along the River Thames in south-west London. Hundreds of people ...,https://www.youtube.com/watch?v=0y3yuR1imR8,2021-05-10T08:13:03Z,2021,5,10
4,UCIRYBXDze5krPDzAEOxFGVA,Guardian News,3tlrTPLRxSg,Israeli police clash with Palestinian protesters at al-Aqsa mosque,"Rock-throwing Palestinians and Israeli police firing stun grenades clashed outside al-Aqsa mosque, in on-going violence in ...",https://www.youtube.com/watch?v=3tlrTPLRxSg,2021-05-10T07:38:06Z,2021,5,10
5,UCIRYBXDze5krPDzAEOxFGVA,Guardian News,MFdccDWOhIw,Colorado man fatally shoots six people at birthday party,A man fatally shot six other people including his girlfriend and then himself at a birthday party in Colorado Springs. A motive has ...,https://www.youtube.com/watch?v=MFdccDWOhIw,2021-05-10T03:42:27Z,2021,5,10
