,channelId,channelTitle,videoId,vidoeTitle,description,link,time,year,month,day
0,UCIRYBXDze5krPDzAEOxFGVA,Guardian News,RxHOtoUYIZo,Free speech protests erupt in Spain after rapper&#39;s arrest,"Protesters marched and clashed with police in several Spanish cities on Tuesday night after the arrest of Pablo Rivadulla, known ...",https://www.youtube.com/watch?v=RxHOtoUYIZo,2021-02-17T18:41:41Z,2021,2,17
1,UCIRYBXDze5krPDzAEOxFGVA,Guardian News,XE0m5obSlRc,Coronavirus: WHO experts answer questions from the public – watch live,Experts from the World Health Organization are expected to answer questions people send in on the Covid-19 pandemic ...,https://www.youtube.com/watch?v=XE0m5obSlRc,2021-02-17T18:10:42Z,2021,2,17
2,UCIRYBXDze5krPDzAEOxFGVA,Guardian News,3w1IIJsOQXw,Donald Trump&#39;s former casino in Atlantic City demolished,Atlantic City authorities have demolished Donald Trump's former casino and hotel complex after it fell into disrepair. It was closed ...,https://www.youtube.com/watch?v=3w1IIJsOQXw,2021-02-17T15:31:33Z,2021,2,17
3,UCIRYBXDze5krPDzAEOxFGVA,Guardian News,3TYfLOpSjv8,Captain Tom: online trolling would have &#39;broken his heart&#39; says daughter,Captain Sir Tom Moore's daughter has said his heart would have been broken to hear about trolling the family received in an ...,https://www.youtube.com/watch?v=3TYfLOpSjv8,2021-02-17T12:55:53Z,2021,2,17
4,UCIRYBXDze5krPDzAEOxFGVA,Guardian News,swRans1O4Ds,World&#39;s most endangered right whale spotted off Spanish island,Divers unwittingly filmed a North Atlantic right whale calf – one of the world's most endangered whales – as they navigated back to ...,https://www.youtube.com/watch?v=swRans1O4Ds,2021-02-17T10:56:43Z,2021,2,17
