,channelId,channelTitle,videoId,vidoeTitle,description,link,time,year,month,day
0,UCIRYBXDze5krPDzAEOxFGVA,Guardian News,K-RmKXxsajA,Boris Johnson: outline of Brexit deal should be &#39;done by July&#39;,"The British prime minister has said there is no reason why the outline of a deal cannot be sealed by the end of next month, after he ...",https://www.youtube.com/watch?v=K-RmKXxsajA,2020-06-15T19:18:17Z,2020,6,15
1,UCIRYBXDze5krPDzAEOxFGVA,Guardian News,hwwUw1WKDpU,Priti Patel gives public order update in parliament amid Black Lives Matter protests  – watch live,The British parliament takes urgent question on the publishing of the two metre distance rule review.,https://www.youtube.com/watch?v=hwwUw1WKDpU,2020-06-15T17:50:22Z,2020,6,15
2,UCIRYBXDze5krPDzAEOxFGVA,Guardian News,lmHTv7huUgU,Coronavirus: WHO holds briefing on developments in the global outbreak – watch live,The World Health Organization holds a briefing on the latest developments of the coronavirus outbreak across the world.,https://www.youtube.com/watch?v=lmHTv7huUgU,2020-06-15T17:43:42Z,2020,6,15
3,UCIRYBXDze5krPDzAEOxFGVA,Guardian News,ieltMmRNaXA,&#39;Trust with the police is broken&#39;: Rayshard Brooks&#39;s family tell of devastation,"The family of Rayshard Brooks, who was shot and killed by a white police officer, have paid tribute to him and told of their ...",https://www.youtube.com/watch?v=ieltMmRNaXA,2020-06-15T17:28:40Z,2020,6,15
4,UCIRYBXDze5krPDzAEOxFGVA,Guardian News,AF2LN_fknh4,Coronavirus: Dominic Raab  holds UK daily briefing – watch live,Dominic Raab and government officials hold a daily briefing on the coronavirus outbreak in the UK.,https://www.youtube.com/watch?v=AF2LN_fknh4,2020-06-15T16:39:06Z,2020,6,15
5,UCIRYBXDze5krPDzAEOxFGVA,Guardian News,PlF7YM0Uy34,Rayshard Brooks&#39;s family hold news conference amid Black Lives Matter protests – watch live,"Rayshard Brooks's widow Tomika Miller and other family members, along with family attorneys hold a news conference.",https://www.youtube.com/watch?v=PlF7YM0Uy34,2020-06-15T16:35:07Z,2020,6,15
6,UCIRYBXDze5krPDzAEOxFGVA,Guardian News,f29mh5ntlw4,‘Porn stars’ deployed in New Zealand government’s online safety campaign,A New Zealand government advertising campaign aimed at promoting online safety for under 18s features two naked 'porn stars'.,https://www.youtube.com/watch?v=f29mh5ntlw4,2020-06-15T07:02:16Z,2020,6,15
7,UCIRYBXDze5krPDzAEOxFGVA,Guardian News,E5DFXZo04HI,"Maria Ressa convicted of &#39;cyber libel&#39;: &#39;If we can&#39;t do our jobs, your rights will be lost&#39;","Maria Ressa, the head of Philippines news website Rappler, known for critical reports about president Rodrigo Duterte, has been ...",https://www.youtube.com/watch?v=E5DFXZo04HI,2020-06-15T03:54:17Z,2020,6,15
8,UCIRYBXDze5krPDzAEOxFGVA,Guardian News,fOZmXXxllo8,Swiss women stage mass scream to demand equal treatment,"Women across Switzerland let loose with screams during a national strike, demanding an end to violence at the hands of men and ...",https://www.youtube.com/watch?v=fOZmXXxllo8,2020-06-15T00:55:11Z,2020,6,15
