,channelId,channelTitle,videoId,vidoeTitle,description,link,time,year,month,day
0,UCIRYBXDze5krPDzAEOxFGVA,Guardian News,zlwSa4AcMIY,Donald Trump on coronavirus travel ban: &#39;We&#39;re in great shape and want to keep it that way&#39;,"Donald Trump spoke to reporters in the Oval Office on Thursday, the morning after he delivered an address to the nation announcing restricted air travel from ...",https://www.youtube.com/watch?v=zlwSa4AcMIY,2020-03-12T19:06:35Z,2020,3,12
1,UCIRYBXDze5krPDzAEOxFGVA,Guardian News,tO-_aV-v7IA,Coronavirus outbreak: health officials testify before the House oversight committee – watch live,"National Institute of Allergy and Infectious Diseases Director Dr Anthony Fauci and Centers for Disease Control and Prevention Director Dr. Robert Redfield, ...",https://www.youtube.com/watch?v=tO-_aV-v7IA,2020-03-12T18:19:25Z,2020,3,12
2,UCIRYBXDze5krPDzAEOxFGVA,Guardian News,STUx3q_WGGo,Shops and pubs close in Italy as prime minister praises citizens&#39; sacrifices,The Italian prime minister Giuseppe Conte ordered on Wednesday night the closure of all non-essential commercial activities to counteract the spread of the ...,https://www.youtube.com/watch?v=STUx3q_WGGo,2020-03-12T11:29:34Z,2020,3,12
3,UCIRYBXDze5krPDzAEOxFGVA,Guardian News,xVLdDA6WWrA,Trump announces travel ban from Europe to the US in bid to stem coronavirus,US president Donald Trump has announced a ban on travellers to the United States from Europe during a televised address to the nation. The ban will be in ...,https://www.youtube.com/watch?v=xVLdDA6WWrA,2020-03-12T10:03:03Z,2020,3,12
4,UCIRYBXDze5krPDzAEOxFGVA,Guardian News,YR_Rgdkibdk,Donald Trump addresses US on coronavirus - watch live,US President Donald Trump addresses the nation as the country battles the coronavirus pandemic. Subscribe to Guardian News on YouTube ...,https://www.youtube.com/watch?v=YR_Rgdkibdk,2020-03-12T01:44:13Z,2020,3,12
