,channelId,channelTitle,videoId,vidoeTitle,description,link,time,year,month,day
0,UCIRYBXDze5krPDzAEOxFGVA,Guardian News,vujAfA6fOVU,Joe Biden: Republicans are in the midst of a &#39;mini-revolution&#39;,The president said he has never seen internal party conflict like the one Republicans are experiencing at the moment and was in ...,https://www.youtube.com/watch?v=vujAfA6fOVU,2021-05-05T19:53:53Z,2021,5,5
1,UCIRYBXDze5krPDzAEOxFGVA,Guardian News,ePmJ0-w2ikk,William and Kate launch YouTube channel: &#39;Be careful what you say&#39;,The Duke and Duchess of Cambridge have launched their first official YouTube channel with a 25-second reel of clips taken from ...,https://www.youtube.com/watch?v=ePmJ0-w2ikk,2021-05-05T17:39:34Z,2021,5,5
2,UCIRYBXDze5krPDzAEOxFGVA,Guardian News,caj1wO-QT6M,Colombia protests: what is driving the deadly unrest?,The UN has condemned the violent repression of protests in Colombia after clashes between police and demonstrators left at ...,https://www.youtube.com/watch?v=caj1wO-QT6M,2021-05-05T16:12:20Z,2021,5,5
3,UCIRYBXDze5krPDzAEOxFGVA,Guardian News,GKcwR7HhDuo,Labour recovery will ‘take longer’ before local elections says Keir Starmer,Labour leader Keir Starmer has warned his party's recovery would take longer than the year he has been at the helm. He said ...,https://www.youtube.com/watch?v=GKcwR7HhDuo,2021-05-05T14:42:54Z,2021,5,5
4,UCIRYBXDze5krPDzAEOxFGVA,Guardian News,z3glBa9jFzo,France threatens to cut Jersey&#39;s electricity over post-Brexit fishing rights,"The French maritime minister, Annick Girardin, warned on Tuesday that France could cut off electricity to the British island of ...",https://www.youtube.com/watch?v=z3glBa9jFzo,2021-05-05T11:16:43Z,2021,5,5
5,UCIRYBXDze5krPDzAEOxFGVA,Guardian News,1FPqiXTstAw,UK Royal Marines test flying jet suit between moving ships,Jet suit developer Gravity Industries and the Royal Marines have spent three days testing the company's latest product's potential ...,https://www.youtube.com/watch?v=1FPqiXTstAw,2021-05-05T07:50:04Z,2021,5,5
