,channelId,channelTitle,videoId,vidoeTitle,description,link,time,year,month,day
0,UCIRYBXDze5krPDzAEOxFGVA,Guardian News,gv_5-e3s_1A,Hundreds of calves stranded at sea suspected for disease,"Hundreds of calves crammed onboard a ship were checked by Spanish government veterinarians after months at sea, suspected ...",https://www.youtube.com/watch?v=gv_5-e3s_1A,2021-02-26T20:47:46Z,2021,2,26
1,UCIRYBXDze5krPDzAEOxFGVA,Guardian News,jsiAqMc1Fxk,Alex Salmond to give evidence at hearing into botched inquiry against him – watch live,The former first minister Alex Salmond is to speak to a Scottish parliament committee about his allegations of a conspiracy against ...,https://www.youtube.com/watch?v=jsiAqMc1Fxk,2021-02-26T19:12:14Z,2021,2,26
2,UCIRYBXDze5krPDzAEOxFGVA,Guardian News,X1HGjmV9mi8,Coronavirus: WHO holds briefing on pandemic – watch live,"Tedros Adhanom Ghebreyesus, director-general of the World Health Organization (WHO) is expected to give briefings on the ...",https://www.youtube.com/watch?v=X1HGjmV9mi8,2021-02-26T18:12:24Z,2021,2,26
3,UCIRYBXDze5krPDzAEOxFGVA,Guardian News,xQjLvnr69D0,&#39;Do not wreck this now&#39;: Jonathan Van Tam warns against breaking lockdown rules early,Jonathan Van Tam has warned people against breaking lockdown rules months ahead of official relaxations especially if they ...,https://www.youtube.com/watch?v=xQjLvnr69D0,2021-02-26T18:10:57Z,2021,2,26
4,UCIRYBXDze5krPDzAEOxFGVA,Guardian News,huhls2pwC4s,Coronavirus UK: Matt Hancock holds press briefing – watch live,Matt Hancock is expected to hold a press briefing on the Covid-19 pandemic.,https://www.youtube.com/watch?v=huhls2pwC4s,2021-02-26T17:47:52Z,2021,2,26
5,UCIRYBXDze5krPDzAEOxFGVA,Guardian News,EXMVtRL8ros,"Shamima Begum cannot return to UK to fight for citizenship, supreme court rules","Shamima Begum, who fled Britain as a schoolgirl to join Islamic State in Syria, lost her case before the supreme court on Friday.",https://www.youtube.com/watch?v=EXMVtRL8ros,2021-02-26T12:21:34Z,2021,2,26
6,UCIRYBXDze5krPDzAEOxFGVA,Guardian News,N4hnA16N5oM,Russian diplomats leave North Korea on hand-powered rail trolley,"In normal times, most diplomats can expect to end a foreign posting with an official – if not always fond – farewell from their hosts ...",https://www.youtube.com/watch?v=N4hnA16N5oM,2021-02-26T10:00:40Z,2021,2,26
7,UCIRYBXDze5krPDzAEOxFGVA,Guardian News,AQP8hRHNAX8,"EU leaders urge vaccination production speed up, warn against exports","Ursula von der Leyen has warned coronavirus vaccine suppliers to honour commitments in the EU, threatening to ban exports.",https://www.youtube.com/watch?v=AQP8hRHNAX8,2021-02-26T01:48:38Z,2021,2,26
