,channelId,channelTitle,videoId,vidoeTitle,description,link,time,year,month,day
0,UCIRYBXDze5krPDzAEOxFGVA,Guardian News,_HUdB9HeXMo,"Coronavirus may never be eradicated, says WHO official","The Covid-19 coronavirus could become endemic like HIV, the World Health Organization has said, warning against any attempt to predict how long it would ...",https://www.youtube.com/watch?v=_HUdB9HeXMo,2020-05-13T19:37:01Z,2020,5,13
1,UCIRYBXDze5krPDzAEOxFGVA,Guardian News,fyzvpK6jvMM,Coronavirus: Robert Jenrick holds UK briefing – watch live,Robert Jenrick and other government officials hold a daily briefing to update on the coronavirus outbreak in the UK. Subscribe to Guardian News on YouTube ...,https://www.youtube.com/watch?v=fyzvpK6jvMM,2020-05-13T17:49:27Z,2020,5,13
2,UCIRYBXDze5krPDzAEOxFGVA,Guardian News,t0RiJufISI8,Coronavirus: WHO holds briefing to update on the outbreak – watch live,Members of the World Health Organisation hold briefing on worldwide developments of the Covid-19 outbreak. Subscribe to Guardian News on YouTube ...,https://www.youtube.com/watch?v=t0RiJufISI8,2020-05-13T17:39:23Z,2020,5,13
3,UCIRYBXDze5krPDzAEOxFGVA,Guardian News,cqLnDhHSJDU,Coronavirus UK: should I be wearing a face mask?,"The UK government has told the public to wear 'cloth face coverings' in crowded places where it's not possible to comply with physical-distancing measures, but ...",https://www.youtube.com/watch?v=cqLnDhHSJDU,2020-05-13T16:03:38Z,2020,5,13
4,UCIRYBXDze5krPDzAEOxFGVA,Guardian News,zClLminnIzY,Mitch McConnell: Obama &#39;should have kept his mouth shut&#39;,"The Senate majority leader, Mitch McConnell, has said Barack Obama should have 'kept his mouth shut' instead of criticising Donald Trump, and called his ...",https://www.youtube.com/watch?v=zClLminnIzY,2020-05-13T15:17:20Z,2020,5,13
5,UCIRYBXDze5krPDzAEOxFGVA,Guardian News,xAU2euHH8v0,Coronavirus: Keir Starmer confronts Boris Johnson at PMQs,Sir Keir Starmer faced off with Boris Johnson during prime minister's questions for the second time since he became Labour leader. Starmer pushed Johnson on ...,https://www.youtube.com/watch?v=xAU2euHH8v0,2020-05-13T14:49:04Z,2020,5,13
6,UCIRYBXDze5krPDzAEOxFGVA,Guardian News,rKzd23g7VdY,Coronavirus: Boris Johnson answers questions at PMQs – watch live,Prime Minister's Questions with Boris Johnson at the dispatch box to answer issues relating to coronavirus pandemic and more. Subscribe to Guardian News on ...,https://www.youtube.com/watch?v=rKzd23g7VdY,2020-05-13T13:00:42Z,2020,5,13
7,UCIRYBXDze5krPDzAEOxFGVA,Guardian News,xCrHjIqHTsE,PMQs: Keir Starmer accuses Boris Johnson of failure to protect care homes,"Sir Keir Starmer has accused the government of being too slow to protect care home residents from coronavirus, quoting figures showing a high number of ...",https://www.youtube.com/watch?v=xCrHjIqHTsE,2020-05-13T12:13:23Z,2020,5,13
