,channelId,channelTitle,videoId,vidoeTitle,description,link,time,year,month,day
0,UC16niRr50-MSBwiO3YDb3RA,BBC News,hMyG21Ioo8M,Milestone for NHS as 15m in UK receive first Covid vaccine - BBC News,The UK has passed a major milestone with more than 15 million people given their first dose of the coronavirus vaccine. In England everyone in the top 4 priority ...,https://www.youtube.com/watch?v=hMyG21Ioo8M,2021-02-14T22:18:00Z,2021,2,14
1,UC16niRr50-MSBwiO3YDb3RA,BBC News,z_SyFyddw9U,Mystery of great white sharks &#39;disappearing&#39; from Cape Town coast - BBC News,"For years, one of South Africa's great tourist attractions has been the opportunity to see great white sharks up close. But barely any great white sharks have been ...",https://www.youtube.com/watch?v=z_SyFyddw9U,2021-02-14T11:48:46Z,2021,2,14
2,UC16niRr50-MSBwiO3YDb3RA,BBC News,Hf2poRCkPVg,The execution of Lisa Montgomery - BBC News,Lisa Montgomery was the first woman to be executed by the federal government in America for nearly 70 years. The 52-year-old strangled pregnant 23-year-old ...,https://www.youtube.com/watch?v=Hf2poRCkPVg,2021-02-14T09:45:17Z,2021,2,14
3,UC16niRr50-MSBwiO3YDb3RA,BBC News,_TwAwSylyh8,Donald Trump impeachment: The debate that led to acquittal - BBC News,Watch the key moments from the US Senate floor during the historic impeachment vote to clear Donald Trump on the charge of inciting the deadly attack on the ...,https://www.youtube.com/watch?v=_TwAwSylyh8,2021-02-14T08:36:47Z,2021,2,14
4,UC16niRr50-MSBwiO3YDb3RA,BBC News,IeIZ-aya7dY,Boris Johnson “optimistic” he can set out plan to ease lockdown in England  - BBC News,The Prime Minister Boris Johnson has said he is optimistic he will be able to set out plans for a cautious easing of restrictions in England. Mr Johnson also said ...,https://www.youtube.com/watch?v=IeIZ-aya7dY,2021-02-13T22:20:15Z,2021,2,13
5,UC16niRr50-MSBwiO3YDb3RA,BBC News,DKGAXTe7HXk,Donald Trump acquitted of inciting insurrection in impeachment trial - BBC News,The former US president Donald Trump has been acquitted of inciting insurrection after last month's storming of the US Capitol building. At the end of his ...,https://www.youtube.com/watch?v=DKGAXTe7HXk,2021-02-13T22:15:44Z,2021,2,13
6,UC16niRr50-MSBwiO3YDb3RA,BBC News,FU1tj8J5ajM,Anti-Putin protester&#39;s arrest video &#39;leaked to scare people&#39; - BBC News,"Vladimir Putin opponent Alexei Navalny's arrest has sparked unprecedented street protests in Russia. With the Kremlin determined to crack down, Russian ...",https://www.youtube.com/watch?v=FU1tj8J5ajM,2021-02-13T17:24:11Z,2021,2,13
7,UC16niRr50-MSBwiO3YDb3RA,BBC News,JnQPtQNiJGg,Myanmar coup: What led to the military seizing power? - BBC News,"When the military seized power through a coup in Myanmar, many around the world were caught by surprise. The Southeast Asian country was on the road to ...",https://www.youtube.com/watch?v=JnQPtQNiJGg,2021-02-13T14:23:28Z,2021,2,13
8,UC16niRr50-MSBwiO3YDb3RA,BBC News,O8Y-_N7NWDA,How video games helped me come to terms with depression - BBC News,"Despite there being an estimated 2.5 billion active gamers around the world, there is a lot of confusion and debate around the effect video games have on our ...",https://www.youtube.com/watch?v=O8Y-_N7NWDA,2021-02-13T09:52:19Z,2021,2,13
9,UC16niRr50-MSBwiO3YDb3RA,BBC News,xDfdl6ZpD7g,"Covid UK: As virus cases drop, how can we safely ease restrictions? - BBC Newsnight",Data suggests levels of covid are going down in all four nations of the United Kingdom. But how can we exit lockdown safely? Please subscribe HERE ...,https://www.youtube.com/watch?v=xDfdl6ZpD7g,2021-02-13T00:27:20Z,2021,2,13
10,UC16niRr50-MSBwiO3YDb3RA,BBC News,lhroJvnznNk,Russian police crack down on opposition activists across country - BBC News,The jailing of Putin critic Alexei Navalny has sparked outrage and protests across Russia. But the Kremlin seems determined to put a stop to them. The police ...,https://www.youtube.com/watch?v=lhroJvnznNk,2021-02-12T22:33:37Z,2021,2,12
11,UC16niRr50-MSBwiO3YDb3RA,BBC News,wPLYzYWaB6Y,Pandemic causes UK’s biggest slump in economic output for 300 years - BBC News,"The UK has seen the biggest fall in economic output for 300 years, due to the coronavirus pandemic. GDP - the total value of goods and services produced in the ...",https://www.youtube.com/watch?v=wPLYzYWaB6Y,2021-02-12T22:13:35Z,2021,2,12
12,UC16niRr50-MSBwiO3YDb3RA,BBC News,tavHN6ZRhqo,The city with the double pandemic - BBC News,"Aida and Daniel are two married paramedics living in Tijuana, Mexico - one of the most violent cities in the world. They thought they were prepared for all ...",https://www.youtube.com/watch?v=tavHN6ZRhqo,2021-02-12T18:30:16Z,2021,2,12
13,UC16niRr50-MSBwiO3YDb3RA,BBC News,fc1h1nOXNIQ,&#39;At least you&#39;re not a cat!&#39; US Congressman gets in a spin - BBC News,US congressman Tom Emmer made an unusual appearance when struggling with his video conferencing technology. The representative brought proceedings ...,https://www.youtube.com/watch?v=fc1h1nOXNIQ,2021-02-12T16:45:01Z,2021,2,12
14,UC16niRr50-MSBwiO3YDb3RA,BBC News,9A_pVLuhN4Q,How Mike Pence became a villain in Trump world - BBC News,"Mike Pence, the former US vice president, used to be seen as Donald Trump's right-hand man. But during the Capitol riots, a pro-Trump mob called the loyal ...",https://www.youtube.com/watch?v=9A_pVLuhN4Q,2021-02-12T15:00:10Z,2021,2,12
15,UC16niRr50-MSBwiO3YDb3RA,BBC News,W4-Yhv60XO0,Northern Ireland Protocol: Can the UK and EU find a solution to its problems? - BBC Newsnight,"Both the UK and EU have admitted there have been ""teething problems"" with the so-called Northern Ireland protocol since it came into force on 1 January.",https://www.youtube.com/watch?v=W4-Yhv60XO0,2021-02-12T13:20:30Z,2021,2,12
16,UC16niRr50-MSBwiO3YDb3RA,BBC News,oNsJbdVi5iE,Driver captures deadly 100-vehicle Texas pile-up - BBC News,"Drivers captured the first moments of a massive deadly pile-up on an icy highway in Fort Worth, Texas. The early morning crash killed at least five and left ...",https://www.youtube.com/watch?v=oNsJbdVi5iE,2021-02-12T13:00:32Z,2021,2,12
17,UC16niRr50-MSBwiO3YDb3RA,BBC News,ks6cooYtr38,Saving Australia&#39;s numbats - BBC News,The numbat - a small and little-known Australian marsupial - is one of the world's most endangered animals. Conservationists are working hard to save them by ...,https://www.youtube.com/watch?v=ks6cooYtr38,2021-02-12T07:00:08Z,2021,2,12
18,UC16niRr50-MSBwiO3YDb3RA,BBC News,Sk8UgUkVGcA,Arthritis drug may cut Covid hospital deaths by half - BBC News,A drug that is normally given to people with arthritis could help save lives in the treatment of Covid 19. A major trial shows that when Tocilizumab is combined ...,https://www.youtube.com/watch?v=Sk8UgUkVGcA,2021-02-11T22:29:54Z,2021,2,11
19,UC16niRr50-MSBwiO3YDb3RA,BBC News,aoP1DpKJhbc,Meghan wins legal battle with Mail on Sunday over “private” letter to her father - BBC News,"Meghan, the Duchess of Sussex, has won a two-year legal battle with the Mail on Sunday over the publication of a letter she wrote to her estranged father, ...",https://www.youtube.com/watch?v=aoP1DpKJhbc,2021-02-11T22:16:41Z,2021,2,11
20,UC16niRr50-MSBwiO3YDb3RA,BBC News,RQQKewYkg2s,Huge boat parade to celebrate Tampa Bay Buccaneers Super Bowl win - BBC News,The Tampa Bay Buccaneers celebrated their recent Super Bowl win with a boat parade on the Hillsborough river. Though cheerleaders from the team wore ...,https://www.youtube.com/watch?v=RQQKewYkg2s,2021-02-11T21:32:26Z,2021,2,11
21,UC16niRr50-MSBwiO3YDb3RA,BBC News,CcauXrkQNak,"Capitol mob got close to Pence, Romney and Schumer, new footage shows - BBC News",Impeachment managers from the Democratic Party released security footage for the first time since the US Capitol riots on 6 January. The videos show US ...,https://www.youtube.com/watch?v=CcauXrkQNak,2021-02-11T16:45:00Z,2021,2,11
22,UC16niRr50-MSBwiO3YDb3RA,BBC News,7lltnkD0y7w,What&#39;s going on in Central African Republic? - BBC News,The Central African Republic's most powerful rebel groups have formed an unlikely alliance against the government. They've captured large parts of the country ...,https://www.youtube.com/watch?v=7lltnkD0y7w,2021-02-11T15:44:37Z,2021,2,11
23,UC16niRr50-MSBwiO3YDb3RA,BBC News,9nLZL5FpYpk,What’s causing unrest in the Netherlands? - BBC Newsnight,"Over the last few weeks, violent protests have broken out in the Netherlands as the country struggles against growing conspiracy theories, political upheaval and ...",https://www.youtube.com/watch?v=9nLZL5FpYpk,2021-02-11T00:42:21Z,2021,2,11
24,UC16niRr50-MSBwiO3YDb3RA,BBC News,lF4vBrRVkx4,“Don’t book a summer holiday” says UK government - BBC News,You should not be booking a holiday this summer - in the UK or abroad - according to the UK government. Going on holiday is currently illegal in the UK.,https://www.youtube.com/watch?v=lF4vBrRVkx4,2021-02-10T22:24:55Z,2021,2,10
25,UC16niRr50-MSBwiO3YDb3RA,BBC News,aZ_MZ-NyvzE,Extra £3.5 billion to remove dangerous cladding is “too little too late” say residents - BBC News,The UK government has announced an extra £3.5 billion to pay for the removal of flammable cladding from high-rise flats in England. More than three and a half ...,https://www.youtube.com/watch?v=aZ_MZ-NyvzE,2021-02-10T22:14:15Z,2021,2,10
26,UC16niRr50-MSBwiO3YDb3RA,BBC News,qcnnI6HD6DU,Lawyer uses Zoom filter by mistake - &#39;I&#39;m not a cat&#39; - BBC News,A lawyer appearing before a judge at a virtual court case via Zoom appeared on screen as a cat - after not realising a filter was switched on. Rod Ponton was ...,https://www.youtube.com/watch?v=qcnnI6HD6DU,2021-02-10T15:11:10Z,2021,2,10
27,UC16niRr50-MSBwiO3YDb3RA,BBC News,s76iBP49-lQ,Why are so many children living in poverty in the UK? - BBC Newsnight,A third of all families with children under five in the UK are living in poverty — that's 1.3 million children. What happens when Covid-19 batters already struggling ...,https://www.youtube.com/watch?v=s76iBP49-lQ,2021-02-10T00:23:20Z,2021,2,10
28,UC16niRr50-MSBwiO3YDb3RA,BBC News,-1f-HUppTy4,Donald Trump’s impeachment trial begins in US Senate - BBC News,"Donald Trump's second impeachment trial has begun in the US Senate. The former president is charged with ""inciting insurrection"" in a speech to supporters ...",https://www.youtube.com/watch?v=-1f-HUppTy4,2021-02-09T23:07:13Z,2021,2,9
29,UC16niRr50-MSBwiO3YDb3RA,BBC News,3JSYgC1891o,"Travellers to England could face £10,000 fines or prison for breaking quarantine rules - BBC News","The UK government has unveiled tough new quarantine measures for anyone arriving in England from outside the UK, including fines and even prison terms for ...",https://www.youtube.com/watch?v=3JSYgC1891o,2021-02-09T22:54:14Z,2021,2,9
30,UC16niRr50-MSBwiO3YDb3RA,BBC News,f9MlTgruBGY,Trump impeachment explained - BBC News,"Donald Trump's second impeachment trial opens on Tuesday, almost a year after his first. He's accused of inciting the 6 Jan attack on the Capitol by a crowd of ...",https://www.youtube.com/watch?v=f9MlTgruBGY,2021-02-09T18:11:47Z,2021,2,9
31,UC16niRr50-MSBwiO3YDb3RA,BBC News,P1T8KT_hOLs,WHO team dismiss theory Covid-19 leaked from Chinese lab - BBC News,"A World Health Organization (WHO) mission investigating the origins of Covid-19 have dismissed a theory that the virus came from a laboratory in Wuhan, China ...",https://www.youtube.com/watch?v=P1T8KT_hOLs,2021-02-09T17:08:29Z,2021,2,9
32,UC16niRr50-MSBwiO3YDb3RA,BBC News,oZ4ar4BdDyA,Myanmar police fire rubber bullets as protesters defy ban - BBC News,"Police in Myanmar fired rubber bullets during a demonstration in the capital Nay Pyi Taw, as thousands defied a ban on protests. One woman is in hospital in a ...",https://www.youtube.com/watch?v=oZ4ar4BdDyA,2021-02-09T16:17:55Z,2021,2,9
33,UC16niRr50-MSBwiO3YDb3RA,BBC News,0BMIioWnR4s,Indian farmer: &#39;Why I&#39;m protesting&#39; - BBC News,"In India, tens of thousands of farmers are continuing to protest government laws they fear will drive them out of business. The government says the reforms, ...",https://www.youtube.com/watch?v=0BMIioWnR4s,2021-02-09T15:09:51Z,2021,2,9
34,UC16niRr50-MSBwiO3YDb3RA,BBC News,WjvFlzepTN0,Utah avalanche: Amazing escape of snowmobilers - BBC News,"Dramatic video captures an avalanche as it buries a group of snowmobilers in eastern Utah. On the same day, another slide in Millcreek Canyon killed four ...",https://www.youtube.com/watch?v=WjvFlzepTN0,2021-02-09T12:43:28Z,2021,2,9
35,UC16niRr50-MSBwiO3YDb3RA,BBC News,cs7vgTbRNc8,Trump impeachment: The terror of being trapped in the US Capitol - BBC News,Three members of the US Congress describe in vivid detail what it was like when rioters stormed the Capitol on 6 January. This week the second impeachment ...,https://www.youtube.com/watch?v=cs7vgTbRNc8,2021-02-09T11:43:42Z,2021,2,9
36,UC16niRr50-MSBwiO3YDb3RA,BBC News,geVquYtVZEs,Capitol riots: A new kind of political extremism? - BBC Newsnight,"Newsnight's International Editor, Gabriel Gatehouse, investigates whether some extremist groups pre-planned the storming of the Capitol before Trump's speech ...",https://www.youtube.com/watch?v=geVquYtVZEs,2021-02-09T00:42:48Z,2021,2,9
37,UC16niRr50-MSBwiO3YDb3RA,BBC News,vuHGfEW4_sA,UK insists AstraZeneca vaccine is effective against South African variant of Covid - BBC News,There's been a concerted effort by the UK government and its scientific advisers to reassure people about the efficacy of its vaccination programme. It follows ...,https://www.youtube.com/watch?v=vuHGfEW4_sA,2021-02-08T22:31:05Z,2021,2,8
38,UC16niRr50-MSBwiO3YDb3RA,BBC News,4MIne4i2UY8,Why is Iran&#39;s nuclear plan a problem? - BBC News,Iran's nuclear programme has been the focus of a long running international crisis - but what do we know about the sites at the heart of the programme and what ...,https://www.youtube.com/watch?v=4MIne4i2UY8,2021-02-08T21:00:01Z,2021,2,8
39,UC16niRr50-MSBwiO3YDb3RA,BBC News,hdmE4NdKAao,Myanmar Coup: two major cities put under curfew - BBC News,"Myanmar military has begun to impose restrictions in some areas, including curfews and limits to gatherings. Huge protests were held on Monday for a third ...",https://www.youtube.com/watch?v=hdmE4NdKAao,2021-02-08T18:07:49Z,2021,2,8
40,UC16niRr50-MSBwiO3YDb3RA,BBC News,avirbVbeVEk,Japan’s suicide rate rises during pandemic  - BBC News,"The number of people taking their own lives rose last year for the first time since 2009, Japan's health ministry has said. Although deaths among men fell slightly, ...",https://www.youtube.com/watch?v=avirbVbeVEk,2021-02-08T16:59:36Z,2021,2,8
