,channelId,channelTitle,videoId,vidoeTitle,description,link,time,year,month,day
0,UCIzXayRP7-P0ANpq-nD-h5g,The Sun,bKxejb4o6Lc,Views of COVID-19 lockdown London before Queen&#39;s address on coronavirus - Watch again,A view of central London two weeks after Prime Minister Boris Johnson ordered people to stay at home and gave powers to the ...,https://www.youtube.com/watch?v=bKxejb4o6Lc,2020-04-05T19:57:39Z,2020,4,5
1,UCIzXayRP7-P0ANpq-nD-h5g,The Sun,gewF4SxTGWQ,The Queen evokes wartime spirit as she thanks NHS and all Brits in COVID-19 TV address,THE Queen evoked the wartime spirit as she thanked Brits and the NHS for their tireless efforts fighting COVID-19 and promised ...,https://www.youtube.com/watch?v=gewF4SxTGWQ,2020-04-05T19:10:18Z,2020,4,5
2,UCIzXayRP7-P0ANpq-nD-h5g,The Sun,gKIdvISZbbg,Matt Hancock and government officials give coronavirus daily briefing - Watch again,Government officials deliver the daily government briefing for UKdevlopments during the coronavirus UK outbreak. Read more UK ...,https://www.youtube.com/watch?v=gKIdvISZbbg,2020-04-05T16:09:58Z,2020,4,5
3,UCIzXayRP7-P0ANpq-nD-h5g,The Sun,Fuuz6TbjhQ0,NHS nurse joining COVID-19 emergency frontline teary about putting herself at risk of coronavirus,A NURSE who has answered the call to rejoin the NHS today has tearfully admitted she knows she's putting her life on the line to ...,https://www.youtube.com/watch?v=Fuuz6TbjhQ0,2020-04-05T15:11:42Z,2020,4,5
4,UCIzXayRP7-P0ANpq-nD-h5g,The Sun,SP8huEbpKVQ,Donald Trump warns America to brace for a &#39;lot of deaths&#39; in the coming week,"'It will be the toughest time' said Donald Trump, as he warns America to brace for a 'lot of deaths' in the coming week.",https://www.youtube.com/watch?v=SP8huEbpKVQ,2020-04-05T10:00:23Z,2020,4,5
5,UCIzXayRP7-P0ANpq-nD-h5g,The Sun,HmM4oUzaMvE,Matt Hancock blasts sunbathers breaking COVID-19 lockdown rules and threatens to ban all exercise,Health Secretary Matt Hancock has blasted sunbathers for breaking coronavirus lockdown rules in public parks - and insisted it's ...,https://www.youtube.com/watch?v=HmM4oUzaMvE,2020-04-05T08:59:58Z,2020,4,5
6,UCIzXayRP7-P0ANpq-nD-h5g,The Sun,HEbRtq2croI,Donald Trump daily briefing on COVID-19 pandemic with Coronavirus Task Force,President Donald Trump and Members of the Coronavirus Task Force brief reporters as the US battles the COVID-19 pandemic.,https://www.youtube.com/watch?v=HEbRtq2croI,2020-04-05T00:51:14Z,2020,4,5
7,UCIzXayRP7-P0ANpq-nD-h5g,The Sun,txaO5PA8kGU,"Child, 5, becomes UK’s youngest COVID-19 victim as 708 more die taking death toll to 4,353",A five-year-old child has become Britain's youngest coronavirus victim as 708 more people lost their lives on the deadliest day yet ...,https://www.youtube.com/watch?v=txaO5PA8kGU,2020-04-04T18:05:14Z,2020,4,4
8,UCIzXayRP7-P0ANpq-nD-h5g,The Sun,pkft0aWe9-Y,Watch again: Michael Gove and government officials give coronavirus daily briefing - LIVE,Michael Gove and government officials give coronavirus daily briefing of the COVID-19 crisis in the UK. Read more UK ...,https://www.youtube.com/watch?v=pkft0aWe9-Y,2020-04-04T15:57:24Z,2020,4,4
9,UCIzXayRP7-P0ANpq-nD-h5g,The Sun,RVWLAC1vtJU,Emergency COVID-19 shipments of ventilators and personal protective gear from China land in the UK,A flight from China carrying a shipment of COVID-19 life-saving ventilators and personal protective gear from China lands in ...,https://www.youtube.com/watch?v=RVWLAC1vtJU,2020-04-04T15:17:54Z,2020,4,4
10,UCIzXayRP7-P0ANpq-nD-h5g,The Sun,JbOakNL-XqE,New Labour leader elect Keir Starmer gives acceptance speech &amp; vows to oust party&#39;s anti-Semitism,"Sir Keir Starmer has been crowned Labour leader. Sir Keir was the favourite all along to win the competition, and will now finally ...",https://www.youtube.com/watch?v=JbOakNL-XqE,2020-04-04T10:10:59Z,2020,4,4
11,UCIzXayRP7-P0ANpq-nD-h5g,The Sun,bEQQfLWZOvU,How the UK failed COVID-19 testing whilst Germany and South Korea succeed,"Matthew Lesh, Head of Research at the Adam Smith Institue argues why the UK failed to test enough people quick enough, ...",https://www.youtube.com/watch?v=bEQQfLWZOvU,2020-04-04T08:00:24Z,2020,4,4
12,UCIzXayRP7-P0ANpq-nD-h5g,The Sun,WaGQpHiAG9I,China holds moment of mourning for victims of coronavirus outbreak that’s swept the world,China held a three-minute moment of mourning across the country early Saturday to honor those who have died during the ...,https://www.youtube.com/watch?v=WaGQpHiAG9I,2020-04-04T07:07:40Z,2020,4,4
13,UCIzXayRP7-P0ANpq-nD-h5g,The Sun,_O39dQ_XFdg,Donald Trump daily briefing on COVID-19 pandemic with Coronavirus Task Force,President Donald Trump and Members of the Coronavirus Task Force brief reporters as the US battles the COVID-19 pandemic.,https://www.youtube.com/watch?v=_O39dQ_XFdg,2020-04-03T23:53:27Z,2020,4,3
14,UCIzXayRP7-P0ANpq-nD-h5g,The Sun,dn_8kR_E9jA,President Donald Trump explains why he won’t wear a face mask despite CDC recommendations,"PRESIDENT Donald Trump revealed why he is currently choosing not to wear a face mask, claiming 'I just don't see it for myself'.",https://www.youtube.com/watch?v=dn_8kR_E9jA,2020-04-03T23:38:01Z,2020,4,3
15,UCIzXayRP7-P0ANpq-nD-h5g,The Sun,Bkq39u5nGP4,Matt Hancock and government officials give coronavirus daily briefing,Matt Hancock will be delivering the daily government briefing for the second day in a row since recovering from COVID-19.,https://www.youtube.com/watch?v=Bkq39u5nGP4,2020-04-03T17:15:58Z,2020,4,3
16,UCIzXayRP7-P0ANpq-nD-h5g,The Sun,eQKj6ScTJuw,Matt Hancock demands public stay home in COVID-19 lockdown despite sunny weekend weather,"Health Secretary Matt Hancock said: ""We cannot relax our discipline now. If we do, people will die. ""This advice is not a request, ...",https://www.youtube.com/watch?v=eQKj6ScTJuw,2020-04-03T17:16:15Z,2020,4,3
17,UCIzXayRP7-P0ANpq-nD-h5g,The Sun,Yc1WmUe1Rog,NHS doctor suffering from COVID-19 describes feeling &#39;terrible aching muscles and bones&#39;,"Dr David Hepburn works in an intensive care unit (ICU) taking care of coronavirus patients. Two weeks ago he caught COVID-19, ...",https://www.youtube.com/watch?v=Yc1WmUe1Rog,2020-04-03T14:30:05Z,2020,4,3
18,UCIzXayRP7-P0ANpq-nD-h5g,The Sun,ZZNR8hMhegk,India&#39;s COVID-19 cases rise to 2567 as the country braces for chaos,"India has now instigated a tough lockdown scheme on its citizens, aimed at preventing the spread of the deadly coronavirus ...",https://www.youtube.com/watch?v=ZZNR8hMhegk,2020-04-03T13:34:14Z,2020,4,3
19,UCIzXayRP7-P0ANpq-nD-h5g,The Sun,0XSKoGsRDxM,PM urges Brits to stay home this Easter as fair weather could see public flouting COVID-19 lockdown,Prime Minister Boris Johnson urged locked-down Brits to continue staying at home to help fight the coronavirus pandemic this ...,https://www.youtube.com/watch?v=0XSKoGsRDxM,2020-04-03T12:35:12Z,2020,4,3
20,UCIzXayRP7-P0ANpq-nD-h5g,The Sun,Uk64NBpo_XQ,Prince Charles hails ‘unbelievable feat of work’ as he opens coronavirus hospital NHS Nightingale,"PRINCE Charles today hailed the ""unbelievable feat of work"" that saw a new 4000-bed coronavirus hospital opened in just nine ...",https://www.youtube.com/watch?v=Uk64NBpo_XQ,2020-04-03T11:56:34Z,2020,4,3
21,UCIzXayRP7-P0ANpq-nD-h5g,The Sun,x1Qp4whzMDo,Donald Trump repatriates Brits on COVID-19 cruise ships docking in Florida after four die on board,TWO cruise ships full of coronavirus cases were allowed to unload passengers in Florida after four people died on one of the ...,https://www.youtube.com/watch?v=x1Qp4whzMDo,2020-04-03T10:32:21Z,2020,4,3
22,UCIzXayRP7-P0ANpq-nD-h5g,The Sun,hiiRoUbZBN8,Matt Hancock says PM is &#39;working hard to do what&#39;s needed from home&#39; despite having COVID-19,Matt Hancock says the PM Boris Johnson 'is working very hard from home and doing what is needed' despite recovering from ...,https://www.youtube.com/watch?v=hiiRoUbZBN8,2020-04-03T08:49:04Z,2020,4,3
23,UCIzXayRP7-P0ANpq-nD-h5g,The Sun,cjCVCH7SHlA,Is Sweden heading to a COVID-19 catastrophe after refusing lockdown?,"Sweden's refusal to go into coronavirus lockdown is leading the country towards catastrophe, scientists have warned. Daily life is ...",https://www.youtube.com/watch?v=cjCVCH7SHlA,2020-04-03T07:00:14Z,2020,4,3
24,UCIzXayRP7-P0ANpq-nD-h5g,The Sun,x0EaU-dNSME,Donald Trump tests negative for coronavirus a second time and slams Pelosi’s new ‘partisan’ probe,DONALD Trump tested negative for coronavirus again after taking a new test which he described as 'much more pleasant'.,https://www.youtube.com/watch?v=x0EaU-dNSME,2020-04-03T00:30:05Z,2020,4,3
25,UCIzXayRP7-P0ANpq-nD-h5g,The Sun,k0ejrMwRcqM,Donald Trump daily briefing on COVID-19 pandemic with Coronavirus Task Force,President Donald Trump and Members of the Coronavirus Task Force brief reporters as the US battles the COVID-19 pandemic.,https://www.youtube.com/watch?v=k0ejrMwRcqM,2020-04-03T00:27:41Z,2020,4,3
26,UCIzXayRP7-P0ANpq-nD-h5g,The Sun,0eCPNtTjcz4,Quarantined Boris Johnson joins millions apploauding COVID-19 NHS frontline staff for second time,"PM Boris Johnson looked a little under the weather but still joined the nationwide display of gratitude, by joining Clap for Carers ...",https://www.youtube.com/watch?v=0eCPNtTjcz4,2020-04-02T21:36:42Z,2020,4,2
27,UCIzXayRP7-P0ANpq-nD-h5g,The Sun,foAYpXqzUtQ,Matt Hancock and government officials give coronavirus daily briefing - Replay,Health Secretary Matt Hancock returns to Westminster today after a week in self-isolation and will unveil a new five-point plan he ...,https://www.youtube.com/watch?v=foAYpXqzUtQ,2020-04-02T18:21:24Z,2020,4,2
28,UCIzXayRP7-P0ANpq-nD-h5g,The Sun,qrF6Z8s5dmw,Matt Hancock gives first coronavirus briefing since coming out of isolation,Health Secretary Matt Hancock returned to Westminster today after a week in self-isolation and unveiled a new five-point plan he ...,https://www.youtube.com/watch?v=qrF6Z8s5dmw,2020-04-02T18:04:43Z,2020,4,2
29,UCIzXayRP7-P0ANpq-nD-h5g,The Sun,QEEOMRYjmLQ,"Coronavirus Explained: As UK promised more COVID-19 tests, when will a virus vaccine be ready?",BORIS Johnson has vowed to fight the coronavirus lockdown with testing for as many people as possible. The PM told the nation ...,https://www.youtube.com/watch?v=QEEOMRYjmLQ,2020-04-02T15:30:06Z,2020,4,2
30,UCIzXayRP7-P0ANpq-nD-h5g,The Sun,vc06w42q2Ps,"COVID-19 hits UK economy as deaths reach 2,921",Former Chair of the British Chambers of Commerce John Longworth gives his view on the effect of coronavirus on the UK ...,https://www.youtube.com/watch?v=vc06w42q2Ps,2020-04-02T13:43:05Z,2020,4,2
31,UCIzXayRP7-P0ANpq-nD-h5g,The Sun,cF7tPQQ5-UI,Public Health England boss says ramping up UK COVID-19 testing rates &#39;isn&#39;t easy&#39;,"MASS testing for coronavirus is the key to lifting the lockdown, experts have said. But while countries like Germany test around ...",https://www.youtube.com/watch?v=cF7tPQQ5-UI,2020-04-02T12:30:13Z,2020,4,2
32,UCIzXayRP7-P0ANpq-nD-h5g,The Sun,66OenbDsgz8,Is this the solution to the COVID-19 vaccine?,"Professor Angus Dalgliesh believes he may have found a solution to the coronavirus vaccine, a drug he has used on cancer ...",https://www.youtube.com/watch?v=66OenbDsgz8,2020-04-02T11:30:02Z,2020,4,2
33,UCIzXayRP7-P0ANpq-nD-h5g,The Sun,0a4AK_g9fHA,COVID-19 symptoms so bad the NHS sent an ambulance ’I was left gasping for air&#39;,"Jozef Wallis, 40, ended up in an intensive care unit after contracting coronavirus. On 11 March, the tech boss went for drinks in the ...",https://www.youtube.com/watch?v=0a4AK_g9fHA,2020-04-02T10:33:08Z,2020,4,2
34,UCIzXayRP7-P0ANpq-nD-h5g,The Sun,nvMiHNnWgFQ,Temporary COVID-19 morgue built in London as hundreds die in coronavirus hotspot,A temporary morgue is being built in London as 759 people were killed by coronavirus in the capital. The makeshift mortuary is ...,https://www.youtube.com/watch?v=nvMiHNnWgFQ,2020-04-02T09:10:50Z,2020,4,2
35,UCIzXayRP7-P0ANpq-nD-h5g,The Sun,xF-lTHYEVl8,Donald Trump daily briefing on COVID-19 pandemic with Coronavirus Task Force,President Donald Trump and Members of the Coronavirus Task Force brief reporters as the US battles the COVID-19 pandemic.,https://www.youtube.com/watch?v=xF-lTHYEVl8,2020-04-02T02:36:35Z,2020,4,2
36,UCIzXayRP7-P0ANpq-nD-h5g,The Sun,8kGBBgtkuww,Donald Trump warns &#39;horrific&#39; days ahead as US runs out of COVID-19  medical protective gear,"PRESIDENT Trump cautioned Americans about the ""horrific"" days ahead as the nation's stockpile of medical supplies dwindles to ...",https://www.youtube.com/watch?v=8kGBBgtkuww,2020-04-02T00:01:01Z,2020,4,2
37,UCIzXayRP7-P0ANpq-nD-h5g,The Sun,YJNuQMfSfjI,Boris Johnson vows ramping up COVID-19 testing is how UK will &#39;defeat coronavirus&#39;,Prime Minister Boris Johnson insists the government will be ramping up testing of COVID-19 in response to criticisms the UK ...,https://www.youtube.com/watch?v=YJNuQMfSfjI,2020-04-01T20:39:37Z,2020,4,1
38,UCIzXayRP7-P0ANpq-nD-h5g,The Sun,rmyuORHvCA4,COVID-19 kills 908 Americans in 24hrs making the US a coronavirus hotspot as deaths exceed 4000,"Much like China and Italy before, the United States of America has now become the world's largest coronavirus hotspot, with ...",https://www.youtube.com/watch?v=rmyuORHvCA4,2020-04-01T19:00:18Z,2020,4,1
39,UCIzXayRP7-P0ANpq-nD-h5g,The Sun,Mh2eutwh_dA,"UK coronavirus deaths spike by 50 per cent as 563 die in one day taking total to 2,352",Business Secretary Alok Sharma delivered the shocking statistic update on the COVID-19 outbreak in the UK at the daily briefing ...,https://www.youtube.com/watch?v=Mh2eutwh_dA,2020-04-01T18:00:06Z,2020,4,1
40,UCIzXayRP7-P0ANpq-nD-h5g,The Sun,JG2DZdU69Aw,"Coronavirus Explained: As UK death toll skyrockets, could there be a second outbreak of COVID-19?",Deaths due to coronavirus jumped by 50 per cent on Wednesday as 563 people died in 24 hours. The total death toll now stands ...,https://www.youtube.com/watch?v=JG2DZdU69Aw,2020-04-01T17:00:09Z,2020,4,1
41,UCIzXayRP7-P0ANpq-nD-h5g,The Sun,CYdDLymA7aM,Alok Sharma and government officials give coronavirus daily briefing - Replay,Business Secretary Alok Sharma and government officials deliver daily briefing providing an update on the COVID-19 outbreak in ...,https://www.youtube.com/watch?v=CYdDLymA7aM,2020-04-01T16:31:29Z,2020,4,1
42,UCIzXayRP7-P0ANpq-nD-h5g,The Sun,t7g4gKCnUhQ,"UK &#39;ramping up&#39; COVID-19 testing to 25,000 a day after government criticised for being too slow","Cabinet Minister, Robert Jenrick, claims the UK now have the capacity to test 25000 people for coronavirus daily in the UK by the ...",https://www.youtube.com/watch?v=t7g4gKCnUhQ,2020-04-01T14:31:06Z,2020,4,1
43,UCIzXayRP7-P0ANpq-nD-h5g,The Sun,D9Y5AeVwZgM,Prince Charles&#39; message to Britain after recovering from coronavirus,"Prince Charles' message to Britain after recovering from COVID-19.The royal describes coronavirus lockdown as ""strange, ...",https://www.youtube.com/watch?v=D9Y5AeVwZgM,2020-04-01T12:33:42Z,2020,4,1
44,UCIzXayRP7-P0ANpq-nD-h5g,The Sun,Xg5SC3mPiOI,Pregnant mum recovering from COVID-19 tearful excitement as she&#39;s discharged from hospital,A pregnant mum who was so ill with coronavirus last week she was in hospital shares tearful excitement as 'she can go home and ...,https://www.youtube.com/watch?v=Xg5SC3mPiOI,2020-04-01T10:45:48Z,2020,4,1
45,UCIzXayRP7-P0ANpq-nD-h5g,The Sun,3P9nph0TbxY,"Donald Trump warns 100,000 Americans will die from coronavirus in &#39;very painful&#39; few weeks","President Donald Trump warns of 'very, very painful' two weeks ahead and asks the public to wear masks rather than competing ...",https://www.youtube.com/watch?v=3P9nph0TbxY,2020-04-01T09:26:17Z,2020,4,1
46,UCIzXayRP7-P0ANpq-nD-h5g,The Sun,lLOT9EDHX2k,&#39;We need a reset&#39; Iain Duncan Smith takes on China&#39;s COVID-19 response,Iain Duncan Smith takes on China's response to the coronavirus outbreak by calling for a reset in relations between the UK and ...,https://www.youtube.com/watch?v=lLOT9EDHX2k,2020-04-01T07:00:24Z,2020,4,1
47,UCIzXayRP7-P0ANpq-nD-h5g,The Sun,mRnhAALnTPQ,Trump administration gives update on the Covid-19 pandemic with the Coronavirus Task Force,Members of the Coronavirus Task Force brief reporters as the US battles the the Covid-19 pandemic From Brexit breaking news to ...,https://www.youtube.com/watch?v=mRnhAALnTPQ,2020-04-01T00:35:36Z,2020,4,1
48,UCIzXayRP7-P0ANpq-nD-h5g,The Sun,rKsVY4j5uSM,Vladimir Putin refuses to self-isolate after shaking hands with doctor who now has COVID-19,"FEARS have been raised for Vladimir Putin's health after he shook hands with Russia's top coronavirus doctor, who has now ...",https://www.youtube.com/watch?v=rKsVY4j5uSM,2020-03-31T18:30:04Z,2020,3,31
49,UCIzXayRP7-P0ANpq-nD-h5g,The Sun,C4fZ42gQc-E,"UK COVID-19 death rate doubles as 381 die in 24 hours and 25,150 positive cases","UK coronavirus death rate doubles as 381 including teen, 19, with no health problems die in 24 hours. THE UK coronavirus death ...",https://www.youtube.com/watch?v=C4fZ42gQc-E,2020-03-31T17:30:00Z,2020,3,31
