,channelId,channelTitle,videoId,vidoeTitle,description,link,time,year,month,day
0,UCIzXayRP7-P0ANpq-nD-h5g,The Sun,KF4IF4maScs,Nasa astronauts return to Earth in historic first ‘splashdown’ in 45 years,"TWO Nasa astronauts have arrived back on Earth in a historic first ""splashdown"" in 45 years. Doug Hurley and Bob Behnken ...",https://www.youtube.com/watch?v=KF4IF4maScs,2020-08-02T19:20:54Z,2020,8,2
1,UCIzXayRP7-P0ANpq-nD-h5g,The Sun,NxKD_gliJSY,Prince William correctly predicts scoreline as he hosts FA Cup viewing party at Sandringham estate,The Duke of Cambridge correctly predicts the scoreline of the FA Cup final when speaking to guests at his FA Cup viewing party in ...,https://www.youtube.com/watch?v=NxKD_gliJSY,2020-08-02T15:14:12Z,2020,8,2
2,UCIzXayRP7-P0ANpq-nD-h5g,The Sun,quvBOiWZJ3Q,Nasa astronauts start flight home in SpaceX capsule despite Storm Isaias threatening splashdown,TWO American astronauts have been sent from space back to Florida — despite Tropical Storm Isaias threatening the Sunshine ...,https://www.youtube.com/watch?v=quvBOiWZJ3Q,2020-08-02T00:47:29Z,2020,8,2
3,UCIzXayRP7-P0ANpq-nD-h5g,The Sun,mvAlXPGiJr8,Portland protesters burn American flags as Trump vows ‘clean up of anarchists’,DONALD Trump said federal agents will not leave Portland unless local police “complete cleanup of Anarchists and Agitators” as ...,https://www.youtube.com/watch?v=mvAlXPGiJr8,2020-08-01T19:56:07Z,2020,8,1
4,UCIzXayRP7-P0ANpq-nD-h5g,The Sun,OUEtGa3XSxE,Donald Trump says he is considering banning TikTok,PRESIDENT Donald Trump says he plans to officially ban TikTok in the US. Trump made the announcement on Air Force One on ...,https://www.youtube.com/watch?v=OUEtGa3XSxE,2020-08-01T10:48:10Z,2020,8,1
5,UCIzXayRP7-P0ANpq-nD-h5g,The Sun,CfGWl_MovUM,UK beaches packed on hottest day of 2020 despite pleas to stay at home due to coronavirus pandemic,"Beaches across the UK were packed today as the nation experiences its hottest day of the year, and would could be the hottest ...",https://www.youtube.com/watch?v=CfGWl_MovUM,2020-07-31T15:10:01Z,2020,7,31
6,UCIzXayRP7-P0ANpq-nD-h5g,The Sun,NwAFbi2w0nA,Communist China&#39;s great confrontation with the West explained by Dr Alan Mendoza - BQ #26,Dr Alan Mendoza is a founding member of the foreign policy think tank the Henry Jackson Society and an expert on China and ...,https://www.youtube.com/watch?v=NwAFbi2w0nA,2020-07-31T12:43:44Z,2020,7,31
7,UCIzXayRP7-P0ANpq-nD-h5g,The Sun,3lQ7s4uCpec,Live: Boris Johnson halts easing coronavirus lockdown as UK coronavirus infections rise,BORIS Johnson is today set to hit the brakes on easing the coronavirus lockdown. The Prime Minister will give a press conference ...,https://www.youtube.com/watch?v=3lQ7s4uCpec,2020-07-31T12:10:12Z,2020,7,31
8,UCIzXayRP7-P0ANpq-nD-h5g,The Sun,Xe62iJb-tIk,British dad whose penis dropped off has new one built on his ARM in world first,A dad who lost his penis to a horrific blood infection has become the first man in the world to have a new one built on his arm.,https://www.youtube.com/watch?v=Xe62iJb-tIk,2020-07-31T10:36:02Z,2020,7,31
9,UCIzXayRP7-P0ANpq-nD-h5g,The Sun,RezwRoji8nk,Chaos &amp; confusion as 4.5million hit by new bombshell lockdown rules with less than 3 hours’ warning,Bombshell new coronavirus rules have left Brits confused after 4.5million people were issued with fresh lockdown demands with ...,https://www.youtube.com/watch?v=RezwRoji8nk,2020-07-31T08:43:34Z,2020,7,31
10,UCIzXayRP7-P0ANpq-nD-h5g,The Sun,ciIpJhFmyBs,Trump holds a news conference following tweet about delaying November US election,US President Donald Trump holds a news conference on the response to the novel coronavirus pandemic and other issues From ...,https://www.youtube.com/watch?v=ciIpJhFmyBs,2020-07-30T22:50:33Z,2020,7,30
11,UCIzXayRP7-P0ANpq-nD-h5g,The Sun,wNa1iM1uVAk,LIVE: NASA launches Mars 2020 Perseverance Rover with first aircraft to fly on another planet,NASA is firing its most advanced rover yet to Mars today in a bold bid to hunt down signs of alien life on the planet's surface.,https://www.youtube.com/watch?v=wNa1iM1uVAk,2020-07-30T14:11:14Z,2020,7,30
12,UCIzXayRP7-P0ANpq-nD-h5g,The Sun,HGSPO9K2kuA,PM says there are 10 to 30 UK coronavirus hotspots &#39;bubbling up&#39; where we need tough local lockdowns,Boris Johnson says the UK is not 'out of the woods yet' with coronavirus and it's 'absolutely vital' that we continue to 'keep our ...,https://www.youtube.com/watch?v=HGSPO9K2kuA,2020-07-30T13:04:59Z,2020,7,30
13,UCIzXayRP7-P0ANpq-nD-h5g,The Sun,DajpDKJKMcU,COVID isolation to increase from 7 days to 10 days as &#39;second wave&#39; hits Europe,Matt Hancock has said the UK will be increasing the time those with symptoms of the virus must self isolate from 7 days to 10 days ...,https://www.youtube.com/watch?v=DajpDKJKMcU,2020-07-30T11:40:46Z,2020,7,30
14,UCIzXayRP7-P0ANpq-nD-h5g,The Sun,7fzfp0Jgypk,Trump &#39;never confronted&#39; Putin about bounty reports alleging &#39;Russia paid Taliban to kill US troops&#39;,President Donald Trump said he never questioned Russian leader Vladimir Putin about US intelligence reports that Moscow paid ...,https://www.youtube.com/watch?v=7fzfp0Jgypk,2020-07-30T10:00:03Z,2020,7,30
15,UCIzXayRP7-P0ANpq-nD-h5g,The Sun,DmOe6e0b6Mc,Amazon compared to heroin dealer and Facebook blasted for ‘neutralising’ rivals as CEOs roasted,"FACEBOOK'S Mark Zuckerberg was criticised for ""neutralising"" rivals and Amazon was compared to a heroin dealer when the ...",https://www.youtube.com/watch?v=DmOe6e0b6Mc,2020-07-30T09:00:25Z,2020,7,30
16,UCIzXayRP7-P0ANpq-nD-h5g,The Sun,XzqrwsPtLxE,"Live: CEOs of Amazon, Apple, Facebook and Google face antitrust hearing",The chief executives of US technology giants are set to tell Congress they face stiff competition that motivates them to keep ...,https://www.youtube.com/watch?v=XzqrwsPtLxE,2020-07-29T23:16:24Z,2020,7,29
17,UCIzXayRP7-P0ANpq-nD-h5g,The Sun,8WRmlwjWvNw,Freight train derails and bursts into flames in Arizona causing bridge collapse,"A freight train in Tempe, Arizona derailed on Wednesday morning causing a massive fire and part of the bridge to collapse.",https://www.youtube.com/watch?v=8WRmlwjWvNw,2020-07-29T16:45:00Z,2020,7,29
18,UCIzXayRP7-P0ANpq-nD-h5g,The Sun,UUDLz-0ygk0,Coronavirus: Is Boris Johnson right about a &#39;second wave&#39; of COVID-19 in Europe,"BORIS Johnson today warned that Europe was on the verge of a second wave and the UK must be ""vigilant"" - as he defended the ...",https://www.youtube.com/watch?v=UUDLz-0ygk0,2020-07-29T15:43:47Z,2020,7,29
19,UCIzXayRP7-P0ANpq-nD-h5g,The Sun,xxetiIdgjHk,Two migrants trying to reach UK hidden in Brit family&#39;s roof box wound up 100 miles deeper in France,"Two migrants who tried to reach Britain hidden in a car roof box ended up heading 100 miles back into France. The pair, both 16 ...",https://www.youtube.com/watch?v=xxetiIdgjHk,2020-07-29T14:09:35Z,2020,7,29
20,UCIzXayRP7-P0ANpq-nD-h5g,The Sun,wGeiiJWejNc,Austin police release footage showing cop&#39;s fatal shooting of unarmed man,"The Austin Police Department released footage of the moment officers shot dead a Texas man, Michael Ramos, who announced ...",https://www.youtube.com/watch?v=wGeiiJWejNc,2020-07-29T13:00:15Z,2020,7,29
21,UCIzXayRP7-P0ANpq-nD-h5g,The Sun,Lhi7PlHutuQ,Heathrow boss urges airport testing to cut COVID quarantine times for holidaymakers,The CEO of Heathrow airport has called for the government to test passengers on their arrival. John Holland-Kaye told ...,https://www.youtube.com/watch?v=Lhi7PlHutuQ,2020-07-29T11:49:49Z,2020,7,29
22,UCIzXayRP7-P0ANpq-nD-h5g,The Sun,O0tFvyuscv8,Family panic as they find three bears trashing their kitchen and eating out of the bin,THREE little black bears entered an Alaska home last week and wreaked havoc in the kitchen before leaving the household ...,https://www.youtube.com/watch?v=O0tFvyuscv8,2020-07-29T10:06:28Z,2020,7,29
23,UCIzXayRP7-P0ANpq-nD-h5g,The Sun,i4OYytzSlRw,Donald Trump says &#39;nobody likes me&#39; and cuts short presser after difficult questioning,US President Donald Trump questions why he's not as popular as his coronavirus task force experts. The president lamented that ...,https://www.youtube.com/watch?v=i4OYytzSlRw,2020-07-29T08:25:55Z,2020,7,29
24,UCIzXayRP7-P0ANpq-nD-h5g,The Sun,_2wdxPrdugo,Virgin Galactic unveils cabin of SpaceShipTwo rocket plane that will carry tourists to space,VIRGIN Galactic has unveiled the sci-fi cabin where passengers will one day gaze at Earth after paying $250000 (£175000) for a ...,https://www.youtube.com/watch?v=_2wdxPrdugo,2020-07-28T19:10:49Z,2020,7,28
25,UCIzXayRP7-P0ANpq-nD-h5g,The Sun,VY8hPa7706M,&quot;What&#39;s another two weeks?&quot; - Brits plan to travel overseas despite UK COVID-19 quarantine risk,Holidaymakers returning to the UK from Spain must now self isolate on their return to the country for 14 days. The closure of the ...,https://www.youtube.com/watch?v=VY8hPa7706M,2020-07-28T17:30:01Z,2020,7,28
26,UCIzXayRP7-P0ANpq-nD-h5g,The Sun,VpTuCAnwiBI,Boycott of Twitter over Wiley&#39;s anti-Semitic Tweets as Chief Rabbi slams company,Thousands of people are boycotting the social media company Twitter after accusing the platform of allowing racist comments to ...,https://www.youtube.com/watch?v=VpTuCAnwiBI,2020-07-28T16:30:01Z,2020,7,28
27,UCIzXayRP7-P0ANpq-nD-h5g,The Sun,KyZRrvGWiC0,Amber Heard says it was ‘incredibly painful’ to relive Johnny Depp break-up in bombshell trial,"Amber Heard today said it was ""incredibly painful"" to relieve the ""traumatic"" details of her split with Johnny Depp at the end of the ...",https://www.youtube.com/watch?v=KyZRrvGWiC0,2020-07-28T15:42:23Z,2020,7,28
28,UCIzXayRP7-P0ANpq-nD-h5g,The Sun,cQxHJ4Xcc5g,Malaysian ex-PM Najib Razak plans to appeal after getting 12-year jail term in 1MDB corruption trial,A court in Malaysia has sentenced former PM Najib Razak to 12 years in jail after finding him guilty on all seven counts in the first ...,https://www.youtube.com/watch?v=cQxHJ4Xcc5g,2020-07-28T14:48:57Z,2020,7,28
29,UCIzXayRP7-P0ANpq-nD-h5g,The Sun,slLS-xcOk0E,Madeleine McCann cops with sniffer dogs dig up allotment in German city where Christian B lived,German cops have dug up a garden in Hanover believed to be linked to the disappearance of Madeleine McCann. Forensic ...,https://www.youtube.com/watch?v=slLS-xcOk0E,2020-07-28T13:21:10Z,2020,7,28
30,UCIzXayRP7-P0ANpq-nD-h5g,The Sun,67QHlqj_sTc,Government &#39;set to cut&#39; 14 day COVID quarantine to just 10 days in bid to defuse tensions with Spain,The government are set to cut the current requirement for people entering the UK from certain destinations from a 14-day ...,https://www.youtube.com/watch?v=67QHlqj_sTc,2020-07-28T12:00:03Z,2020,7,28
31,UCIzXayRP7-P0ANpq-nD-h5g,The Sun,y6Ffjh-GmaQ,"&#39;Europe on verge of Covid second wave&#39;, Boris Johnson says as he defends Spain quarantine","BORIS Johnson today warned that Europe was on the verge of a second wave and the UK must be ""vigilant"" - as he defended the ...",https://www.youtube.com/watch?v=y6Ffjh-GmaQ,2020-07-28T11:14:05Z,2020,7,28
32,UCIzXayRP7-P0ANpq-nD-h5g,The Sun,CCDnNRxnu00,Spanish PM blasts UK Government forcing tourists returning home from Spain to isolate for two weeks,Spain's PM has hit back at Britain's quarantine U-turn insisting the Balearic and Canary Islands and parts of the Costas are safer ...,https://www.youtube.com/watch?v=CCDnNRxnu00,2020-07-28T08:26:12Z,2020,7,28
33,UCIzXayRP7-P0ANpq-nD-h5g,The Sun,4x-8ncygrxE,President Trump wears a masks as he tours a FUJIFILM facility that&#39;s working on Covid-19 vaccines,U.S. President Donald Trump takes a tour of the Fujifilm Diosynth Biotechnologies' Innovation Center - a pharmaceutical ...,https://www.youtube.com/watch?v=4x-8ncygrxE,2020-07-27T21:53:48Z,2020,7,27
34,UCIzXayRP7-P0ANpq-nD-h5g,The Sun,-87GIeBGmF0,France &amp; Germany could be added to quarantine list after COVID-19 spike hits Europe,Fears are growing that France and Germany may be added to the UK's quarantine list after tourists in Spain were told to self ...,https://www.youtube.com/watch?v=-87GIeBGmF0,2020-07-27T15:24:39Z,2020,7,27
35,UCIzXayRP7-P0ANpq-nD-h5g,The Sun,BaH3LJPUkO0,"Jeep mows into Black Lives Matter march before protester fires gun, injuring two people in Colorado","A Jeep mowed into a Black Lives Matter march before one protester opened fire, injuring at least two people. One demonstrator ...",https://www.youtube.com/watch?v=BaH3LJPUkO0,2020-07-27T13:18:50Z,2020,7,27
36,UCIzXayRP7-P0ANpq-nD-h5g,The Sun,J2-Zs2t2DiA,"&#39;I was way overweight in ICU&#39;, admits PM as he launches plan to get Brits fit to fight COVID-19",Coronavirus latest: Boris Johnson has announced plans to get the public fit and healthy and to fight obesity through a new ...,https://www.youtube.com/watch?v=J2-Zs2t2DiA,2020-07-27T11:36:18Z,2020,7,27
37,UCIzXayRP7-P0ANpq-nD-h5g,The Sun,ZjyPS3MHGw4,BLM protester shot dead in Austin who was pushing fiancee in wheelchair moments before attack,The Black Lives Matter protester shot dead on Saturday night at a demonstration in Austin has been identified. Garrett Foster was ...,https://www.youtube.com/watch?v=ZjyPS3MHGw4,2020-07-27T10:25:34Z,2020,7,27
38,UCIzXayRP7-P0ANpq-nD-h5g,The Sun,KPK_4kbkhpg,Flag lowered at Chengdu US Consulate as Chinese officials order it&#39;s closure in response to tensions,China announced it had taken possession of the US consulate in Chengdu hours after the US flag outside the building was ...,https://www.youtube.com/watch?v=KPK_4kbkhpg,2020-07-27T09:26:56Z,2020,7,27
