,channelId,channelTitle,videoId,vidoeTitle,description,link,time,year,month,day
0,UCshwRhftzkiov5wKR7M_LsQ,The Independent,NkND97V8w94,Grant Shapps repeatedly defends Dominic Cummings over 500 mile round-trip during lockdown,The transport secretary has insisted the government's chief advisor Dominic Cummings did not break the lockdown rules when he ...,https://www.youtube.com/watch?v=NkND97V8w94,2020-05-23T17:18:20Z,2020,5,23
1,UCshwRhftzkiov5wKR7M_LsQ,The Independent,4GqQC8bPW2c,Dominic Cummings defends lockdown trip as &#39;right thing&#39; to do,Dominic Cummings has broken his silence after it emerged he apparently flouted lockdown rules by travelling to Durham with his ...,https://www.youtube.com/watch?v=4GqQC8bPW2c,2020-05-23T12:19:15Z,2020,5,23
2,UCshwRhftzkiov5wKR7M_LsQ,The Independent,8IYMxP-2rsU,Kayleigh McEnany scolds media for not spreading Obamagate conspiracy,White House press secretary Kayleigh McEnany admonished the press corps on Friday for refusing to promote unproven theories ...,https://www.youtube.com/watch?v=8IYMxP-2rsU,2020-05-23T11:36:36Z,2020,5,23
3,UCshwRhftzkiov5wKR7M_LsQ,The Independent,vQgv8uNf_-A,Kayleigh McEnany clashes with with reporters over church reopening plan,Donald Trump's press secretary Kayleigh McEnany clashed with reporters Friday over the president's plan to reopen churches this ...,https://www.youtube.com/watch?v=vQgv8uNf_-A,2020-05-23T11:07:34Z,2020,5,23
4,UCshwRhftzkiov5wKR7M_LsQ,The Independent,GZy8UsDcuOQ,Pakistan plane crash survivor tells of &#39;jump&#39; to safety,"One of the two survivors of the Pakistan plane crash has told how he jumped to safety. ""When the plane caught fire I unfastened ...",https://www.youtube.com/watch?v=GZy8UsDcuOQ,2020-05-23T10:43:30Z,2020,5,23
5,UCshwRhftzkiov5wKR7M_LsQ,The Independent,T5u0Si7-a44,Trump&#39;s bank details revealed by press secretary Kayleigh McEnany,Donald Trump's personal bank details were inadvertently revealed Friday during a White House press conference.,https://www.youtube.com/watch?v=T5u0Si7-a44,2020-05-23T08:39:51Z,2020,5,23
6,UCshwRhftzkiov5wKR7M_LsQ,The Independent,JUogMbSwlB8,Bolsonaro&#39;s foul-mouthed rant to cabinet over security forces,A profanity-laced video emerged on Friday showing Brazilian President Jair Bolsonaro expressing frustration at his inability to get ...,https://www.youtube.com/watch?v=JUogMbSwlB8,2020-05-23T07:55:11Z,2020,5,23
