,channelId,channelTitle,videoId,vidoeTitle,description,link,time,year,month,day
0,UCshwRhftzkiov5wKR7M_LsQ,The Independent,ufD0ICr04lk,Live: White House press secretary Jen Psaki holds briefing,White House press secretary Jen Psaki holds a briefing. The director of the National Economic Council Brian Deese will join the ...,https://www.youtube.com/watch?v=ufD0ICr04lk,2021-06-04T18:54:30Z,2021,6,4
1,UCshwRhftzkiov5wKR7M_LsQ,The Independent,t-LFf0v3dsk,"Covid situation is &#39;still hopeful&#39; but &#39;nevertheless fragile&#39;, says Sturgeon","Speaking at a Covid briefing, Nicola Sturgeon said the Covid situation is 'still hopeful' but 'nevertheless fragile' in Scotland.",https://www.youtube.com/watch?v=t-LFf0v3dsk,2021-06-04T15:23:39Z,2021,6,4
2,UCshwRhftzkiov5wKR7M_LsQ,The Independent,Wp-PByYYFAQ,Live: Joe Biden delivers remarks on May jobs report,US president Joe Biden delivers remarks on the May jobs report. Like us on Facebook: ...,https://www.youtube.com/watch?v=Wp-PByYYFAQ,2021-06-04T14:56:38Z,2021,6,4
3,UCshwRhftzkiov5wKR7M_LsQ,The Independent,_VhCPUodJ4Y,"Mare of Easttown, Jupiter&#39;s Legacy and Inside No. 9 | Binge or Bin episode 3","HBO's hit show Mare of Easttown, BBC's gritty prison drama Time, superhero Netflix series Jupiter's Legacy and the sixth series of ...",https://www.youtube.com/watch?v=_VhCPUodJ4Y,2021-06-04T14:01:04Z,2021,6,4
4,UCshwRhftzkiov5wKR7M_LsQ,The Independent,LJs2T4VjGTY,Pence admits he and Trump will never see eye to eye on ‘dark day’ of Capitol riot,"For the first time since the violent insurrection of the US Capitol, former vice president Mike Pence acknowledged that he might not ...",https://www.youtube.com/watch?v=LJs2T4VjGTY,2021-06-04T13:30:46Z,2021,6,4
5,UCshwRhftzkiov5wKR7M_LsQ,The Independent,X5G8wEvmlcs,Deadly police shooting sparks protest in Minneapolis,"A protest broke out in Minneapolis, Minnesota on Thursday, after a multi-agency task force shot dead a man for allegedly ...",https://www.youtube.com/watch?v=X5G8wEvmlcs,2021-06-04T13:31:23Z,2021,6,4
6,UCshwRhftzkiov5wKR7M_LsQ,The Independent,0gjuWX2VSA0,Toppled slave trader statue to go on display in Bristol museum,A statue of slave trader Edward Colston that was torn down by Black Lives Matter protesters in Bristol will be put on public display ...,https://www.youtube.com/watch?v=0gjuWX2VSA0,2021-06-04T09:12:15Z,2021,6,4
