,channelId,channelTitle,videoId,vidoeTitle,description,link,time,year,month,day
0,UCIRYBXDze5krPDzAEOxFGVA,Guardian News,hSQcj4-zqsc,Little Richard&#39;s most memorable hits,"Little Richard, one of the pioneers of the first wave of rock'n'roll, has died. He was 87. His 1955 song Tutti Frutti, with the lyric 'awopbopaloobop alopbamboom', ...",https://www.youtube.com/watch?v=hSQcj4-zqsc,2020-05-09T17:58:37Z,2020,5,9
1,UCIRYBXDze5krPDzAEOxFGVA,Guardian News,H0CXFgToxH8,"More than 1,000 queue in Geneva to get free food parcels amid coronavirus lockdown",A line of people stretched for more than half a mile outside an ice rink where volunteers were handing out about 1500 parcels in Geneva. Some of those queuing ...,https://www.youtube.com/watch?v=H0CXFgToxH8,2020-05-09T17:54:47Z,2020,5,9
2,UCIRYBXDze5krPDzAEOxFGVA,Guardian News,HL0vJ7Z4L_Q,Coronavirus: Grant Shapps gives update on the outbreak in the UK – watch live,Grant Shapps and government officials hold a daily briefing to update on the coronavirus outbreak in the UK.,https://www.youtube.com/watch?v=HL0vJ7Z4L_Q,2020-05-09T16:32:04Z,2020,5,9
3,UCIRYBXDze5krPDzAEOxFGVA,Guardian News,NZliKGoUN4E,Thousands attend Belarus VE Day parade despite pandemic,"Thousands of people, including elderly veterans of the second world war, have turned out for Belarus's Victory Day military parade despite the coronavirus ...",https://www.youtube.com/watch?v=NZliKGoUN4E,2020-05-09T15:34:26Z,2020,5,9
4,UCIRYBXDze5krPDzAEOxFGVA,Guardian News,7qbtqew-CI8,Donald Trump says coronavirus will &#39;go away without a vaccine&#39;,"Donald Trump has asserted with no evidence that the coronavirus pandemic will 'go away without a vaccine'. Without mentioning specifics, he pointed to other ...",https://www.youtube.com/watch?v=7qbtqew-CI8,2020-05-09T14:49:18Z,2020,5,9
5,UCIRYBXDze5krPDzAEOxFGVA,Guardian News,eKO8IURIrEQ,Roy Horn of Siegfried &amp; Roy dies from coronavirus,"Roy Horn of Siegfried & Roy, the duo whose extraordinary magic tricks astonished millions until Horn was critically injured in 2003 by one of the act's famed ...",https://www.youtube.com/watch?v=eKO8IURIrEQ,2020-05-09T13:24:55Z,2020,5,9
