,channelId,channelTitle,videoId,vidoeTitle,description,link,time,year,month,day
0,UCIRYBXDze5krPDzAEOxFGVA,Guardian News,dp5yr6coXVk,Coronavirus: New York governor Andrew Cuomo gives an update – watch live,"The governor of New York, Andrew Cuomo, provides the latest on coronavirus.",https://www.youtube.com/watch?v=dp5yr6coXVk,2020-03-29T19:07:00Z,2020,3,29
1,UCIRYBXDze5krPDzAEOxFGVA,Guardian News,_lsb_gYPPrc,"Nancy Pelosi slams Trump&#39;s coronavirus delays: &#39;As the president fiddles, people are dying&#39;","The House Speaker, Nancy Pelosi, delivered a devastating critique of Donald Trump on Sunday, accusing the president directly of costing American lives ...",https://www.youtube.com/watch?v=_lsb_gYPPrc,2020-03-29T17:58:54Z,2020,3,29
2,UCIRYBXDze5krPDzAEOxFGVA,Guardian News,8pbsJKlCeO0,"UK coronavirus restrictions could last &#39;up to six months&#39;, says Dr Jenny Harries","The deputy chief medical officer for England, Dr Jenny Harries, has said restrictions could remain in place for up to six months, and that lifting them too soon ...",https://www.youtube.com/watch?v=8pbsJKlCeO0,2020-03-29T17:31:49Z,2020,3,29
3,UCIRYBXDze5krPDzAEOxFGVA,Guardian News,-eps50XIAZg,Coronavirus: Spanish hospital workers meditate as virus &#39;arriving at peak&#39;,Health workers in Madrid meditate together as many Spanish hospitals are stretched to near breaking point. The country has posted record single-day death ...,https://www.youtube.com/watch?v=-eps50XIAZg,2020-03-29T16:08:18Z,2020,3,29
4,UCIRYBXDze5krPDzAEOxFGVA,Guardian News,x5XT8H5PLzQ,Coronavirus: UK government holds briefing as lockdown expected to tighten – watch in full,The UK is expected to impose tighter restrictions to tackle the coronavirus outbreak as officials brief the nation.,https://www.youtube.com/watch?v=x5XT8H5PLzQ,2020-03-29T15:53:26Z,2020,3,29
5,UCIRYBXDze5krPDzAEOxFGVA,Guardian News,wWz9XZLC3Pg,"UK&#39;s coronavirus lockdown will be in place for significant period, says Gove","The Cabinet Office minister, Michael Gove, has said the peak of the coronavirus outbreak in Britain will depend on people's actions. He told the BBC's Andrew ...",https://www.youtube.com/watch?v=wWz9XZLC3Pg,2020-03-29T10:51:42Z,2020,3,29
6,UCIRYBXDze5krPDzAEOxFGVA,Guardian News,nH5TcDhIqbw,Coronavirus: Tony Blair calls for mass UK testing,The former prime minister Tony Blair has said a point will need to be reached where a 'very large' proportion of the population is tested for coronavirus.,https://www.youtube.com/watch?v=nH5TcDhIqbw,2020-03-29T09:12:59Z,2020,3,29
