,channelId,channelTitle,videoId,vidoeTitle,description,link,time,year,month,day
0,UCIRYBXDze5krPDzAEOxFGVA,Guardian News,1v7o_6uI9R0,Ahmaud Arbery: police bodycam video shows failed attempt to use Taser in 2017 incident – exclusive,"Police attempted to use a Taser on Ahmaud Arbery, the slain Georgia jogger, after questioning why he was sitting alone in his car in a park one morning in ...",https://www.youtube.com/watch?v=1v7o_6uI9R0,2020-05-18T22:23:51Z,2020,5,18
1,UCIRYBXDze5krPDzAEOxFGVA,Guardian News,UEYfSuH7Iwk,Coronavirus: Trump claims he takes hydroxychloroquine despite FDA warnings,"Donald Trump claimed he has been taking hydroxychloroquine to prevent Covid-19, despite no compelling evidence that the drug is effective against the ...",https://www.youtube.com/watch?v=UEYfSuH7Iwk,2020-05-18T21:38:53Z,2020,5,18
2,UCIRYBXDze5krPDzAEOxFGVA,Guardian News,U3z2QiVJKfY,Norwegian politicians film physically distanced dance for national day,Prime minister Erna Solberg and her colleagues filmed the dance during the coronavirus pandemic. It was aired on 17 May on NRK. Mass gatherings and ...,https://www.youtube.com/watch?v=U3z2QiVJKfY,2020-05-18T18:55:42Z,2020,5,18
3,UCIRYBXDze5krPDzAEOxFGVA,Guardian News,O8eQV1vurs0,Coronavirus: New York governor Andrew Cuomo provides update on the outbreak - watch live,New York's Governor Andrew Cuomo provides an update on the state's coronavirus response.,https://www.youtube.com/watch?v=O8eQV1vurs0,2020-05-18T16:30:24Z,2020,5,18
4,UCIRYBXDze5krPDzAEOxFGVA,Guardian News,omONyHBOddM,Coronavirus: everyone over five eligible for test in UK,"The health secretary, Matt Hancock, has announced people across the UK will be eligible for a Covid-19 test if they are over the age of five and have symptoms.",https://www.youtube.com/watch?v=omONyHBOddM,2020-05-18T15:59:42Z,2020,5,18
5,UCIRYBXDze5krPDzAEOxFGVA,Guardian News,20-dENpSx4I,Xi Jinping defends China&#39;s handling of coronavirus and backs review of global response,Chinese President Xi Jinping is backing calls for an independent review of the global response to the coronavirus pandemic under the World Health ...,https://www.youtube.com/watch?v=20-dENpSx4I,2020-05-18T14:29:30Z,2020,5,18
6,UCIRYBXDze5krPDzAEOxFGVA,Guardian News,jHVt7I-9LpU,Bolsonaro greets anti-lockdown protesters as coronavirus cases rise in Brazil,"The Brazilian president, Jair Bolsonaro, greeted coronavirus lockdown protesters after his country's total number of Covid-19 cases surpassed 230000.",https://www.youtube.com/watch?v=jHVt7I-9LpU,2020-05-18T08:10:42Z,2020,5,18
