,channelId,channelTitle,videoId,vidoeTitle,description,link,time,year,month,day
0,UCIRYBXDze5krPDzAEOxFGVA,Guardian News,LBWwW2NZrnw,New Zealand PM Jacinda Ardern&#39;s live TV interview interrupted by magnitude-5.8 earthquake,A magnitude-5.8 earthquake hit New Zealand while prime minister Jacinda Ardern was doing a live television interview from Wellington. 'We're just having a bit ...,https://www.youtube.com/watch?v=LBWwW2NZrnw,2020-05-24T23:40:52Z,2020,5,24
1,UCIRYBXDze5krPDzAEOxFGVA,Guardian News,M5Cf5jvQ1TQ,Johnson says coronavirus tests will be available in schools that open on 1 June,Boris Johnson confirmed that the government will press ahead with the phased reopening of schools from 1 June. 'The education of children is crucial for their ...,https://www.youtube.com/watch?v=M5Cf5jvQ1TQ,2020-05-24T19:10:02Z,2020,5,24
2,UCIRYBXDze5krPDzAEOxFGVA,Guardian News,k8W0y8S0Wpo,Boris Johnson says Dominic Cummings will not be &#39;marked down&#39; for lockdown rule breaking,"The prime minister has said his chief aide Dominic Cummings acted 'responsibly, legally and with integrity' when he decided to travel to Durham with his wife ...",https://www.youtube.com/watch?v=k8W0y8S0Wpo,2020-05-24T17:02:55Z,2020,5,24
3,UCIRYBXDze5krPDzAEOxFGVA,Guardian News,F4jzboq6Ftw,Boris Johnson holds briefing amid calls for Dominic Cummings to go – watch live,Prime minister leads daily briefing to update on the coronavirus outbreak. Johnson is expected to be faced with new questions on allegations his chief aide ...,https://www.youtube.com/watch?v=F4jzboq6Ftw,2020-05-24T16:45:01Z,2020,5,24
4,UCIRYBXDze5krPDzAEOxFGVA,Guardian News,sW0uLKo2-dw,Dominic Cummings denies returning to Durham in doorstep interview,"Boris Johnson's chief aide Dominic Cummings said he did not travel to Durham a second time when he was asked by reporters on his doorstep, before going to ...",https://www.youtube.com/watch?v=sW0uLKo2-dw,2020-05-24T13:45:54Z,2020,5,24
5,UCIRYBXDze5krPDzAEOxFGVA,Guardian News,aSTAiF4HTjs,Police fire teargas as thousands rally against Beijing&#39;s national security law in Hong Kong,"Hong Kong police used teargas, pepper spray and water cannon on crowds as thousands rallied against Beijing's declaration that it intends to impose national ...",https://www.youtube.com/watch?v=aSTAiF4HTjs,2020-05-24T12:57:54Z,2020,5,24
