,channelId,channelTitle,videoId,vidoeTitle,description,link,time,year,month,day
0,UCIRYBXDze5krPDzAEOxFGVA,Guardian News,tY6fz36NXrI,Trump defends taking unproved coronavirus drug hydroxychloroquine,"The US president has defended his use of the anti-malaria drug, dismissing a study indicating it was not an effective coronavirus treatment as a 'Trump enemy ...",https://www.youtube.com/watch?v=tY6fz36NXrI,2020-05-19T20:27:06Z,2020,5,19
1,UCIRYBXDze5krPDzAEOxFGVA,Guardian News,l-HrXap8Glc,Coronavirus: Rishi Sunak takes questions on economic rescue plan – watch live,UK finance minister Rishi Sunak speaks to lawmakers on parliament's Treasury Committee about his COVID-19 crisis plan. Subscribe to Guardian News on ...,https://www.youtube.com/watch?v=l-HrXap8Glc,2020-05-19T18:28:57Z,2020,5,19
2,UCIRYBXDze5krPDzAEOxFGVA,Guardian News,APrnv-mCl58,Coronavirus: George Eustice holds daily UK government briefing – watch live,George Eustice and government officials hold a daily briefing to update on the coronavirus outbreak in the United Kingdom Subscribe to Guardian News on ...,https://www.youtube.com/watch?v=APrnv-mCl58,2020-05-19T17:56:53Z,2020,5,19
3,UCIRYBXDze5krPDzAEOxFGVA,Guardian News,nZAgZ_yhBxU,Environment secretary George Eustice calls on furloughed Britons to pick fruit,"George Eustice, the environment secretary, has urged Britons on furlough to 'lend a hand' picking fruit and vegetables on British farms, as only a third of the ...",https://www.youtube.com/watch?v=nZAgZ_yhBxU,2020-05-19T17:15:41Z,2020,5,19
4,UCIRYBXDze5krPDzAEOxFGVA,Guardian News,wuZBdoeej1w,Chinese man reunited with parents 32 years after abduction as toddler,A Chinese man who was stolen from his family as a toddler has been reunited with his parents after 32 years. Mao Yin was snatched in 1988 when he was ...,https://www.youtube.com/watch?v=wuZBdoeej1w,2020-05-19T17:01:03Z,2020,5,19
5,UCIRYBXDze5krPDzAEOxFGVA,Guardian News,I9gmE87jxcI,Coronavirus: Matt Hancock addresses parliament – watch live,"Health Secretary, Matt Hancock, discusses the latest news on Covid-19 handling by Government. Michael Gove answers questions on Brexit and Britain's exit ...",https://www.youtube.com/watch?v=I9gmE87jxcI,2020-05-19T13:18:36Z,2020,5,19
6,UCIRYBXDze5krPDzAEOxFGVA,Guardian News,5RPap1BWYns,Tasmanian tiger: newly released footage captures last-known vision of thylacine,"Newly released footage captures the last-known moving images of the evasive thylacine (Tasmanian tiger). Shot in 1935, the footage has been released to the ...",https://www.youtube.com/watch?v=5RPap1BWYns,2020-05-19T06:33:45Z,2020,5,19
7,UCIRYBXDze5krPDzAEOxFGVA,Guardian News,kX2GzjxXx8Q,Italian cities reopen after two months of coronavirus lockdowns,"Italy has started easing coronavirus lockdown restrictions and some shops, restaurants and museums have reopened for the first time in two months. Physical ...",https://www.youtube.com/watch?v=kX2GzjxXx8Q,2020-05-19T05:39:34Z,2020,5,19
8,UCIRYBXDze5krPDzAEOxFGVA,Guardian News,AX3IOaxfO6k,"Trump reacts to dismissed &#39;Obamagate&#39; investigation: &#39;If it was me, they would do it&#39;","After US attorney general William Barr dismissed the possibility of investigating 'Obamagate', president Donald Trump responded 'If it was me, they would do it'.",https://www.youtube.com/watch?v=AX3IOaxfO6k,2020-05-19T05:29:59Z,2020,5,19
