,channelId,channelTitle,videoId,vidoeTitle,description,link,time,year,month,day
0,UCIRYBXDze5krPDzAEOxFGVA,Guardian News,W6iZkRIfx-w,&#39;No getting on the beers&#39; at home with mates as coronavirus clampdown increases,After announcing pubs and restaurants will temporarily close in Victoria – as they will around Australia – state premier Daniel Andrews told the public it is not ...,https://www.youtube.com/watch?v=W6iZkRIfx-w,2020-03-22T23:52:16Z,2020,3,22
1,UCIRYBXDze5krPDzAEOxFGVA,Guardian News,Qzxmy58z4EY,Coronavirus: Boris Johnson and housing secretary daily briefing on outbreak in UK – watch live,"Boris Johnson and Robert Jenrick, the housing secretary, hold a daily briefing from 10 Downing on the coronavirus outbreak in the United Kingdom.",https://www.youtube.com/watch?v=Qzxmy58z4EY,2020-03-22T18:56:55Z,2020,3,22
2,UCIRYBXDze5krPDzAEOxFGVA,Guardian News,zv0I1rS96-0,Coronavirus: Johnson threatens stricter measures if people flout social distancing rules,Boris Johnson has threatened to introduce stricter measures if people do not adhere to the government's advice on social distances. Speaking at the PM's daily ...,https://www.youtube.com/watch?v=zv0I1rS96-0,2020-03-22T18:47:49Z,2020,3,22
3,UCIRYBXDze5krPDzAEOxFGVA,Guardian News,5eDRHtsVNKo,Coronavirus: daughter takes inspiration from Love Actually to pay tribute to self-isolating mum,"It was a Mother's Day unlike any other. There was to be no hugs, kisses, or even a cuppa as Britons were advised not to visit loved ones on Sunday. But in the ...",https://www.youtube.com/watch?v=5eDRHtsVNKo,2020-03-22T17:30:34Z,2020,3,22
4,UCIRYBXDze5krPDzAEOxFGVA,Guardian News,Fp0LeY_Uedg,Dentist warns of risk as visitors flock to seaside town amid Covid-19 outbreak,"A dentist has warned of a 'disaster waiting to happen' as thousands of people flocked to his seaside town, Skegness, in spite of official guidance to stay at home ...",https://www.youtube.com/watch?v=Fp0LeY_Uedg,2020-03-22T12:27:28Z,2020,3,22
