,channelId,channelTitle,videoId,vidoeTitle,description,link,time,year,month,day
0,UCIRYBXDze5krPDzAEOxFGVA,Guardian News,RHvuMMCgUYA,Super-cyclone Amphan batters India and Bangladesh,"The Bay of Bengal's fiercest storm this century, super-cyclone Amphan, has slammed into the coast of eastern India and Bangladesh, bringing heavy gales and ...",https://www.youtube.com/watch?v=RHvuMMCgUYA,2020-05-20T23:04:35Z,2020,5,20
1,UCIRYBXDze5krPDzAEOxFGVA,Guardian News,UQq4Y4m7J-Q,People flock to English beaches as coronavirus lockdown eases,Beaches across the south of England were packed on Wednesday as the country basked in the hottest temperatures since the coronavirus outbreak began.,https://www.youtube.com/watch?v=UQq4Y4m7J-Q,2020-05-20T21:40:18Z,2020,5,20
2,UCIRYBXDze5krPDzAEOxFGVA,Guardian News,79BCK2EOYP0,Michigan dam failures force thousands to flee flooding,"Rapidly rising water overwhelmed dams and forced the evacuation of about 10000 people in central Michigan, where flooding struck communities along ...",https://www.youtube.com/watch?v=79BCK2EOYP0,2020-05-20T19:54:55Z,2020,5,20
3,UCIRYBXDze5krPDzAEOxFGVA,Guardian News,keX9CYihBms,"Tom Moore reacts to knighthood: &#39;Inside, nothing&#39;s changed&#39;","Tom Moore, whose sponsored walks in his garden raised £33m for NHS charities, has reacted with delight after it was confirmed he is to be knighted. 'I think Sir ...",https://www.youtube.com/watch?v=keX9CYihBms,2020-05-20T19:31:12Z,2020,5,20
4,UCIRYBXDze5krPDzAEOxFGVA,Guardian News,HrQOl3DR8Mk,Coronavirus: culture secretary Oliver Dowden holds daily UK government briefing – watch live,Oliver Dowden and government officials hold a daily briefing to update on the coronavirus outbreak in the United Kingdom.,https://www.youtube.com/watch?v=HrQOl3DR8Mk,2020-05-20T18:18:40Z,2020,5,20
5,UCIRYBXDze5krPDzAEOxFGVA,Guardian News,-s6g_JgxxYo,Hour-long queues as McDonald&#39;s reopens drive-through restaurants,"Large queues formed outside a McDonald's branch in Sutton, south London, as the fast-food chain reopened 33 of its drive-through restaurants after the easing ...",https://www.youtube.com/watch?v=-s6g_JgxxYo,2020-05-20T18:12:18Z,2020,5,20
6,UCIRYBXDze5krPDzAEOxFGVA,Guardian News,Ux-vtBsVwqY,Starmer challenges Johnson over Covid-19 test and track delays,"The prime minister has told the Labour leader, Keir Starmer, there is a committed effort to having a coronavirus test and tracing system in place by the start of ...",https://www.youtube.com/watch?v=Ux-vtBsVwqY,2020-05-20T14:38:17Z,2020,5,20
7,UCIRYBXDze5krPDzAEOxFGVA,Guardian News,Rn3B9FDwVY0,Coronavirus: Boris Johnson answers questions at PMQs – watch live,Prime Minister's Questions with Boris Johnson at the dispatch box to answer issues relating to coronavirus pandemic and more. Subscribe to Guardian News on ...,https://www.youtube.com/watch?v=Rn3B9FDwVY0,2020-05-20T13:37:15Z,2020,5,20
8,UCIRYBXDze5krPDzAEOxFGVA,Guardian News,rBfLUe4BpU4,Coronavirus: Ardern flags four-day week as way to rebuild New Zealand,"New Zealand's prime minister, Jacinda Ardern, has suggested employers consider a four-day working week and other flexible working options as a way to boost ...",https://www.youtube.com/watch?v=rBfLUe4BpU4,2020-05-20T08:51:57Z,2020,5,20
