,channelId,channelTitle,videoId,vidoeTitle,description,link,time,year,month,day
0,UCIRYBXDze5krPDzAEOxFGVA,Guardian News,wm3IW71LNBo,Bernie Sanders endorses Joe Biden for president: &#39;We need you in the White House&#39;,Former campaign rival Bernie Sanders on Monday endorsed Democratic frontrunner Joe Biden as the next president of the United States as he made a joint ...,https://www.youtube.com/watch?v=wm3IW71LNBo,2020-04-13T20:36:03Z,2020,4,13
1,UCIRYBXDze5krPDzAEOxFGVA,Guardian News,0T59A1uXYu8,"Coronavirus: number of deaths expected to continue rising, says chief scientific adviser",The government's chief scientific adviser on Monday warned that the UK's daily death toll from coronavirus would likely rise this week before plateauing for ...,https://www.youtube.com/watch?v=0T59A1uXYu8,2020-04-13T20:25:18Z,2020,4,13
2,UCIRYBXDze5krPDzAEOxFGVA,Guardian News,IfLd2Z6vmts,Coronavirus: Dominic Raab holds daily briefing on outbreak in UK – watch live,UK Government give latest news and response to pandemic.,https://www.youtube.com/watch?v=IfLd2Z6vmts,2020-04-13T17:45:11Z,2020,4,13
3,UCIRYBXDze5krPDzAEOxFGVA,Guardian News,OXQEyYmmEAs,Coronavirus: WHO holds briefing on latest outbreak developments – watch live,World Health Organization holds briefing on the latest worldwide developments of the coronavirus outbreak.,https://www.youtube.com/watch?v=OXQEyYmmEAs,2020-04-13T17:06:43Z,2020,4,13
4,UCIRYBXDze5krPDzAEOxFGVA,Guardian News,pBzt9LsHLVY,Coronavirus: governor Cuomo provides update on outbreak in New York – watch live,New York's governor Andrew Cuomo provides a coronavirus update.,https://www.youtube.com/watch?v=pBzt9LsHLVY,2020-04-13T17:04:31Z,2020,4,13
5,UCIRYBXDze5krPDzAEOxFGVA,Guardian News,kD2ZzQlZRX0,"&#39;Do not delay funerals&#39; during coronavirus outbreak, says Scottish health advisor","Dr Gregor Smith has urged families in Scotland not to delay funerals due to coronavirus, to avoid putting further strain on funeral and mortuary services ...",https://www.youtube.com/watch?v=kD2ZzQlZRX0,2020-04-13T14:23:39Z,2020,4,13
6,UCIRYBXDze5krPDzAEOxFGVA,Guardian News,7-kbYMx5Exc,Coronavirus: Nicola Sturgeon gives briefing on outbreak in Scotland - watch live,Scottish first minister Nicola Sturgeon gives briefing on the coronavirus situation in Scotland.,https://www.youtube.com/watch?v=7-kbYMx5Exc,2020-04-13T13:21:21Z,2020,4,13
7,UCIRYBXDze5krPDzAEOxFGVA,Guardian News,SppjkRnvQac,New York doctor films inside coronavirus ward: &#39;All you hear is oxygen&#39;,"A New York doctor has filmed inside an emergency ward treating Covid-19 patients. Dr Erik Blutinger, of Mount Sinai Queens hospital, said in the footage, shot ...",https://www.youtube.com/watch?v=SppjkRnvQac,2020-04-13T09:21:19Z,2020,4,13
8,UCIRYBXDze5krPDzAEOxFGVA,Guardian News,80lSpPZybRo,&#39;Music for Hope&#39;: Italian tenor Andrea Bocelli performs in empty Milan cathedral,"Andrea Bocelli sang in a closed Duomo Cathedral in Milan, Italy on Sunday as part of a 'Music for Hope' event designed to bring people together during the ...",https://www.youtube.com/watch?v=80lSpPZybRo,2020-04-13T03:28:45Z,2020,4,13
