,channelId,channelTitle,videoId,vidoeTitle,description,link,time,year,month,day
0,UCw3fku0sH3qA3c3pZeJwdAw,Daily Mail,bxk5XHQLl1o,Biden slams Trump&#39;s &#39;crowing&#39; over improving unemployment report,Former Vice President Joe Biden called for Trump to come out of his 'own bunker' Friday after Trump confirmed he visited the ...,https://www.youtube.com/watch?v=bxk5XHQLl1o,2020-06-06T12:05:28Z,2020,6,6
1,UCw3fku0sH3qA3c3pZeJwdAw,Daily Mail,nFD4jKTwJnI,Trump cracks jokes after forgetting what an RV is,President Donald Trump joked on Friday he was going to buy an RV and drive around the country with first lady Melania Trump.,https://www.youtube.com/watch?v=nFD4jKTwJnI,2020-06-06T12:04:39Z,2020,6,6
2,UCw3fku0sH3qA3c3pZeJwdAw,Daily Mail,3MSOZxMFMtU,Graphic: Second angle shows moment elderly man hits pavement after cop shove,Caution: Graphic content - Fifty seven officers have resigned from their positions on a Buffalo Police team in 'disgust' over the ...,https://www.youtube.com/watch?v=3MSOZxMFMtU,2020-06-06T12:01:56Z,2020,6,6
3,UCw3fku0sH3qA3c3pZeJwdAw,Daily Mail,H5C1UsIRmaQ,Massive fire tears through Amazon distribution center in California,"A major fire broke out at an Amazon distribution warehouse in Redlands, east of Los Angeles on Friday. The fire broke out around ...",https://www.youtube.com/watch?v=H5C1UsIRmaQ,2020-06-06T11:59:52Z,2020,6,6
4,UCw3fku0sH3qA3c3pZeJwdAw,Daily Mail,ulLxj89Ku-4,Prince William and Kate Middleton speak to volunteers on Zoom,The Duke and Duchess of Cambridge revealed they've been answering helpline calls and text messages from their Amner Hall ...,https://www.youtube.com/watch?v=ulLxj89Ku-4,2020-06-06T11:43:48Z,2020,6,6
5,UCw3fku0sH3qA3c3pZeJwdAw,Daily Mail,b11mjfsQlRM,Trump tours Maine medical swab manufacturing plant without mask,"President Trump called Maine's Democratic Gov. Janet Mills a 'dictator' less than an hour into his trip to the state, complaining that ...",https://www.youtube.com/watch?v=b11mjfsQlRM,2020-06-06T11:39:17Z,2020,6,6
6,UCw3fku0sH3qA3c3pZeJwdAw,Daily Mail,sVU34ugT-hY,WHO says governments should encourage people to wear face masks,"Wearing face coverings on public transport will be mandatory in the UK by June 15, but Mick Cash, general secretary of the RMT, ...",https://www.youtube.com/watch?v=sVU34ugT-hY,2020-06-06T11:33:29Z,2020,6,6
