,channelId,channelTitle,videoId,vidoeTitle,description,link,time,year,month,day
0,UCw3fku0sH3qA3c3pZeJwdAw,Daily Mail,gByFT3v4SYQ,Crazy moment man tries to drive car with clamped wheel - it does not end well!,This is the moment a driver desperately tried to avoid paying for his car to be unclamped by attempting to drive off with the device ...,https://www.youtube.com/watch?v=gByFT3v4SYQ,2021-06-01T18:15:02Z,2021,6,1
1,UCw3fku0sH3qA3c3pZeJwdAw,Daily Mail,OBF75QBY7-k,"England&#39;s final 26-man squad revealed for Euro 2020: Lingard out, Saka in and four right-backs!",Euro2020 #EnglandSquad #BukayoSaka #JesseLingard #GarethSouthgate #4RBs Jude Bellingham will have been waiting ...,https://www.youtube.com/watch?v=OBF75QBY7-k,2021-06-01T17:02:52Z,2021,6,1
2,UCw3fku0sH3qA3c3pZeJwdAw,Daily Mail,cdu65M6GlGQ,UK Covid-19: Government reconsidering date for lifting June 21st &#39;Freedom Day&#39; restrictions,Business Minister Paul Scully said 'no decision has been taken' on whether the final restrictions will be lifted on June 21.,https://www.youtube.com/watch?v=cdu65M6GlGQ,2021-06-01T16:49:21Z,2021,6,1
3,UCw3fku0sH3qA3c3pZeJwdAw,Daily Mail,n566zUUqGVA,&#39;Democracy is in peril&#39;: Joe Biden gives speech on Memorial Day,President Joe Biden visited the tomb of the unknowns at Arlington National Cemetery on Monday as he marked Memorial Day.,https://www.youtube.com/watch?v=n566zUUqGVA,2021-06-01T15:56:16Z,2021,6,1
4,UCw3fku0sH3qA3c3pZeJwdAw,Daily Mail,PzUI1mEW0ag,"Scotland Covid-19: Nicola Sturgeon delays Scottish unlocking plan, putting pressure on Boris Johnson",NicolaSturgeon #UKCovid19 #Covid19 #ScotlandCovid19 #IndianVariant Nicola Sturgeon heaped pressure on Boris Johnson ...,https://www.youtube.com/watch?v=PzUI1mEW0ag,2021-06-01T14:39:11Z,2021,6,1
5,UCw3fku0sH3qA3c3pZeJwdAw,Daily Mail,-qxy9jeWWbU,"UK Covid-19: People react to getting vaccine during 15,000 free-for-all jabs at Twickenham Stadium",Twickenham #Covid19 #UKCovid19 #IndianVariant Thousands of young people tonight descended on Twickenham Stadium ...,https://www.youtube.com/watch?v=-qxy9jeWWbU,2021-06-01T13:15:00Z,2021,6,1
6,UCw3fku0sH3qA3c3pZeJwdAw,Daily Mail,NjY5WhIB5dg,Rolls-Royce unveils world&#39;s most expensive car: Boat Tail costs $28.4m and has cocktail tables,RollsRoyce #BoatTail #MostExpensiveCar #Rolls The world's most expensive new car has been unveiled today by Rolls-Royce ...,https://www.youtube.com/watch?v=NjY5WhIB5dg,2021-06-01T12:15:01Z,2021,6,1
7,UCw3fku0sH3qA3c3pZeJwdAw,Daily Mail,-rnT4ZjK1FY,People in Newcastle celebrate Bank Holiday weekend at outdoor rave,Revellers were seen celebrating the end of some lockdown restrictions meaning they were able to meet up with friends in bars ...,https://www.youtube.com/watch?v=-rnT4ZjK1FY,2021-06-01T11:15:00Z,2021,6,1
8,UCw3fku0sH3qA3c3pZeJwdAw,Daily Mail,A5_xGHbyT-c,UK Covid-19: 21st of June Freedom Day easing &#39;hanging in the balance&#39; says scientist,"FreedomDay #UKCovid19 #IndianVariant #UKLockdown Linda Bauld, the Professor of Public Health from the University of ...",https://www.youtube.com/watch?v=A5_xGHbyT-c,2021-06-01T09:01:26Z,2021,6,1
