,channelId,channelTitle,videoId,vidoeTitle,description,link,time,year,month,day
0,UCw3fku0sH3qA3c3pZeJwdAw,Daily Mail,I78x01Bu4xw,Couple&#39;s dogs recorded barking 130 times from midnight to 4am,A couple with 16 dogs have been slapped with a fine after their barking animals were secretly recorded more than 130 times at ...,https://www.youtube.com/watch?v=I78x01Bu4xw,2020-08-11T17:06:32Z,2020,8,11
1,UCw3fku0sH3qA3c3pZeJwdAw,Daily Mail,h3KX1v2T5wE,Residents in Chicago growing concerned over growing unrest,Black Lives Matter Chicago said early Monday's looting of stores was a form of 'reparations' as the group held a protest Monday ...,https://www.youtube.com/watch?v=h3KX1v2T5wE,2020-08-11T17:05:42Z,2020,8,11
2,UCw3fku0sH3qA3c3pZeJwdAw,Daily Mail,zJCp4-Z0u2Y,Biden may announce presidential running mate this week,Joe Biden could announce his running mate as soon as Tuesday as speculation mounts who will be named to the Democratic ...,https://www.youtube.com/watch?v=zJCp4-Z0u2Y,2020-08-11T17:04:10Z,2020,8,11
3,UCw3fku0sH3qA3c3pZeJwdAw,Daily Mail,TAl1jx_3xKc,Governors raise concerns over cost of Trump&#39;s COVID aid,"A new study from Pennsylvania State University found that for every American who dies from coronavirus, about nine family ...",https://www.youtube.com/watch?v=TAl1jx_3xKc,2020-08-11T17:02:26Z,2020,8,11
4,UCw3fku0sH3qA3c3pZeJwdAw,Daily Mail,J4FE-yA6ot0,A look at the controversy surrounding social media app TikTok,"A internal poll carried out by Microsoft employees found that 63 per cent think the TikTok merger is a bad idea, with just 18 per ...",https://www.youtube.com/watch?v=J4FE-yA6ot0,2020-08-11T17:00:08Z,2020,8,11
5,UCw3fku0sH3qA3c3pZeJwdAw,Daily Mail,KIm7zAMOB7Y,Volunteers show shocking extent of Mauritius oil spill,A Japanese ship that ran aground on a reef off Mauritius two weeks ago has now stopped leaking oil into the Indian Ocean but the ...,https://www.youtube.com/watch?v=KIm7zAMOB7Y,2020-08-11T16:57:14Z,2020,8,11
6,UCw3fku0sH3qA3c3pZeJwdAw,Daily Mail,ptJCSmgR5Is,Adorable baby elephant plays with ball in paddling pool,The footage was recorded by the family who adopted the rescue animal as a newborn after she became separated from her herd.,https://www.youtube.com/watch?v=ptJCSmgR5Is,2020-08-11T16:55:02Z,2020,8,11
7,UCw3fku0sH3qA3c3pZeJwdAw,Daily Mail,SZO9BP-jCN4,Vladimir Putin announces Russia has approved first ever Covid vaccine,"Vladimir Putin announced today that Russia had become the first country to register a vaccine, claiming it has 'passed all the ...",https://www.youtube.com/watch?v=SZO9BP-jCN4,2020-08-11T16:53:02Z,2020,8,11
8,UCw3fku0sH3qA3c3pZeJwdAw,Daily Mail,2oDNeWNBP9I,China: Typhoon Mekkhala winds seen destroying building,Footage captures the terrifying moment part of the structure being ripped through and blown away by the strong gales in Fujian ...,https://www.youtube.com/watch?v=2oDNeWNBP9I,2020-08-11T16:50:25Z,2020,8,11
