,channelId,channelTitle,videoId,vidoeTitle,description,link,time,year,month,day
0,UCw3fku0sH3qA3c3pZeJwdAw,Daily Mail,yrb_G_dlY5k,Paddleboarder gets surprise of his life when seal hops on board,"Cenk Albayrak-Touye was near Brownsea Island, in Poole Harbour, Dorset, when the seal jumped onto his paddle-board and ...",https://www.youtube.com/watch?v=yrb_G_dlY5k,2021-06-02T21:46:20Z,2021,6,2
1,UCw3fku0sH3qA3c3pZeJwdAw,Daily Mail,cPnATqUxbPM,All you need to know ahead of England&#39;s Euro 2020 campaign,Gareth Southgate's headache over his England squad selection has been replaced by an even more thumping one over his ...,https://www.youtube.com/watch?v=cPnATqUxbPM,2021-06-02T21:45:10Z,2021,6,2
2,UCw3fku0sH3qA3c3pZeJwdAw,Daily Mail,1MDXH7WG-Kc,"UK Covid-19 latest: Boris Johnson says, &#39;We&#39;re going to try to allow people to travel&#39;",UKTravel #BorisJohnson #UKcovid19 Boris Johnson warned that the government will have 'no hesitation' about imposing ...,https://www.youtube.com/watch?v=1MDXH7WG-Kc,2021-06-02T16:17:27Z,2021,6,2
3,UCw3fku0sH3qA3c3pZeJwdAw,Daily Mail,kykHD3q1hEs,UK Covid-19: Smug Matt Hancock boasts about UK&#39;s vaccine success,MattHancock #UKCovid19 #vaccine UK Covid-19 latest: The Health Secretary Matt Hancock used a global Covid conference in ...,https://www.youtube.com/watch?v=kykHD3q1hEs,2021-06-02T15:10:40Z,2021,6,2
4,UCw3fku0sH3qA3c3pZeJwdAw,Daily Mail,DnSviLh85R4,Crazy moment wild elephants walk through China&#39;s Kunming city after 500km journey,elephants #wildelephants #elephantsincity #china #kunming The herd of wild elephants broke out of a nature reserve in southern ...,https://www.youtube.com/watch?v=DnSviLh85R4,2021-06-02T13:15:00Z,2021,6,2
5,UCw3fku0sH3qA3c3pZeJwdAw,Daily Mail,ScG7ofi84UM,Joe Biden slams effort to &#39;erase&#39; the 1921 slaughter of Tulsa residents,"President Joe Biden on Tuesday slammed efforts to 'erase' the Tulsa Race Massacre from history and, in a passionate speech, ...",https://www.youtube.com/watch?v=ScG7ofi84UM,2021-06-02T10:15:00Z,2021,6,2
6,UCw3fku0sH3qA3c3pZeJwdAw,Daily Mail,pjbm3YUDoHs,Euro 2020: Gareth Southgate explains why he left Jesse Lingard out of England squad,GarethSouthgate #England #JesseLingard #Euro2020 Jesse Lingard has been left out of England's 26-man squad for Euro 2020.,https://www.youtube.com/watch?v=pjbm3YUDoHs,2021-06-02T08:42:51Z,2021,6,2
