,channelId,channelTitle,videoId,vidoeTitle,description,link,time,year,month,day
0,UCw3fku0sH3qA3c3pZeJwdAw,Daily Mail,TM8jsl-8L5Y,South Korea says Kim Jong-Un&#39;s sister is &#39;de facto second-in-command&#39; in North Korea,"South Korea's intelligence agency believes that Kim Yo Jong, the sister of North Korean leader Kim Jong Un, is serving as his 'de ...",https://www.youtube.com/watch?v=TM8jsl-8L5Y,2020-08-20T16:39:58Z,2020,8,20
1,UCw3fku0sH3qA3c3pZeJwdAw,Daily Mail,hPerFxvDyiM,Portland police declare riot for second night after attack on ICE,Cops fired pepper spray to disperse the crowds after Portland protesters pounded on the window of the ICE complex and ...,https://www.youtube.com/watch?v=hPerFxvDyiM,2020-08-20T16:38:06Z,2020,8,20
2,UCw3fku0sH3qA3c3pZeJwdAw,Daily Mail,fdjhwGHwl9k,Trump says QAnon theorists &#39;love our country&#39;,President Trump says QAnon conspiracy theorists like him and 'love our country'. Trump has refused to speak against the group ...,https://www.youtube.com/watch?v=fdjhwGHwl9k,2020-08-20T16:34:25Z,2020,8,20
3,UCw3fku0sH3qA3c3pZeJwdAw,Daily Mail,untFkhW5030,WHO warns &#39;even a coronavirus vaccine won&#39;t end pandemic&#39;,World Health Organization warned even a vaccine wouldn't end the coronavirus pandemic. Researchers around the world had ...,https://www.youtube.com/watch?v=untFkhW5030,2020-08-20T16:32:16Z,2020,8,20
4,UCw3fku0sH3qA3c3pZeJwdAw,Daily Mail,5wYo0NF_zOM,Trump demands full &#39;snapback&#39; of UN sanctions against Iran,"The United States will demand Thursday that all United Nations sanctions be reimposed against Iran, President Donald Trump ...",https://www.youtube.com/watch?v=5wYo0NF_zOM,2020-08-20T16:30:19Z,2020,8,20
5,UCw3fku0sH3qA3c3pZeJwdAw,Daily Mail,qMt6zm2kQHg,Hungry ant drags bumblebee 60 TIMES his size,How strong is an ant? Clearly enough to try and shift a massive (relatively speaking) bumblebee! This is the surreal moment a tiny ...,https://www.youtube.com/watch?v=qMt6zm2kQHg,2020-08-20T16:27:57Z,2020,8,20
6,UCw3fku0sH3qA3c3pZeJwdAw,Daily Mail,9C1tbinGGD0,Donald Trump again claims New Zealand is having a &#39;big outbreak&#39; of coronavirus,"The US President, whose country has recorded the highest number of cases across the globe, made the comments during a press ...",https://www.youtube.com/watch?v=9C1tbinGGD0,2020-08-20T16:00:10Z,2020,8,20
