,channelId,channelTitle,videoId,vidoeTitle,description,link,time,year,month,day
0,UCw3fku0sH3qA3c3pZeJwdAw,Daily Mail,GCrF1PEg1ic,&#39;We&#39;re in deep s**t:&#39; Dr. Bright says COVID warnings were ignored,"Dr. Rick Bright, the HHS whistleblower, slammed the government's coronavirus response complaining 'we don't have a strategy or ...",https://www.youtube.com/watch?v=GCrF1PEg1ic,2020-05-14T22:01:32Z,2020,5,14
1,UCw3fku0sH3qA3c3pZeJwdAw,Daily Mail,ZiaFPianwpw,"Anti-lockdown protesters descend on Lansing, Michigan",Anti-lockdown protesters turned on each other Thursday when a fight erupted on the steps of the capitol building (pictured).,https://www.youtube.com/watch?v=ZiaFPianwpw,2020-05-14T21:57:23Z,2020,5,14
2,UCw3fku0sH3qA3c3pZeJwdAw,Daily Mail,WaVLSVhdjQA,People head to bars in Wisconsin after lifting stay-at-home order,"The 4-3 ruling on Wednesday, the first of its kind in the nation, found that Governor Tony Evers' (inset) administration overstepped ...",https://www.youtube.com/watch?v=WaVLSVhdjQA,2020-05-14T17:01:07Z,2020,5,14
3,UCw3fku0sH3qA3c3pZeJwdAw,Daily Mail,6lwO3EsIKvg,Dr. Rick Bright testimony: 2020 could be &#39;darkest winter in modern history&#39;,Dr. Bright was poised to warn lawmakers that '2020 will be the darkest winter in modern history' if a concrete plan isn't followed to ...,https://www.youtube.com/watch?v=6lwO3EsIKvg,2020-05-14T16:56:49Z,2020,5,14
4,UCw3fku0sH3qA3c3pZeJwdAw,Daily Mail,NONhDDWPbMc,Daily UK coronavirus briefing: 14 May 2020,"The first round of random public testing in England, carried out by the Office for National Statistics, detected just 33 positive ...",https://www.youtube.com/watch?v=NONhDDWPbMc,2020-05-14T16:53:33Z,2020,5,14
