,channelId,channelTitle,videoId,vidoeTitle,description,link,time,year,month,day
0,UCw3fku0sH3qA3c3pZeJwdAw,Daily Mail,f__8826PwAs,Officer who fatally shot Rayshard Brooks is charged with murder,"Fired officer Garrett Rolfe, 27, has been charged with 11 counts including felony murder, a charge that carries a possible sentence ...",https://www.youtube.com/watch?v=f__8826PwAs,2020-06-17T22:14:03Z,2020,6,17
1,UCw3fku0sH3qA3c3pZeJwdAw,Daily Mail,_JBAGAYsdCU,PM&#39;s plane paint job &#39;promoting the UK&#39; claims Oliver Dowden,"The Voyager aircraft used by the PM on foreign trips is to get 'national branding', rather than the standard grey that makes it less ...",https://www.youtube.com/watch?v=_JBAGAYsdCU,2020-06-17T20:56:08Z,2020,6,17
2,UCw3fku0sH3qA3c3pZeJwdAw,Daily Mail,rlay1cMPcdM,Bristol statue saved from harbour and paint will be kept,Sir Winston Churchill's statue will be freed from its protective box by Thursday in time for French President Emmanuel Macron's ...,https://www.youtube.com/watch?v=rlay1cMPcdM,2020-06-17T20:54:57Z,2020,6,17
3,UCw3fku0sH3qA3c3pZeJwdAw,Daily Mail,5VVSj5niqtU,Legendary giant tortoise Diego released back into wild of Galapagos,"Diego the Giant tortoise fathered over 800 children after being moved to Santa Cruz island in Galapagos, Ecuador, ...",https://www.youtube.com/watch?v=5VVSj5niqtU,2020-06-17T20:50:06Z,2020,6,17
4,UCw3fku0sH3qA3c3pZeJwdAw,Daily Mail,Ut6dL8HZywY,Six US states see record spikes in new COVID-19 cases,White House Coronavirus Task Force Dr. Anthony Fauci has explained that advice on the public wearing masks changed when it ...,https://www.youtube.com/watch?v=Ut6dL8HZywY,2020-06-17T20:30:54Z,2020,6,17
5,UCw3fku0sH3qA3c3pZeJwdAw,Daily Mail,kpbsjt0RDdE,Families begin to see loved ones at special drive-in at care home,"As the UK's infection rates continue to fall, the Health Service Journal (HSJ) has said the 2.2 million clinically extremely vulnerable ...",https://www.youtube.com/watch?v=kpbsjt0RDdE,2020-06-17T14:48:30Z,2020,6,17
6,UCw3fku0sH3qA3c3pZeJwdAw,Daily Mail,pY-oqMv7pYg,Nurse calls for her medication as she&#39;s dragged by her hair by French police,"Riot police were on Tuesday filmed snatching Farida, 52, from a chaotic crowd of health workers calling for better pay and ...",https://www.youtube.com/watch?v=pY-oqMv7pYg,2020-06-17T14:45:44Z,2020,6,17
7,UCw3fku0sH3qA3c3pZeJwdAw,Daily Mail,5hIsi_HhVFA,Boris Johnson: Anyone who defaces war memorials will face &#39;full force of law&#39;,Boris Johnson used Prime Ministers Questions to warn that attacks on public property will be 'met with the full force of the law'.,https://www.youtube.com/watch?v=5hIsi_HhVFA,2020-06-17T14:38:52Z,2020,6,17
8,UCw3fku0sH3qA3c3pZeJwdAw,Daily Mail,_W3v5xOfkAA,Four-year-old returns home after undergoing chemo for seven weeks,"James Stephenson, 32, of Ackworth, West Yorkshire, isolated in 15ft hospital room with little Oliver so he could be with him while ...",https://www.youtube.com/watch?v=_W3v5xOfkAA,2020-06-17T12:42:23Z,2020,6,17
