,channelId,channelTitle,videoId,vidoeTitle,description,link,time,year,month,day
0,UCw3fku0sH3qA3c3pZeJwdAw,Daily Mail,iB4cAcG2atY,Van-Tam warns public not to abuse liberties as lockdown eases,England's deputy chief medical officer Professor Jonathan Van Tam (left) warned that abusing the fresh liberties would risk a ...,https://www.youtube.com/watch?v=iB4cAcG2atY,2020-05-30T21:31:04Z,2020,5,30
1,UCw3fku0sH3qA3c3pZeJwdAw,Daily Mail,YhRPsFvZZuM,NASA astronauts launch to space on SpaceX spacecraft,NASA and Elon Musk's SpaceX have officially brought spaceflight back to US with the successful launch of the Falcon 9 rocket ...,https://www.youtube.com/watch?v=YhRPsFvZZuM,2020-05-30T21:28:54Z,2020,5,30
2,UCw3fku0sH3qA3c3pZeJwdAw,Daily Mail,OWE4b8NHgPk,Distraught Minnesota governor laments &#39;chaos&#39; in Minneapolis,"'Last night is a mockery of pretending that this is about George Floyd's death, or inequities, or historical traumas to our ...",https://www.youtube.com/watch?v=OWE4b8NHgPk,2020-05-30T21:25:36Z,2020,5,30
3,UCw3fku0sH3qA3c3pZeJwdAw,Daily Mail,I483Y6jEGdo,Riots spread across United States after George Floyd&#39;s killing,Minneapolis Mayor Jacob Frey says the city's 3rd Police Precinct was ordered to be evacuated late Thursday to avoid ...,https://www.youtube.com/watch?v=I483Y6jEGdo,2020-05-30T15:20:05Z,2020,5,30
4,UCw3fku0sH3qA3c3pZeJwdAw,Daily Mail,EqQm0XcJ1mM,Protesters confront police outside White House as George Floyd riots continue,"'Great job last night at the White House by the U.S. @SecretService. They were not only totally professional, but very cool,' Trump ...",https://www.youtube.com/watch?v=EqQm0XcJ1mM,2020-05-30T14:26:49Z,2020,5,30
5,UCw3fku0sH3qA3c3pZeJwdAw,Daily Mail,KXzhhdWZKvg,Minneapolis Mayor Jacob Frey seeks to calm city rocked by violence,"Frey came to national prominence last year after being mentioned in a tweet by President Donald Trump, who criticized Frey and ...",https://www.youtube.com/watch?v=KXzhhdWZKvg,2020-05-30T14:17:40Z,2020,5,30
6,UCw3fku0sH3qA3c3pZeJwdAw,Daily Mail,QFiQH2QvwIE,George Floyd protesters turn on CNN headquarters in Atlanta,"The White House has gone into lockdown as protesters tried to scale the walls, battled with Secret Service and burned American ...",https://www.youtube.com/watch?v=QFiQH2QvwIE,2020-05-30T14:13:17Z,2020,5,30
7,UCw3fku0sH3qA3c3pZeJwdAw,Daily Mail,XDAOu33pUc0,Trump abruptly turns and LEAVES press conference amid controversy,President Trump refused to take questions at a Rose Garden event that had been billed as a 'news conference' on the heels of ...,https://www.youtube.com/watch?v=XDAOu33pUc0,2020-05-30T13:57:52Z,2020,5,30
