,channelId,channelTitle,videoId,vidoeTitle,description,link,time,year,month,day
0,UCw3fku0sH3qA3c3pZeJwdAw,Daily Mail,PZWxPz7nCs0,Firemen rescue adorable lamb stuck in a tunnel in a field,"The sheep was rescued from a storm drain in Belmont, Herefordshire, on Tuesday. It had taken a dip in the drain on a hot day ...",https://www.youtube.com/watch?v=PZWxPz7nCs0,2020-07-15T16:53:48Z,2020,7,15
1,UCw3fku0sH3qA3c3pZeJwdAw,Daily Mail,OOauyF3TkNM,Chipmunk makes a fool of huge hunting owl as it escapes its claws over and over again,"Footage reveals the owl diving on its four-and-a-half ounce quarry in Ontario, Canada. In the first clip the owl dive-bombs the ...",https://www.youtube.com/watch?v=OOauyF3TkNM,2020-07-15T16:48:45Z,2020,7,15
2,UCw3fku0sH3qA3c3pZeJwdAw,Daily Mail,i5woaeJNqhc,Trump says more white people than black people killed by police,"Trump brushed off a question about why more black people are dying at the hands of police, arguing 'so are white people.",https://www.youtube.com/watch?v=i5woaeJNqhc,2020-07-15T16:08:40Z,2020,7,15
3,UCw3fku0sH3qA3c3pZeJwdAw,Daily Mail,ruU43eV6bzg,"&#39;Be cool,&#39; French president Emmanuel Macron tells &#39;yellow vests&#39; who confront him",French president Emmanuel Macron and his wife Brigitte were at the centre of an astonishing security scare when furious ...,https://www.youtube.com/watch?v=ruU43eV6bzg,2020-07-15T14:25:12Z,2020,7,15
4,UCw3fku0sH3qA3c3pZeJwdAw,Daily Mail,diCVjwjXtyw,China calls UK ban on Huawei discriminative to Chinese companies,China today accused Boris Johnson of being 'America's dupe' after the UK banned Huawei from its 5G network. Beijing's foreign ...,https://www.youtube.com/watch?v=diCVjwjXtyw,2020-07-15T13:29:19Z,2020,7,15
5,UCw3fku0sH3qA3c3pZeJwdAw,Daily Mail,LxYDXVm9jng,President Trump rips Joe Biden over his record with China,President Trump denied he believed he was the underdog in the race for the White House against Joe Biden after spending an ...,https://www.youtube.com/watch?v=LxYDXVm9jng,2020-07-15T09:29:49Z,2020,7,15
6,UCw3fku0sH3qA3c3pZeJwdAw,Daily Mail,F-g4iMxPSms,Matt Hancock: Face masks mandatory in English shops from 24 July,Health Minister Matt Hancock on Tuesday confirmed that people would be required to wear them from July 24. Shoppers not ...,https://www.youtube.com/watch?v=F-g4iMxPSms,2020-07-15T09:26:06Z,2020,7,15
7,UCw3fku0sH3qA3c3pZeJwdAw,Daily Mail,kWPDDPP-y-s,What&#39;s your beef? Hilarious moment a cow wanders into police station,"Lynn the cow is a well-known cow in the town of Doomadgee, in far north Queensland, and often comes by the police station for a ...",https://www.youtube.com/watch?v=kWPDDPP-y-s,2020-07-15T09:20:46Z,2020,7,15
