,channelId,channelTitle,videoId,vidoeTitle,description,link,time,year,month,day
0,UCw3fku0sH3qA3c3pZeJwdAw,Daily Mail,rJ3QTRj6BFk,Mother compares getting coronavirus test to &#39;winning the lottery&#39;,Queues of people seeking a Covid-19 test were seen in Southend-on-sea amid a bottleneck in Britain's testing system. People ...,https://www.youtube.com/watch?v=rJ3QTRj6BFk,2020-09-17T15:23:29Z,2020,9,17
1,UCw3fku0sH3qA3c3pZeJwdAw,Daily Mail,T7N4Jz8KSxc,Bizarre moment Deliveroo driver is spotted on penny farthing,"River Irvine, 25, had been standing outside Envy Barbers in Covent Garden, London, when he spotted the Deliveroo worker riding ...",https://www.youtube.com/watch?v=T7N4Jz8KSxc,2020-09-17T14:35:54Z,2020,9,17
2,UCw3fku0sH3qA3c3pZeJwdAw,Daily Mail,wvVIN2PaK-s,CDC director Robert Redfield says face masks more important than COVID vaccine,CDC director Robert Redfield says the wearing of face masks is likely to be more important than a coronavirus vaccine as 'we ...,https://www.youtube.com/watch?v=wvVIN2PaK-s,2020-09-17T14:17:14Z,2020,9,17
3,UCw3fku0sH3qA3c3pZeJwdAw,Daily Mail,gsW2OXQbZmk,Trump claims CDC director Robert Redfield is wrong on face masks importance,"Donald Trump contradicts CDC director Robert Redfield, says a coronavirus vaccine is more important than the wearing of face ...",https://www.youtube.com/watch?v=gsW2OXQbZmk,2020-09-17T14:14:51Z,2020,9,17
4,UCw3fku0sH3qA3c3pZeJwdAw,Daily Mail,m_m5Rs6Zpxk,Trump says any violent protests around election will be &#39;put down&#39;,US president Donald Trump says any violent protests around the 2020 election in November will be 'put down.' Original Article: ...,https://www.youtube.com/watch?v=m_m5Rs6Zpxk,2020-09-17T14:08:44Z,2020,9,17
5,UCw3fku0sH3qA3c3pZeJwdAw,Daily Mail,5F-nZZsT1BI,Trump wants &#39;big payment&#39; for government over TikTok deal,President Donald Trump said Wednesday he was not ready to sign off on a deal for Oracle to buy TikTok from a Chinese parent ...,https://www.youtube.com/watch?v=5F-nZZsT1BI,2020-09-17T14:02:54Z,2020,9,17
6,UCw3fku0sH3qA3c3pZeJwdAw,Daily Mail,im1sWFDrECk,Hurricane Sally: Boat washes ashore in Pensacola as storm lashes Gulf Coast,"Hurricane Sally blasted ashore Wednesday near Gulf Shores, Alabama, as a Category 2 storm, shoving a surge of ocean water ...",https://www.youtube.com/watch?v=im1sWFDrECk,2020-09-17T14:02:04Z,2020,9,17
7,UCw3fku0sH3qA3c3pZeJwdAw,Daily Mail,cvhY5Jx4gyo,Restaurants in South Korea use robots to maintain social distancing,"Robots bring food to customers at No Brand Burger, a fast-food chain in South Korea where machines also take orders and cook ...",https://www.youtube.com/watch?v=cvhY5Jx4gyo,2020-09-17T14:00:45Z,2020,9,17
8,UCw3fku0sH3qA3c3pZeJwdAw,Daily Mail,w8pS4JqygXo,Boris Johnson: The UK does not have enough coronavirus testing capacity,"Boris Johnson bluntly acknowledged that there is 'not enough' capacity for screening as he blamed a 'huge, huge' surge in ...",https://www.youtube.com/watch?v=w8pS4JqygXo,2020-09-17T13:58:38Z,2020,9,17
