,channelId,channelTitle,videoId,vidoeTitle,description,link,time,year,month,day
0,UCw3fku0sH3qA3c3pZeJwdAw,Daily Mail,aiViDroDQpc,WHO confirms new outbreak of Ebola virus disease in Congo,Health Minister Eteni Longondo said four people who died in Mbandaka had tested positive at the national biomedical laboratory ...,https://www.youtube.com/watch?v=aiViDroDQpc,2020-06-01T18:14:34Z,2020,6,1
1,UCw3fku0sH3qA3c3pZeJwdAw,Daily Mail,rjE_3BSZ-W8,AG pledges to pursue &#39;justice and truth&#39; over George Floyd death,Minnesota AG Keith Ellison said Monday that he is 'very seriously' looking at prosecuting the other three officers who were at the ...,https://www.youtube.com/watch?v=rjE_3BSZ-W8,2020-06-01T18:07:41Z,2020,6,1
2,UCw3fku0sH3qA3c3pZeJwdAw,Daily Mail,h4wbPOSPeVY,Electric currents around Mars fundamental to atmospheric loss,"Scientists have mapped electric currents flowing around the red planet. They are caused by solar wind, formed of charged ...",https://www.youtube.com/watch?v=h4wbPOSPeVY,2020-06-01T18:05:37Z,2020,6,1
3,UCw3fku0sH3qA3c3pZeJwdAw,Daily Mail,-zislGe-6qc,Camden Market food sellers &#39;extremely excited&#39; as trading resumes,Outdoor markets and car showrooms will reopen from this morning as the Government urged Britons to act 'sensibly' as they enjoy ...,https://www.youtube.com/watch?v=-zislGe-6qc,2020-06-01T18:04:04Z,2020,6,1
4,UCw3fku0sH3qA3c3pZeJwdAw,Daily Mail,1O6z_BUWaPQ,Utah man aims bow and arrow at BLM protesters,"Video on social media shows Brandon McCormick climb out of his car at an intersection in Salt Lake City with a compound bow, ...",https://www.youtube.com/watch?v=1O6z_BUWaPQ,2020-06-01T18:02:51Z,2020,6,1
5,UCw3fku0sH3qA3c3pZeJwdAw,Daily Mail,AIAy97Msczg,Police cars destroyed and officers spat at as protests hit Chicago,The most recent fatal shooting involved two men driving down East 95th Street at approximately 1.41pm yesterday. A person in a ...,https://www.youtube.com/watch?v=AIAy97Msczg,2020-06-01T17:59:58Z,2020,6,1
6,UCw3fku0sH3qA3c3pZeJwdAw,Daily Mail,HIXaPv8Wdn4,Protesters march through New York City during the fourth day,Anti-police brutality protests have erupted in at least 75 cities across the U.S. after the death in custody of unarmed black man ...,https://www.youtube.com/watch?v=HIXaPv8Wdn4,2020-06-01T17:55:59Z,2020,6,1
7,UCw3fku0sH3qA3c3pZeJwdAw,Daily Mail,Vw-iKsqxV_U,Protesters shut down the Manhattan Bridge during march,"Horrifying video footage has emerged of New York Police Department officers clashing with protesters, a car in Manhattan set on ...",https://www.youtube.com/watch?v=Vw-iKsqxV_U,2020-06-01T17:50:18Z,2020,6,1
8,UCw3fku0sH3qA3c3pZeJwdAw,Daily Mail,lddIWyCwfBQ,Cops use tear gas against protesters in DC near the White House,"In Washington DC, fury erupted as the hour of an 11pm curfew neared and as police fired tear gas and pepper spray amid blazes ...",https://www.youtube.com/watch?v=lddIWyCwfBQ,2020-06-01T17:46:34Z,2020,6,1
9,UCw3fku0sH3qA3c3pZeJwdAw,Daily Mail,pZKcugrbNy4,Wreckage of house teeters over cliff after landslide in Kent,"Mother-of-five Emma Tullett (inset), 42, had only purchased her two-bedroom bungalow (right yesterday and left today) in August ...",https://www.youtube.com/watch?v=pZKcugrbNy4,2020-06-01T17:38:22Z,2020,6,1
10,UCw3fku0sH3qA3c3pZeJwdAw,Daily Mail,2kHKpJtVgfA,Matt Hancock calls Remdesivir the &#39;biggest step forward&#39; in briefing,"Britain today announced a preliminary daily Covid-19 death toll of 142, taking the official number of victims in the UK past 37000.",https://www.youtube.com/watch?v=2kHKpJtVgfA,2020-06-01T17:36:32Z,2020,6,1
11,UCw3fku0sH3qA3c3pZeJwdAw,Daily Mail,oEFZCN3H6FQ,Priti Patel slams &#39;far-right thugs&#39; who attacked police in London,The Home Secretary told the Commons she gave police her 'full backing' to tackle yobs responsible for violence scenes in ...,https://www.youtube.com/watch?v=oEFZCN3H6FQ,2020-06-15T21:17:28Z,2020,6,15
12,UCw3fku0sH3qA3c3pZeJwdAw,Daily Mail,YLa-I9TirWY,Westminster Cathedral opens its doors to worshippers again,Places of worship across the UK reopened for private prayer on Monday with worshipers sat in socially-distanced pews and ...,https://www.youtube.com/watch?v=YLa-I9TirWY,2020-06-15T21:16:07Z,2020,6,15
13,UCw3fku0sH3qA3c3pZeJwdAw,Daily Mail,inFq1OHg6IU,US Ambassador slams Russia after they convict Paul Whelan,A Russian court found ex-U.S. marine Paul Whelan guilty of spying for the United States on Monday and sentenced him to 16 ...,https://www.youtube.com/watch?v=inFq1OHg6IU,2020-06-15T18:16:46Z,2020,6,15
14,UCw3fku0sH3qA3c3pZeJwdAw,Daily Mail,yrRmN7CxqKM,Supreme Court endorses LGBTQ worker protection against discrimination,A U.S. Supreme Court ruling protecting gay and trans people from discrimination at work was hailed by LGBT+ groups on Monday ...,https://www.youtube.com/watch?v=yrRmN7CxqKM,2020-06-15T18:07:34Z,2020,6,15
15,UCw3fku0sH3qA3c3pZeJwdAw,Daily Mail,sny07I07O7I,Protesters demonstrate near White House on Trump&#39;s birthday,"Donald Trump turned 74 on Sunday and celebrated his birthday at his Bedminster golf course in New Jersey, before returning to ...",https://www.youtube.com/watch?v=sny07I07O7I,2020-06-15T16:06:25Z,2020,6,15
16,UCw3fku0sH3qA3c3pZeJwdAw,Daily Mail,whKWqWIZ_NA,Nike Oxford Street store sees scuffles break out as it re-opens its doors,Shoppers desperate to hit the high street formed huge socially distanced queues after dawn today as the majority of stores ...,https://www.youtube.com/watch?v=whKWqWIZ_NA,2020-06-15T16:04:44Z,2020,6,15
17,UCw3fku0sH3qA3c3pZeJwdAw,Daily Mail,jxROsavzl2A,German tourists arrive in Mallorca as travel restrictions ease,Motorists were queuing to enter France from Italy and Germany from Denmark this morning after emergency checks were lifted ...,https://www.youtube.com/watch?v=jxROsavzl2A,2020-06-15T15:56:04Z,2020,6,15
18,UCw3fku0sH3qA3c3pZeJwdAw,Daily Mail,uys7898bWqA,EasyJet CEO Johan Lundgren explains coronavirus safety measures as flights resume,"The first flight, from London Gatwick to Glasgow, left at 6.53am for a scheduled arrival in Scotland of 8.30am, as the airline ...",https://www.youtube.com/watch?v=uys7898bWqA,2020-06-15T15:52:58Z,2020,6,15
19,UCw3fku0sH3qA3c3pZeJwdAw,Daily Mail,s5CAEdYle1k,Cat successfully squeezes through gap under door in Illinois,"Mikko, who lives in Lombard, Illinois, likes to be with her owner at all times so upon finding the door closed she decides to try and ...",https://www.youtube.com/watch?v=s5CAEdYle1k,2020-06-15T15:47:42Z,2020,6,15
20,UCw3fku0sH3qA3c3pZeJwdAw,Daily Mail,dtFHIEDmvf8,Couple become unexpected owners of duckling after finding egg,"Will Hall, 26, and Alice Kendall, 22, from Winchester, Hampshire, discovered an abandoned duckling egg and hatched it in their ...",https://www.youtube.com/watch?v=dtFHIEDmvf8,2020-06-15T15:46:30Z,2020,6,15
21,UCw3fku0sH3qA3c3pZeJwdAw,Daily Mail,zr7eSpsNkew,Protesters burn down Wendy&#39;s after cops killed Rayshard Brooks,Atlanta police are seeking a masked woman suspected of burning down a Wendy's restaurant. Crime Stoppers of Atlanta offered a ...,https://www.youtube.com/watch?v=zr7eSpsNkew,2020-06-15T15:35:31Z,2020,6,15
22,UCw3fku0sH3qA3c3pZeJwdAw,Daily Mail,4nnJAfpqWVw,Firework thrown and riot police move in at BLM counter protest in London,Boris Johnson said it is 'the height of lunacy' to accuse Winston Churchill - who was Prime Minister twice - of racism after he lead ...,https://www.youtube.com/watch?v=4nnJAfpqWVw,2020-06-15T15:37:20Z,2020,6,15
23,UCw3fku0sH3qA3c3pZeJwdAw,Daily Mail,0y7CESFf3b0,Mourners in Mumbai gather outside home of Bollywood star Sushant Singh Rajput,Actor Sushant Singh Rajput has been found dead in his Mumbai apartment. The 34-year-old was one of Bollywood's most ...,https://www.youtube.com/watch?v=0y7CESFf3b0,2020-06-15T15:34:27Z,2020,6,15
24,UCw3fku0sH3qA3c3pZeJwdAw,Daily Mail,BJO22U0nBhY,Emmanuel Macron announces reopening of cafes and restaurants,"In an upbeat live TV address on Sunday night watched by families across the nation, Emmanuel Macron said virtually all ...",https://www.youtube.com/watch?v=BJO22U0nBhY,2020-06-15T15:32:03Z,2020,6,15
25,UCw3fku0sH3qA3c3pZeJwdAw,Daily Mail,v-uPRk75EDs,Adele leads messages to mark third anniversary of Grenfell fire,Adele thanked Grenfell United for 'fighting for true justice' during a YouTube memorial service to honour the victims of the Grenfell ...,https://www.youtube.com/watch?v=v-uPRk75EDs,2020-06-15T15:26:55Z,2020,6,15
26,UCw3fku0sH3qA3c3pZeJwdAw,Daily Mail,z0nnsbcdiuk,Thousands of protesters join BLM marches around the world,Sunday´s turnout in Tokyo underlined how Japan has historically been reticent in dealing with diversity and is now trying to ...,https://www.youtube.com/watch?v=z0nnsbcdiuk,2020-06-15T15:21:04Z,2020,6,15
27,UCw3fku0sH3qA3c3pZeJwdAw,Daily Mail,QRsB-TOqaqQ,Johnson urges shoppers to shop &#39;confidently&#39; as stores reopen,The Prime Minister visited Westfield shopping centre in East London today ahead of Monday's big retail relaunch for the British ...,https://www.youtube.com/watch?v=QRsB-TOqaqQ,2020-06-15T15:16:45Z,2020,6,15
28,UCw3fku0sH3qA3c3pZeJwdAw,Daily Mail,O-9c0HWRWuw,"Police in Palmdale, California rule Robert Fuller&#39;s death a suicide","Police in Palmdale, California, have announced they will investigate the death of 24-year-old Robert Fuller (left), who was found ...",https://www.youtube.com/watch?v=O-9c0HWRWuw,2020-06-15T15:06:03Z,2020,6,15
29,UCw3fku0sH3qA3c3pZeJwdAw,Daily Mail,1vzU_WzFj7c,&#39;We had a nice crowd&#39;: Trump defends half-empty Tulsa rally,President Donald Trump said Tuesday his Tulsa crowd was 'incredible' despite 'horrible ominous warnings' from the media and ...,https://www.youtube.com/watch?v=1vzU_WzFj7c,2020-06-23T23:18:48Z,2020,6,23
30,UCw3fku0sH3qA3c3pZeJwdAw,Daily Mail,V_Kjav0PWz4,Dr. Fauci says coronavirus vaccine will enter phase 3 trial,Dr. Anthony Fauci said there is a 'promising' coronavirus vaccine entering phase three trials next month and there could be a cure ...,https://www.youtube.com/watch?v=V_Kjav0PWz4,2020-06-23T23:14:36Z,2020,6,23
31,UCw3fku0sH3qA3c3pZeJwdAw,Daily Mail,TPiW3P7Zqbc,Huge 7.4 magnitude earthquake rocks Mexico,"A strong earthquake hit the southern Mexican state of Oaxaca on Tuesday, shaking buildings in the center of the capital of Mexico ...",https://www.youtube.com/watch?v=TPiW3P7Zqbc,2020-06-23T23:11:55Z,2020,6,23
32,UCw3fku0sH3qA3c3pZeJwdAw,Daily Mail,-H7zAiaKSsw,Dr. Anthony Fauci tells Congress he&#39;s never been told to slow down on testing,Dr. Anthony Fauci told Congress Tuesday that he's seeing a 'disturbing surge of infections' of the coronavirus and said it's ...,https://www.youtube.com/watch?v=-H7zAiaKSsw,2020-06-23T23:10:17Z,2020,6,23
33,UCw3fku0sH3qA3c3pZeJwdAw,Daily Mail,p1JgNil3OLY,Spanish royals seek to boost tourism sector with Canary Islands tour,"Mother-of-two Letizia, 47, looked effortlessly chic in a grey dress as she appeared alongside her husband, 52, to greet crowds of ...",https://www.youtube.com/watch?v=p1JgNil3OLY,2020-06-23T23:06:36Z,2020,6,23
34,UCw3fku0sH3qA3c3pZeJwdAw,Daily Mail,m39y98qR370,Vladimir Putin announces income tax increase for wealthy Russians,President Vladimir Putin raised income tax for wealthy Russians and offered new state handouts... Original Article: ...,https://www.youtube.com/watch?v=m39y98qR370,2020-06-23T23:07:26Z,2020,6,23
35,UCw3fku0sH3qA3c3pZeJwdAw,Daily Mail,y2AoAqDmq_U,"Food blogger takes on whopping 4,000 calorie fish and chips feast","Kate Ovens, 26, from Fleet, Hampshire, famed for conquering giant food dishes, was challenged to take on the mammoth task by ...",https://www.youtube.com/watch?v=y2AoAqDmq_U,2020-06-23T21:59:53Z,2020,6,23
36,UCw3fku0sH3qA3c3pZeJwdAw,Daily Mail,I3SVyFRS2wQ,Djokovic tests positive for Covid-19 s in the wake of Adria Tour,Novak Djokovic has tested positive for coronavirus after his Adria Tour tennis project held two events while ignoring social ...,https://www.youtube.com/watch?v=I3SVyFRS2wQ,2020-06-23T22:01:28Z,2020,6,23
37,UCw3fku0sH3qA3c3pZeJwdAw,Daily Mail,Dq1fXJTKmBQ,Goose called Phoenix forms incredible bond with owner,"James Cosgrove, 28, was handed a goose egg by a colleague just before lockdown - but he had no idea that it was fertile. Rather ...",https://www.youtube.com/watch?v=Dq1fXJTKmBQ,2020-06-23T14:36:29Z,2020,6,23
38,UCw3fku0sH3qA3c3pZeJwdAw,Daily Mail,0g6BAML6SYk,Chinese man walks like a monkey for exercise and to prevent illness,50-year-old Chen Haigang said that his unique workout routine helped him fully stretch his muscles and feel refreshed. Bizarre ...,https://www.youtube.com/watch?v=0g6BAML6SYk,2020-06-23T14:21:20Z,2020,6,23
39,UCw3fku0sH3qA3c3pZeJwdAw,Daily Mail,wQAjP3e2sPQ,Boris Johnson announces new lockdown measures,Customers could face a three-month waiting list for a trim and some salons said they will reopen at midnight to clear the huge ...,https://www.youtube.com/watch?v=wQAjP3e2sPQ,2020-06-23T14:19:23Z,2020,6,23
40,UCw3fku0sH3qA3c3pZeJwdAw,Daily Mail,c6UZT9IS9b4,Mexican cartel chief threatens government after mother&#39;s detention,"María Ortiz, the mother of Santa Rosa de Lima Cartel leader Jose 'El Marro' Yepez, was arrested during a major security ...",https://www.youtube.com/watch?v=c6UZT9IS9b4,2020-06-23T14:13:01Z,2020,6,23
41,UCw3fku0sH3qA3c3pZeJwdAw,Daily Mail,YuUhGKMmauI,Parliament hears urgent question on changes to furlough scheme,"Just 100000 new roles were added in the past week to take the total to 9.2million, according to Treasury numbers released this ...",https://www.youtube.com/watch?v=YuUhGKMmauI,2020-06-23T14:11:24Z,2020,6,23
42,UCw3fku0sH3qA3c3pZeJwdAw,Daily Mail,E6H-2H4YuAo,China puts final satellite for Beidou navigation network into orbit,The spacecraft was launched into geostationary orbit on top of a Long March-3B rocket at the Xichang Satellite Launch Center at ...,https://www.youtube.com/watch?v=E6H-2H4YuAo,2020-06-23T14:09:49Z,2020,6,23
43,UCw3fku0sH3qA3c3pZeJwdAw,Daily Mail,N8k9WZAzSYY,"Cops clash with protesters trying to take down Andrew Jackson statue in Washington, DC","'Hey, Hey, Ho, Ho, Andrew Jackson's got to go,' protesters shouted as they threw ropes around the statue of the controversial ...",https://www.youtube.com/watch?v=N8k9WZAzSYY,2020-06-23T11:12:11Z,2020,6,23
44,UCw3fku0sH3qA3c3pZeJwdAw,Daily Mail,at4cMrK_-5w,Official claims &#39;deprioritized&#39; nursing homes caused high death toll,The number of COVID-19 deaths in nursing homes and long-term care facilities across the United States has increased to 43 ...,https://www.youtube.com/watch?v=at4cMrK_-5w,2020-06-23T08:00:01Z,2020,6,23
45,UCw3fku0sH3qA3c3pZeJwdAw,Daily Mail,eyBVrOXwSNM,Two more Trump staffers test positive for coronavirus after rally,Two additional Trump campaign staffers tested positive for COVID-19 Monday bringing the total up to eight staffers who traveled to ...,https://www.youtube.com/watch?v=eyBVrOXwSNM,2020-06-23T00:26:46Z,2020,6,23
46,UCw3fku0sH3qA3c3pZeJwdAw,Daily Mail,Z7zjQ4RuK_U,Mississippi to remove Confederate symbol from state flag,Mississippi's state legislature has voted to remove the Confederate symbol from its flag after 126 years after both the Senate and ...,https://www.youtube.com/watch?v=Z7zjQ4RuK_U,2020-06-29T17:02:34Z,2020,6,29
47,UCw3fku0sH3qA3c3pZeJwdAw,Daily Mail,QR-B5H13Ka8,Crowds hit beaches in Florida and Texas as record COVID numbers surge across country,"Twenty six percent of counties across the United States are now battling uncontrollable coronavirus outbreaks, a data map shows ...",https://www.youtube.com/watch?v=QR-B5H13Ka8,2020-06-29T17:00:39Z,2020,6,29
48,UCw3fku0sH3qA3c3pZeJwdAw,Daily Mail,ybJy_PWa-2U,Hilarious moment alpaca stops cops as they try to search a property,"In the video shared by WA Police on Wednesday, two officers from Kellerberrin, a rural town two hours west of Perth, Australia ...",https://www.youtube.com/watch?v=ybJy_PWa-2U,2020-06-29T16:27:33Z,2020,6,29
49,UCw3fku0sH3qA3c3pZeJwdAw,Daily Mail,2CSBNPRpZmw,Adorable little boy talks his dad through planets and continents,"A little boy's future is certainly bright as he recites the planets and continents in adorable footage. Edgar, 3, from Hertfordshire ...",https://www.youtube.com/watch?v=2CSBNPRpZmw,2020-06-29T16:01:27Z,2020,6,29
50,UCw3fku0sH3qA3c3pZeJwdAw,Daily Mail,0ClbO3321Do,Driver captures &#39;apocalyptic&#39; sandstorm in Chinese city,"Apocalyptic footage shows the city of Hotan in western China being devoured by the sweeping sandstorm, turning skies orange ...",https://www.youtube.com/watch?v=0ClbO3321Do,2020-06-29T14:33:28Z,2020,6,29
51,UCw3fku0sH3qA3c3pZeJwdAw,Daily Mail,vtS56sg0kmc,Mayor of Leicester discusses local lockdown preparations and frustrations,Mayor of Leicester discusses local lockdown preparations and frustrations after fresh spike in coronavirus cases leading worries it ...,https://www.youtube.com/watch?v=vtS56sg0kmc,2020-06-29T13:03:47Z,2020,6,29
52,UCw3fku0sH3qA3c3pZeJwdAw,Daily Mail,lCnwE8HL52U,Boris Johnson promises spending blitz to revitalise UK economy,"Boris Johnson said he will 'double down' on investment in 'levelling up' the UK, comparing the effort to Franklin D Roosevelt's ...",https://www.youtube.com/watch?v=lCnwE8HL52U,2020-06-29T12:52:09Z,2020,6,29
53,UCw3fku0sH3qA3c3pZeJwdAw,Daily Mail,30W-J8QG6ds,How might a trip to the salon work with coronavirus safety measures?,Owner of London salon Threads & Co -show Matt Bartell has revealed to FEMAIL what one of the UK's first Covid-secure salons ...,https://www.youtube.com/watch?v=30W-J8QG6ds,2020-06-29T12:33:44Z,2020,6,29
54,UCw3fku0sH3qA3c3pZeJwdAw,Daily Mail,HQnBOMwMbcc,England cricket team train at the Ageas Bowl,Stuart Broad has spoken to a sports psychologist in a bid to get himself in the right frame of mind for taking on West Indies in front ...,https://www.youtube.com/watch?v=HQnBOMwMbcc,2020-06-29T12:12:50Z,2020,6,29
55,UCw3fku0sH3qA3c3pZeJwdAw,Daily Mail,uEFZydu_XzQ,Bizarre polling stations such as buses rolled out in Russia for Vladimir Putin&#39;s referendum,"Unconventional polling stations such as buses, gazebos and tents have been rolled out in Russia for the ongoing referendum ...",https://www.youtube.com/watch?v=uEFZydu_XzQ,2020-06-29T09:55:23Z,2020,6,29
56,UCw3fku0sH3qA3c3pZeJwdAw,Daily Mail,5bVfI98QXJY,Captain Tom congratulates five-year-old double amputee for raising £1.2m for the NHS,After Tony saw Captain Tom walking laps of his garden to raise money for the NHS Tony was inspired to do the same where he ...,https://www.youtube.com/watch?v=5bVfI98QXJY,2020-06-29T09:47:38Z,2020,6,29
57,UCw3fku0sH3qA3c3pZeJwdAw,Daily Mail,Htx7tbRwTAM,Psychologist shares top tips for teenagers and parents during coronavirus lockdown,"A psychologist shares his top tips to help relationships between teenagers and parents during lockdown. John Coleman, a Family ...",https://www.youtube.com/watch?v=Htx7tbRwTAM,2020-06-29T09:40:39Z,2020,6,29
58,UCw3fku0sH3qA3c3pZeJwdAw,Daily Mail,iYkKuKS54Go,Duchess of Cambridge helps plant garden for children&#39;s hospice,"The Duchess of Cambridge shows that she's not afraid of a bit of dirt in these remarkably candid photographs, taken as she ...",https://www.youtube.com/watch?v=iYkKuKS54Go,2020-06-29T09:13:26Z,2020,6,29
59,UCw3fku0sH3qA3c3pZeJwdAw,Daily Mail,wrNKkhdtmFs,UK airports prepare for influx after travel restrictions are lifted,"Spain-holiday.com, the third biggest holiday rental site in Spain, said it had a record-breaking Saturday morning with a 42 per cent ...",https://www.youtube.com/watch?v=wrNKkhdtmFs,2020-06-29T09:11:50Z,2020,6,29
60,UCw3fku0sH3qA3c3pZeJwdAw,Daily Mail,1aKe1uxL9V8,WHO warns there might never be a &#39;silver bullet&#39; for COVID-19,"Speaking at the WHO's headquarters in Geneva, officials said Covid-19 appears to kill 0.6% of all patients, or one in every 200, ...",https://www.youtube.com/watch?v=1aKe1uxL9V8,2020-08-03T16:45:10Z,2020,8,3
61,UCw3fku0sH3qA3c3pZeJwdAw,Daily Mail,omTGZUVReRY,Trump allows TikTok 45 days to negotiate a sale to Microsoft,Donald Trump has reportedly told Microsoft's CEO he 'may allow' the company to buy TikTok in the United States - but only if the ...,https://www.youtube.com/watch?v=omTGZUVReRY,2020-08-03T16:44:06Z,2020,8,3
62,UCw3fku0sH3qA3c3pZeJwdAw,Daily Mail,YPSwqp5fdIw,EXCLUSIVE - FULL VIDEO: Leaked police bodycam footage shows George Floyd&#39;s arrest for the first time,The terror on George Floyd's face as a rookie cop points a gun at his head while he sits in his car can be seen today for the first ...,https://www.youtube.com/watch?v=YPSwqp5fdIw,2020-08-03T16:42:48Z,2020,8,3
63,UCw3fku0sH3qA3c3pZeJwdAw,Daily Mail,S7LYksVjfsE,How does Rishi Sunak&#39;s Eat Out to Help Out work? MailOnline investigates,"Chancellor Rishi Sunak's 'Eat Out to Help Out' scheme launched today, with participating restaurants offering 50% off in a bid to ...",https://www.youtube.com/watch?v=S7LYksVjfsE,2020-08-03T16:36:15Z,2020,8,3
64,UCw3fku0sH3qA3c3pZeJwdAw,Daily Mail,C1jFzQHCmBk,Parents hire a glass box to present newborn baby to family and friends,"People who wish to introduce their babies to family and loved ones can hire the mobile cabin for $40 an hour in Monterey, Mexico.",https://www.youtube.com/watch?v=C1jFzQHCmBk,2020-08-03T16:32:13Z,2020,8,3
65,UCw3fku0sH3qA3c3pZeJwdAw,Daily Mail,OC1SxUhBgiY,People soak up the rays on Brighton beach amid heatwave weather,This clip shows a large gathering of people as they soak up the rays in the heatwave weather on Brighton Beach. Original Article: ...,https://www.youtube.com/watch?v=OC1SxUhBgiY,2020-08-03T12:02:28Z,2020,8,3
66,UCw3fku0sH3qA3c3pZeJwdAw,Daily Mail,xsr3uZdEEww,"US reports over 25,000 coronavirus deaths in the Month of July",California has become the first state to pass 500000 coronavirus cases as the death toll in the US tops 1000 for the fifth day in a ...,https://www.youtube.com/watch?v=xsr3uZdEEww,2020-08-03T12:00:09Z,2020,8,3
67,UCw3fku0sH3qA3c3pZeJwdAw,Daily Mail,WjcfeVnTnto,Dramatic moment huge rock falls from cliff in Plymouth,"The rock fell away from the edge of a cliff in Tregudda Gorge, between Trevone Bay and Padstow in Cornwall. Two walkers, who ...",https://www.youtube.com/watch?v=WjcfeVnTnto,2020-08-03T12:01:13Z,2020,8,3
68,UCw3fku0sH3qA3c3pZeJwdAw,Daily Mail,1mrj6EFXpU4,NASA astronauts exit SpaceX Dragon Capsule after a splashdown,NASA astronauts Doug Hurley and Bob Behnken splashed down in the Gulf of Mexico aboard SpaceX's Dragon capsule and ...,https://www.youtube.com/watch?v=1mrj6EFXpU4,2020-08-03T11:58:57Z,2020,8,3
69,UCw3fku0sH3qA3c3pZeJwdAw,Daily Mail,oobRQBABpvc,Dr. Birx says coronavirus is &#39;extraordinarily widespread&#39;,Dr. Deborah Birx on Sunday said the US has entered a 'new phase' of the COVID-19 pandemic. COVID-19 has become more ...,https://www.youtube.com/watch?v=oobRQBABpvc,2020-08-03T11:57:39Z,2020,8,3
70,UCw3fku0sH3qA3c3pZeJwdAw,Daily Mail,lkNiIvILY_Q,California evacuates residents as wildfire continues to spread,Thousands of people were under evacuation orders on Sunday after a wildfire in mountains about 75 miles east of Los Angeles ...,https://www.youtube.com/watch?v=lkNiIvILY_Q,2020-08-03T11:56:05Z,2020,8,3
71,UCw3fku0sH3qA3c3pZeJwdAw,Daily Mail,COtzqL31zes,&#39;I prayed for this one&#39;: Musk gets emotional as astronauts return,"The billionaire SpaceX CEO, left, rushed to Houston from the company's headquarters in Hawthorne, California to welcome ...",https://www.youtube.com/watch?v=COtzqL31zes,2020-08-03T11:54:48Z,2020,8,3
72,UCw3fku0sH3qA3c3pZeJwdAw,Daily Mail,1Np8WhFozmc,Hundreds flock to busy Bournemouth on hottest day of the year,It was calm before the storm this morning as rain was feared just 24 hours after sunseekers surged to beaches across Britain on ...,https://www.youtube.com/watch?v=1Np8WhFozmc,2020-08-03T09:48:15Z,2020,8,3
73,UCw3fku0sH3qA3c3pZeJwdAw,Daily Mail,5jPO1vF-fIQ,Nine-year-old &#39;Captain Tobias&#39; completes marathon fundraiser,Tobias Weller has raised more than £137000 after walking hundreds of metres a day. Captain Tobias – as he is called by his ...,https://www.youtube.com/watch?v=5jPO1vF-fIQ,2020-08-03T09:47:04Z,2020,8,3
74,UCw3fku0sH3qA3c3pZeJwdAw,Daily Mail,_XM_HqQaj6A,Washington state traps its first &#39;murder hornet&#39; and expects more,The Washington Department of Agriculture captured its first Asian giant hornet with a bottle trap in Whatcom County. It is the first ...,https://www.youtube.com/watch?v=_XM_HqQaj6A,2020-08-03T09:28:58Z,2020,8,3
75,UCw3fku0sH3qA3c3pZeJwdAw,Daily Mail,XYYo9Cna4pI,Student who lost 220 pounds shows off workout regime,"Dylan Wall, 21, from Dixon County, Tennessee, weighed 425lbs when he graduated from high school in 2017. He decided to ...",https://www.youtube.com/watch?v=XYYo9Cna4pI,2020-08-14T15:34:51Z,2020,8,14
76,UCw3fku0sH3qA3c3pZeJwdAw,Daily Mail,kfzN-QsDWQM,Hilarious moment three dogs join forces to steal food,This is the hilarious moment a trio of dogs help each other to steal some leftover dinner from the kitchen counter. Hugo - the 8 ...,https://www.youtube.com/watch?v=kfzN-QsDWQM,2020-08-14T15:32:02Z,2020,8,14
77,UCw3fku0sH3qA3c3pZeJwdAw,Daily Mail,tri_PVDPXlk,Prince Charles visits wreckage site of Stonehaven train crash,The ScotRail 6.38am service from Aberdeen to Glasgow derailed and slid down an embankment near Stonehaven on ...,https://www.youtube.com/watch?v=tri_PVDPXlk,2020-08-14T15:29:44Z,2020,8,14
78,UCw3fku0sH3qA3c3pZeJwdAw,Daily Mail,tW8IineiA9A,Travellers from France left frustrated by new quarantine,"The quarantine is set to come in at 4am tomorrow - and with an estimated British 500000 holidaymakers in France, a weekend of ...",https://www.youtube.com/watch?v=tW8IineiA9A,2020-08-14T15:28:31Z,2020,8,14
79,UCw3fku0sH3qA3c3pZeJwdAw,Daily Mail,Y8RJx1oOG7U,Escape from France: &#39;Saw the news and had to wake up my family&#39;,"The quarantine is set to come in at 4am tomorrow - and with an estimated British 500000 holidaymakers in France, a weekend of ...",https://www.youtube.com/watch?v=Y8RJx1oOG7U,2020-08-14T15:24:39Z,2020,8,14
