text,date,from
"More like, get the kids back, then the parents can go back to work, start paying their taxes again, and stop costing the government £millions in furlough payments...",20200524,Independent
"Say what you want Boris, but your not using my children as your &quot; let&#39;s see how it goes &quot; Guinea pig generation.<br>I have 5 children and only one of them would have to go back (reception class).<br>I think Boris has made some good decisions throughout this covid era but with this decision he can go get stuffed, because as a father it&#39;s my duty to protect my children.",20200524,Independent
Not happening! Not letting my kids back to school,20200524,Independent
You can keep your kids at home if you want.,20200524,Independent
Everybody prepare for a second spike :(,20200524,Independent
Boris must have bill gates on speed dial now,20201031,SUN
Boris johnson:STAY AT HOME<br><br>meanwhile: everyone is at school,20201031,SUN
"Since March:<br><br>▪️27 million people failed to get a GP appointment<br>▪️GDP drop of -22%<br>▪️One in ten people with suicidal thoughts<br>▪️6 million delayed cancer screenings<br>▪️An estimated 200,000 deaths linked to lockdown impact<br><br>The cure is worse than the disease. We need to learn to live with this virus, with precautions",20201031,SUN
These individuals are utterly useless.,20201031,SUN
Let&#39;s end this tyranny. Dodgy Pcr tests and false numbers are controling the narrative. You aren&#39;t fooling us again.,20201031,SUN
"Johnson takes us all for fools-<br>Stay at home, go to schools.",20201031,SUN
Serco Testing is Corrupt  !!! RESEARCH,20201031,SUN
WHY ARE BAILIFFS AND ENFORCEMENT OFFICERS ALLOWED TO COLLECT MISSED PAYMENTS FROM PEOPLE WHEN THERE IS A PANDEMIC. THE REAL VIRUS IS THIS GOVERNMENT!!!,20201031,SUN
So the mask wearing and first lockdown paid off beautifully.,20201031,SUN
"It&#39;s not the virus damaging our children&#39;s future, it&#39;s you Mr. Johnson  and your gang!!!!!!",20201031,SUN
"PEOPLE OF BRITAIN TIME HAS COME TO IGNORE EVERYTHING THESE MORONS SAY!!  STAY OPEN CHUCK AWAY THE MASK AND LETS SEE THEM FINE EVERYONE!! IF WE GIVE UP OUR FREEDOMS NOW , WE WONT GET THEM BACK!!",20201031,SUN
"The government: <b>screws entire country</b> <br><br>The Sun: This, but with 20 midroll ads",20201031,SUN
England is not yours,20201031,SUN
"Carl Heneghan Dr Mike Yeadon Who Lockdowns achieve nothing He&#39;s either totally thick or having his strings pulled, regardless he&#39;s a national disgrace.",20201031,SUN
"Meanwhile in Sweden living goes on as usual,",20201031,SUN
"By the sound of his voice and his body language, he does not believe what he trying tell us.<br>WHAT IS GOING ON.DING DING bring out you dead, where are they.????",20201031,SUN
Can’t make a living anymore ...but send the kids to school to pass it around anyway,20201031,SUN
"Sweden have 587 covid deaths per million.<br>UK have 685 covid deaths per million.<br>Sweden live absolutely normal life right now. Public transport is full of people without face masks. No restrictions in shops, hospitality sector and other areas of life. But they have less covid deaths then us.<br>WHAT IS GOING ON?",20201031,SUN
"Where have I heard this before? Oh yeah, a coupe of weeks to flatten the curve that turned into never ending months. All for 99.8% survival. Conveniently leave education institutions open (just like last time) so they super spread a non lethal flu like virus so next step is “look! The numbers are rising!). We will not accept this.",20201031,SUN
I hope the sheep are seeing the red flags by now.,20201031,SUN
"Tier 2 Friday , tier 3 on Saturday, tier 4 on Sunday sounds like a Craig David song",20201222,Guardian
She absolutely loves this power. <br><br>I’m still shocked Scots would vote for her.,20201222,Guardian
Scotland tier 6 rules now mean you cannot see anyone not even yourself. All mirrors in scotland to be removed at midnight and everyone must wear a complete head covering which must completely obscure the eyes preventing any vision.,20201222,Guardian
In tier 5 it will be illegal to look out of your window,20201222,Guardian
What the he&#39;ll where going back wards we have had lockdown shut all kind of shops for weeks and we are still no better of just a wasted 10 months joke,20201222,Guardian
"So, it&#39;s been totally fine for me to travel to another locality daily throughout the whole pandemic for work whilst sitting in an office with up to 15 other staff members, but, I can&#39;t travel to see my own family. Yeah, ok then.",20201222,Guardian
When a government can class you as ‘non essential’ there is a problem,20201222,Guardian
"Suddenly level 10, we just start killing people before they can get the virus.",20201222,Guardian
"I see her, I hear her, I feel depressed everytime",20201222,Guardian
Tier 5 . You are no longer allowed to look out of your window.,20201222,Guardian
All in the name of a virus that has killed less than 1 percent of the people it has infected! Absolutely unjustified and clearly a larger agenda at play here.,20201222,Guardian
"These, our so-called leaders, are just loving this new powers...",20201222,Guardian
It&#39;s ALL lies.,20201222,Guardian
Wallace: But you&#39;ll never take our freeedoooommmmm!!<br><br>Establishment: Oh yes we will and we&#39;ll send Wee Kranky to do it...<br><br>Wallace: As you wish my lord..<br><br>If Braveheart was remade today..,20201222,Guardian
Put lockdowns to a referendum. People have a right to Self determination... since Nicola loves referendums,20201222,Guardian
"Recommended quick read this Christmas, ‘Revolutions and Rebellions’ on Wikipedia.",20201222,Guardian
Scotland we must get rid of this power hungry dictator,20201222,Guardian
"\"Wait a second... you want to make these daft guidelines into LAW?! (<a href=\"\"https://www.youtube.com/watch?v=dnmxaES-qWY&amp;t=0m40s\"\">0:40</a>) who do you think you are?! 😡\"",20201222,Guardian
I hope one day I will see these politicians behind bars for what they&#39;ve done to us.,20201222,Guardian
Nuremburg tribunals required in the future,20201222,Guardian
"loosely translated: &quot;my chums haven&#39;t made enough money yet, when they do we can go back to normal&quot;",20210602,Guardian
And so he schmoozes his way towards reluctant &quot;lockdowns&quot; and restrictions. Poor us.,20210602,Guardian
Boris should do the world a favour and go play with the traffic prefably in the fast lane of the M25 and also in non rush hour so he gets hit hard.,20210602,Guardian
OMG IS BORIS VISITING HIS LONG LOST CHILDREN,20210602,Guardian
If he does another lockdown this country will explode 🔥,20210602,Guardian
"This will STOP only when we say STOP. Stop complying, open businesses indoors, do your things, meet your people, live your life. Then all this charade will become unenforceable and unpoliceable.",20210602,Guardian
"Zero Covid19 deaths for the whole of the UK is somehow ambiguous data?<br>Bojo better get his wife witch to brew up some hubble bubble, because I&#39;ve got a feeling there may be double trouble if he flip flops over the June 21st Great Reopening!<br>Muppet!",20210602,Guardian
The data might be ambiguous. But you’re definitely ambitious that we will listen any longer,20210602,Guardian
The MHRA data shows thousands of adverse reactions and deaths from the experimental gene treatments.,20210602,Guardian
I’m sick of hearing about the data. Are they ever going to show us any of this so-called data? Or are they just gonna keep talking about it like some mythical creature,20210602,Guardian
"The data isn&#39;t ambiguous, you are, son",20210602,Guardian
Boris has made up his mind but just wants to delay giving the message. Prepare for June 20th 11:59pm when he says we are going into lockdown and then June 21st he will say Carrie is expecting baby no.2,20210602,Guardian
Your nose is growing by the minute Boris.,20210602,Guardian
It seems people have lost their love for liberty :(,20210602,Guardian
&#39;The &quot;data&quot; is ambiguous&#39; - what data Boris? &#39;Deaths from any cause within 28 days of a (discredited) +ve test&#39;?,20210602,Guardian
"The statistics simply say no deadly pandemic. No excess deaths, no deadly pandemic. Look after yourself and live life.",20210602,Guardian
Boris is the new Father Christmas “don’t believe”,20210602,Guardian
"Boris, just admit - you are NOT in control. And shut up.",20210602,Guardian
All these comments will be analysed by his team of psyco(path)logists to determine how well you are likely to accept the next surge of restrictions and how you just think Boris is meandering when actually the course is already set. Time for action not words or it will be a fait accompli !!<br><br><br> assessing how the,20210602,Guardian
What they should be focusing on is deaths!!!! But they can&#39;t do that because as soon as that is focused on more people will be asking why this continues.,20210602,Guardian
Feel so bad for people who can&#39;t work or have lost their jobs through this.,20210104,SUN
“The definition of insanity is doing the same thing over and over again and expecting different results.”,20210104,SUN
who else click on the video to scroll down to the comments?,20210104,SUN
"We’re already in a lockdown , they just call it “tier 4”",20210104,SUN
&quot;We will not have another lockdown&quot;-  Boris Johnson legit a few months ago.,20210104,SUN
"You can&#39;t tell people it&#39;s disastrous to see family, friends and loved ones or that it&#39;s potentially deadly to go golfing, swimming or skiing then in the same breath tell people to go to work as usual. It&#39;s just not going to work mate. Either we stay home or we don&#39;t.",20210104,SUN
maybe tougher measures on these crooks and their private companies would be better,20210104,SUN
Title should be &quot;Boris warns as England enters third lockdown then Wales and Scotland does their own things&quot;,20210104,SUN
Even the glove dispenser behind him is upset.,20210104,SUN
"Boris to wancock &quot; We need more lockdowns, there may still be some businessess left that have not gone bankrupt yet and some people still have jobs&quot; wancock &quot; we&#39;ll soon sort that out&quot;",20210104,SUN
This Virus will end when the Government decides it will.,20210104,SUN
Hospitals so full that they can occupy a ward for an interview...,20210104,SUN
"It&#39;s only going to be tough, because the government is making it tough. The virus isn&#39;t responsible for wrecking peoples lives, its the government. This man is a monster.",20210104,SUN
POV: You&#39;re genuinely sick of hearing this guy&#39;s voice,20210104,SUN
A straight jacket would match his hair.,20210104,SUN
&quot;Tougher measures&quot; until the economy and all small businesses are completely destroyed.   This is what this is all about. Nothing to do with virus.  This Masonic Tory government is doing as its told by the globalist elites.,20210104,SUN
This is the same guy in April and March saying “I’m shaking and hugging everyone” 😂,20210104,SUN
Stevie Wonder could see this coming,20210104,SUN
"Tough tiers, tough weeks ahead. Suicide rates up.  Families falling apart. Fear shuts down your immune systems. What about more taking responsibility for your health, lifestyle etc.",20210104,SUN
We&#39;ve got tough weeks coming? Wtf does this man think everyone has had since March? Jesus 🤦‍♂️,20210104,SUN
"Just laying the ground work for another lockdown. Text book really. Give it 6 weeks... &quot;my friends, the cases are spiking again and we must close down&quot;",20210308,DailyMail
"funny because I recall schools being open during the whole pandemic until recently, without any problems, because kids were immune init",20210308,DailyMail
"\"The accepted false positive rate on these tests start from 0.8 of 1%. Figures from <a href=\"\"http://gov.uk/\"\">GOV.UK</a> today show that in the 7 days up to the 8th March 5",20210308,DailyMail
But before they said schools don’t effect the transmission of coronavirus??,20210308,DailyMail
Why do you think Furlough till September wake up people.,20210308,DailyMail
Yawn 🥱 can’t people see through this devious liar yet?,20210308,DailyMail
"Of course there will be more recorded cases, when so many children are tested so frequently there will be thousands more false positives added to the statistics that currently report 2000 infections each day that are nothing of the kind.",20210308,DailyMail
do not trust this man or whatever the other clowns are saying,20210308,DailyMail
And the sky is blue and the grass green too. Cases in the healthy shouldn’t be relevant if we’re as close to protecting all the vulnerable/elderly as they say,20210308,DailyMail
"The people and friends I know,even the ones that totally cooperated with lockdowns are so frustrated and angry that I’m convinced that if he try’s anything again it’s going to be a summer of troubles.",20210308,DailyMail
"Bluster, lies and lies. He doesn&#39;t give a stuff for anyone but himself.",20210308,DailyMail
Biggest scam ever perpetrated,20210308,DailyMail
Educate your children to this bs,20210308,DailyMail
This man is as big a criminal as Tony Blair. And we ain&#39;t seen nothing yet.,20210308,DailyMail
Feel sorry for this generation of kids.. it’s bin hard on everyone but I think the kids will suffer the most in the long run..,20210308,DailyMail
3 weeks to flatten the curve,20210308,DailyMail
"Yip, another lockdown on it&#39;s way.  The lying toe-rag.",20210308,DailyMail
At least there is no flu anymore <br>At all<br>0,20210308,DailyMail
The Government are just backing themselves up. &#39;&#39;Don&#39;t say we didn&#39;t warn you&#39;&#39;,20210308,DailyMail
When are Doris and his minions going to be called to account for their vile actions? The lockdown is the disease!,20210308,DailyMail
Due to lockdown I can go to college with a room of 30 people that i do not know. But I can’t go see my mum who has cancer that’s not been out once since this started and she could pass any day. And now I have to wait a months to she her,20201105,BBC
It is interesting that just about everyone I talk to does not believe the BBC or the government.,20201105,BBC
Will the last person in Britain please switch out the light.,20201105,BBC
I dream of guillotines made of the finest English Oak and Sheffield Steel.,20201105,BBC
The comments below are equal parts hilarious and terrifying.,20201105,BBC
"I&#39;m having a gathering at mine this Xmas, I can accommodate 68 million people, all is welcome.",20201105,BBC
"Drove to work this morning. From Wimbledon to Old Street. Traffic was heaving, pavements were overflowing, cafes had queues. Lockdown my arse.",20201105,BBC
The corrupt agenda continues. We know what you&#39;re up to. Don&#39;t think we don&#39;t.,20201105,BBC
"Folks, this was never about a virus, this is the long planned roll out of the UN&#39;s AGENDA 21/30, NEW WORLD ORDER, NEW NORMAL agenda of tyranny running under the cover of a virus to get you to go along with it.   Pure evil posing as care.  They plan on destroying ALL smaller businesses and taking away ALL your rights and freedoms....PERMANENTLY.  WAKE UP!",20201105,BBC
These lockdowns are going to destroy economies!!! And what happens next after economies collapse?,20201105,BBC
"Meanwhile, football &quot;leaders&quot; in England are going to the Government begging for taxpayers money for a sport that pays some players £300,000 A WEEK. Yes, really.",20201105,BBC
"\"The infection rate increase rapidly after china and WHO have claimed that it would not be a serious situation.The world is plunged into economic <a href=\"\"http://chaos.it/\"\">chaos.It</a> is more severe influence than death.\"",20201105,BBC
Every body better start saying there prays from the evil what these devil worshippers start doing,20201105,BBC
What propaganda man,20201105,BBC
This is getting ridiculous. <br><br>Loads of people losing it stuck at home. This is a crime against humanity for a virus which has a 99.7% survivibilty.,20201105,BBC
The shills are back in town and on here.,20201105,BBC
"this is the decline of the democracy, im not sure that we  even have a democracy, this is absolutely totalitarian to take people&#39;s rights and lock them.",20201105,BBC
Its all BS. How anybody but the useless BBC believes this is just astounding.,20201105,BBC
remember remember the 5th on November,20201105,BBC
"If the lockdown is until December the 2nd, Why has the furlough scheme been extended until the end of March 2021? 🤔<br>Will this lockdown be the same kind of lie as the last one?",20201105,BBC
Vaccine passports are coercion and coercion is unlawful.,20210222,DailyMail
Freedom? 🤣<br><br>Digital ID and Covid Passports?,20210222,DailyMail
"Covid has been prioritised over all other health issues without any open or public debate or concern for the consequences, you have to be really blind or naïve not to see it. These measures which have nothing to do with medicine or science, governments are not fighting the dangers of the virus but are fighting the basic rights of their people and destroying their health, economy, education, ecology, culture and other aspects of life.” Andthere is absolutely no evidence whatsoever of any authentic public health threat that remotely justifies the totalitarian emergency measures we are being subjected to or the damage that is being done to society.",20210222,DailyMail
Why isn&#39;t he in jail yet?,20210222,DailyMail
"Basically holding us at ransom and blackmailing us into having this poison jab, sickening! Protect your families and children from this poison",20210222,DailyMail
16 weeks of hell no different to living in a cell,20210222,DailyMail
The moments i frequently here this bozo talking about my life and or restrictions upon it I just laugh and say to myself &quot;you do not have that much power you kin idiot&quot;,20210222,DailyMail
Then bringing it back in a couple of months don&#39;t kid yourselves people.,20210222,DailyMail
No alleged WHOLE genome exists,20210222,DailyMail
"Dont worry folks, 4 months is enough time to invent loads of variants to keep it going. Dont trust this man, and definately dont give him your vote in anything in future.",20210222,DailyMail
What a hoax,20210222,DailyMail
LOCKDOWN IS OVER PASS IT ON,20210222,DailyMail
They won’t tell us their alleged pathogen ?,20210222,DailyMail
Arrests soon.,20210222,DailyMail
How can you vaccine a bit of a genome pathogen ??!!,20210222,DailyMail
Four months to another year or 5,20210222,DailyMail
Nuremberg 2021,20210222,DailyMail
Pathogen is ??,20210222,DailyMail
Transmission of what ?,20210222,DailyMail
Ridiculous that school kids gotta get tested twice a week at home and school especially when we have no symptoms! Also wearing a mask in class! What the hell-,20210222,DailyMail
Don&#39;t have any particular view on Boris but you have to admit it was a pretty decent speech.,20200323,Independent
"This should all have been done at least two weeks ago. This clown has done too little, and too late. The government were beaten to the closure of libraries and leisure centres by many councils at the end of last week. Some shops have already closed volunteerily in order to protect their staff and the public. Most of us could see that were heading for the same situation as our friends in Italy, and we needed to take action much more quickly than the government has done. The Italians at least have a health care system which has not been run into the ground by ten years of cuts and underfunding.",20200323,Independent
"Flights from China, Iran and Italy STILL coming to UK on a daily basis....",20200323,Independent
Anybody else getting V for Vendetta vibes? Is this how it starts?,20200323,Independent
Should have done this in January.,20200323,Independent
This is good but is there still flights coming in and out,20200323,Independent
This is coming like a movie.kmt,20200323,Independent
Does anyone believe now that Jeremy Corbyn would have made a better prime minister?  We chose correctly.,20200323,Independent
"I think there is solution and I am sure we can get rid of this corona virus and I also think we have this only option to get rid of this corona virus which is written below<br>1- must lock down the country<br>2- no flight in , no flight out<br>3- block all borders<br>4- close each and everything <br>5- ask young volunteers (i m available with 100s more with me) to join as a team to provide 2 time food materials door to door for free<br>6- involve charities to collect more donations for serving food to the nation<br>7- no body will come out<br>8- volunteers will work for food factories voluntarily for 4 to 6 weeks <br>9- total lock down no one will be allowed to come out<br>10- within a week we will get the massive reduction in corona cases but the result of improvement will be there from the day first<br><br>Sir please take it as seriously as I described, the situation is controllable only by the way I explained, if want my help I can manage it and i m available to serve the people voluntarily free of cost , but please do what I am saying , this is the only solution lockdown is need of this time <br>If we want to get rid of this virus then we have to do what i have said earlier .",20200323,Independent
The Event is upon us.<br><br>Remain indoors!,20200323,Independent
"If this was done sooner we wouldn&#39;t have 335 deaths or whatever it is, I am frustrated that it wasn&#39;t sooner but at least it is happening now the three week lockdown.",20200323,Independent
"What about construction??? That&#39;s whoes on the tube in the mornings, yet it&#39;s not essential at all.",20200323,Independent
What&#39;s the point of a bloody lock down if people get to exercise on the roads?,20200323,Independent
"So basically nothing will change. People will go to work and get infected, people will go to the park and get infected....what a fking  joke.",20200323,Independent
What if we have flights,20200323,Independent
"Meanwhile 5G gets deployed, full control soon welcome to new world order",20200323,Independent
What is the legal basis for this lockdown? Anyone here versed in the law and the legality of it? Thanks,20200323,Independent
"\"<a href=\"\"https://youtu.be/oeYwsDcbaUk\"\">https://youtu.be/oeYwsDcbaUk</a> 🚨🚨🦠 a worth watching @@<br>Recent <a href=\"\"http://www.youtube.com/results?search_query=%23covid19\"\">#COVID19</a> data show T cells may be essential to prevent severe COVID complications. We’ve been laser-focused on developing a novel T cell activation platform for years &amp; have designed a <a href=\"\"http://www.youtube.com/results?search_query=%23covid\"\">#COVID</a>-19 <a href=\"\"http://www.youtube.com/results?search_query=%23vaccine\"\">#vaccine</a> to activate T cells for long-term impunity!!\"",20200323,Independent
"Why don&#39;t they make supermarkets home delivery and click&#39;n&#39;collect only , then you stop queues of people possibly getting infected?",20200323,Independent
Boris the undertaker,20200323,Independent
Broad casting <br>Bull<br>Crap<br>Stop paying your license fee,20200623,BBC
"Will the House of Commons all be back? As soon as they are back then send kids back, they are not Boris Johnson guinea pigs 😡😡😡😡",20200623,BBC
lol &quot;i&#39;m not qualified to teach my children.&quot; Yeah? Why do you have children then? lmao,20200623,BBC
Becoming parents means you also have to become your children&#39;s teachers. It&#39;s parents responsibility to teach their children manners and things like how to read and write. If you Are not qualified to teach your children anything then don&#39;t become parents and neglect your children. That is why there&#39;s a lot of problem kids out there causing problems and parents not caring.,20200623,BBC
"\"<a href=\"\"https://www.youtube.com/watch?v=oV9-0VuKbZ4&amp;t=0m55s\"\">0:55</a> bbc must have  better designer tables that these\"",20200623,BBC
Scotland need think a lot before adjust lock down rules.,20200623,BBC
Boycott CCP,20200623,BBC
I live in ireland ;o,20200623,BBC
They should leave it until September,20200623,BBC
"It’s funny how other countries have - the not so developed countries they call it, have had better and just top notch alternatives.  Teaching each student via online with teacher and student interaction,  for those who don’t have a stable internet connection, other facilities formed for them with adequate PPE as well as tests done.  I don’t understand why it’s so hard for these parents.",20200623,BBC
Comment section open ! !   That&#39;s good...,20200623,BBC
Absolutely not. There will be a devastating second peak this winter which will completely and utterly overwhelm the NHS barring the greatest medical miracle of all time. It’s sad how much people are ignoring Chris Whitty who clearly knows what he is talking about. To emphasise how bad the situation is the following things will NOT happen next year:<br>Wimbledon <br>Glastonbury <br>Euros <br>Olympics/Paralympics <br>Edinburgh Festivals <br>Notting Hill Carnival <br>A vaccine is the ONLY SAFE WAY out of the pandemic and there is no way it will be ready in time for these events to take place. Anyone who thinks these events will happen next year are kidding themselves and need a big kick up the backside.,20200623,BBC
The plandemic went exactly as planned.The people did what they were told like good little sheep.Healthy people were told to stay at  home for no reason. Family life was greatly disrupted and fear was spread throughout the world.,20200623,BBC
White lives matter too<br><br>But not according to the BBC<br><br>Good time to get canceling you&#39;re BBC license,20200623,BBC
Thank you for the information. It&#39;s curious to see how countries within a certain area respond to the pandemic.,20200623,BBC
