text,date,from
We be back in full lock down by November,20210222,Guardian
"More lies, broken promises and false hopes.",20210222,Guardian
"Liar, Liar, pants on fire... here, let me put it out with this brick 😉",20210222,Guardian
So tens of thousands more unnecessary deaths then.,20210222,Guardian
what about the people who the vaccine killed ??????????????????????????????,20210222,Guardian
So its like i was thinking. That&#39;s a global washing Brain  decisions. Everywhere its the same.,20210222,Guardian
This must be the 10th lockdown.,20210222,Guardian
What a Hancock<br>And so is Bolix,20210222,Guardian
"BORIS JOHNSON is a political beast, he puts at risk with his elementary speech the inhabitants of the islands and the relations between countries, due to his political problems in his country, the future is not going to be as he believes, neither with much weapons nor with colonialist and genocidal words, the Falkland Islands are Argentine as London is from England, how is it possible that countries like England with experience and many brilliant people continue to have ministers of such low level as BORIS JOHNSON speaks as the dictator and murderer Galtieri of Argentina as the English beast Margaret Thatcher friend of the dictator and murderer Pinochet",20210222,Guardian
Never going to last lockdown from November to next April coming soon,20210222,Guardian
So it&#39;s slowly going to ease from insanity to irrational I guess,20210222,Guardian
"How about buying a comb, Boris? You look ridiculous.",20210222,Guardian
He speaks with an English accent but Boris is a German supporter. Our who political class are sell outs and German supporters. Destroy the German  house of commons. We need to take over parliament with force.,20210222,Guardian
"what is he trying to hide unter that wierd haircut, maybe a neuralink implant?",20210222,Guardian
Almost every comment section on Boris videos has been turned off. Why? Do the mean comments hurt is feelings?,20210222,Guardian
He needs a new face !Ugh!,20210222,Guardian
"Just in time. HSBC will collapse sometime around September, followed closely by Santander. The Bank of England and the EuroGroup will no longer be able to keep the lid on the Hyperinflation that is already in circulation and is only being held back by printing money around the clock.  Enjoy the Summer.",20210222,Guardian
Lockdown doesn&#39;t apply too Chinese students coming into our country ?? Why ?    Money !! So there aloud flights over here ! and us Brits cant fly anywhere,20210222,Guardian
FROM GERMANY lob mister johnson:SIE HABEN GUTE ARBEIT GEGN CORONA GELEISTET;WUNDERFULL!!,20210222,Guardian
What’s the pathogen ?,20210222,Guardian
"“When the people fear the government, there is tyranny. When the government fears the people, there is liberty.”<br>start getting scared Boris and Co,  the PEOPLE are coming for you",20210602,DailyMail
They should not have this kind of power over the people for any reason,20210602,DailyMail
Going to try to let? They have overstepped power by far and people are just letting them get away with it,20210602,DailyMail
&#39;We&#39;re going to try to allow people to travel&#39; welcome to the world of the fat little dictator Kim Jong Johnson.,20210602,DailyMail
British priminister is just a big pharma salesman now.....,20210602,DailyMail
"Haha  BORIS stick the travel,vaccine,lockdown, visiting or hugging family and friends, opening a window etc......where the sun dont shine",20210602,DailyMail
"Today&#39;s word &quot;Try&quot;<br>Compulsive thieves TRY not to steal,<br>Clumsy people TRY not to hurt themselves,<br>And most of the time with a few exceptions they FAIL",20210602,DailyMail
"Travelling should have never been restricted, WEF puppet willingly pushed the great reset. You will own nothing an be happy.",20210602,DailyMail
It&#39;s another advert for the sheeple to take up the Vaccines from Boris,20210602,DailyMail
Bojo the clown is just preparing the sheep  into another lockdown but they still don&#39;t get the hint that no one will go on holiday . 🤡,20210602,DailyMail
We don&#39;t get this time back. Another year written off. Events due to take place at CHRISTMAS are already being cancelled!,20210602,DailyMail
The dinghys have never stopped coming to Britain ever since the pandemic started,20210602,DailyMail
Resist the great reset! They have no authority over us. No lockdowns! Open borders! Fight for freedom!,20210602,DailyMail
"🤣🤣🤣😂🤣😂😂😂🤣🤣🤣 “but but I got the jabs, i did as you asked” 🤣🤣😂😂🤣🤣🤣🤣🤣🤣🤣🤣🤣🤣🤣🤣🤣🤣",20210602,DailyMail
"Boris. I&#39;ve been lucky enough to work all of this plandemic. Guess what. I&#39;ve not had any sort of cold or kung flu. <br>How strange. <br>So when it comes to holidays, I&#39;ll go if I want to. I was born a free person",20210602,DailyMail
Why is a Kahzarian leading the British people. One cannot serve 2 masters.,20210602,DailyMail
Try?<br>They&#39;re already allowing people to travel that&#39;s how variants have been getting into the UK,20210602,DailyMail
"No hesitation moving countries to the red list, except India because we were just about to do a trade deal, but, no hesitation i stress. So lets keep everyone at home, bored as hell, whilst we let people in with new virus strains and then SAGE talk about locking down again. No hesitation. lol",20210602,DailyMail
He wants to protect the people of this country......🤣🤣🤣🤣,20210602,DailyMail
🐂💩,20210602,DailyMail
IF YOU THINK THE LOCKDOWN SHOULD END NOW OR AT LEAST MORE MEASURES LIFTED PUT A THUMBS UP PLEASE.,20200510,Independent
"Totally stupid this measures. I work in the NHS and this is  an insult  for all of us. First  noone need to exercize outside,people is dying!, that will be putting everyone at risk,  children should not go to school until vacines are out,  anyone   outside should  use mask,  social distancing is a myth the virus can travel more than 8 meters , so is all nonsense.",20200510,Independent
Whoever controls the numbers controls the population 🤷🏾‍♂️,20200510,Independent
So it’s basically the same advice under a different slogan,20200510,Independent
in coming second wave,20200510,Independent
Hes just waffling,20200510,Independent
Nice speech ? The appreciation of the efforts of people and the thoughts and condolences for people who have lost people to the virus was a nice sentiment<br><br>HOWEVER -<br>I picked up on several key points during the speech that emphasise the plan to monitor and track everyone<br>He said &quot;although we have a plan it is a conditional plan&quot; <br><br>The importance of using Data to stay on top of the virus ? ( and our privacy)<br><br>Levels 1 to 5 alerts which fundamentally was used to install fear amongst people to accept whatever the government told you during the 9/11 period which was followed by the &quot;Weapons&quot; of mass destruction campaign<br><br>He said it will be a necessity to continue to monitor the virus and we will all need to be part of the continued war against the virus<br><br>And tighter controls on people entering the uk . To prevent a re spike of the virus happening<br><br><br>All sounds good on paper ! But !<br><br>I can&#39;t help thinking tat the speech that offered nuggets of hope and &quot;ifs&quot; it was merely a preparation to acclimatise all of us to the next phase of the conditional plan which may ( i think WILL) introduce the reopening of business . Going back to work . Going on holidays overseas. Life insurance . Etc........providing you download and use there monitoring and tracking app of all of us.<br><br>Which obviously forces you by leverage to give up your rights to privacy and data protection because you have no choice if you wish to Work .Travel or go back to normal life again<br><br>JUST A THOUGHT ?,20200510,Independent
so basically nothing is changing just fining people money,20200510,Independent
"In an average year 17,000 people die of Influenza in the UK. How many have died this flu season?",20200510,Independent
Ur well fit,20200510,Independent
Moist prick,20200510,Independent
"Can I go and hug my grandkids or not?<br>What a load of rubbish, why doesn’t he  phone Trump to get a lesson in speaking plain English.",20200510,Independent
"Just to keep you safe, rest assured that the NHS have indemnified their heroes from prosecution and accountability for medical negligence, breaches of duty of care and all manner of conceivable malpractice",20200510,Independent
It’s been weeeks and we’re only on 4 wow,20200510,Independent
If everyone wore masks like in Taiwan then this whole thing wouldn&#39;t even be a problem,20200510,Independent
"This is genocide, millions will die now. Disgusting government and only cares about money.",20200510,Independent
"\"So by July some leasure reopens but with only members of your family?? When will we be able to see other people? <a href=\"\"https://www.youtube.com/watch?v=1VRIajS2JjA&amp;t=22m05s\"\">22:05</a>\"",20200510,Independent
This Corona virus is something else to humanity every body is panic over it and soon it gonna affect the global economy this is the high time to start investing in forex trading,20200510,Independent
So are secondary schools opening or just primary,20200510,Independent
Lockdown will carry on until june the 1st i guess,20200510,Independent
The pubs are shut down but not if they serve a meal 🤣🤦🏻‍♀️🤦🏻‍♀️🤦🏻‍♀️because the virus knows to stay away from pubs with dining 🤣🤣🤣good lord people. Wake up!,20201014,BBC
Don’t worry guys Covid has manners. If you get a meal you’ll be fine.,20201014,BBC
"Pubs can only open if they serve food? Yes of course, because the coronavirus only infects hungry people. 🤣",20201014,BBC
Im just here for the comments,20201014,BBC
We should go and arrest all of these politicians.,20201014,BBC
If a pregnant Woman go swimming she is basically a human submarine,20201014,BBC
"&quot;Ah, yes, put all these restrictions but the &#39;virus&#39; knows how much stacks are in your wallet and where to go.&quot; 😆😆 Government&#39;s a joke",20201014,BBC
The BS detector has gone into overdrive. Ordinary Brits know they are being conned -  as this comments section will clearly show.,20201014,BBC
I predict a riot.,20201014,BBC
IT&#39;S A TRAP!,20201014,BBC
"Boris is ignoring more than just science. Cough cough Julian Assange, UK role in Yemen famine, etc.",20201014,BBC
He knows he’s wrong but is far too arrogant to admit it....,20201014,BBC
lockdown: people whining<br>no-lockdown: same people whining,20201014,BBC
It is a really good thing I am introverted because I can see how patience is wearing thin for extroverts all over the world,20201014,BBC
"When the truth comes out, the BBC &amp; all the collaborators will be given a nice room in the &quot;Hotel California&quot;",20201014,BBC
BBC Spends more than £35Million to force the over 75&#39;s to pay up for a license or face bailiffs.,20201014,BBC
Houses can’t mix <br>Ok so me on a buss lots of people or shopping centre lots of people <br>Why ten pm thing places have to close <br>Sorry but covid is just another bug <br>I’m done with all this crap,20201014,BBC
"No to forced vaccines and lockdowns, end the BBC licence fee.",20201014,BBC
The test are inadequate it’s all pot noodle. Stop getting tested. It’s that simple.,20201014,BBC
We are now paying the price of becoming a service economy rather than a manufacturing one.,20201014,BBC
Who wants to bet they’ll shut everything down right afterwards? :’),20210222,BBC
Horse shit they&#39;ll put us back into lockdown again soon enough.,20210222,BBC
Then bringing it back in a couple of months don&#39;t kid yourselves people.,20210222,BBC
"Cool, so when is lockdown 4 going to start?",20210222,BBC
I can&#39;t trust a man who brushes his hair with a balloon,20210222,BBC
Watch after 2 weeks another lockdown will come this is useless and bullshit.,20210222,BBC
Why is school the first thing they open its the most packed out of everything and it&#39;s getting unrestricted on the same date as only being able to meet one person out side like wtf,20210222,BBC
Who remembers when Boris served tea<br><br>Now he&#39;s serving us with lies,20210222,BBC
Also I can be on the school playground with 60 others but I cannot meet up with anyone till weeks after I can with 60 other,20210222,BBC
WHY OPEN THE SCHOOLS WHEN WE ARE MIXING WITH 30 CHILDREN IN A CLASSROOM BUT CSNT GO OUT IN GROUPS,20210222,BBC
A Boris lockdown so successful it&#39;s enabled Sweden and Florida to carry on as normal lol,20210222,BBC
"We&#39;ll lift the lockdown, cases will rise and we&#39;ll go right back to lockdown. I have been in my home for the past 5 months shopping for only the essientals I want to be able to go out and have fun.",20210222,BBC
ok cool see yall in 2026 when this virus is still going,20210222,BBC
Isn&#39;t that odd. I could have sworn that today he also said that he wouldn&#39;t be nominating dates but would be lead by the data. Can we trust anything he says? He&#39;s getting worse. He used to contradict himself a couple of days later. We&#39;ve now got the contradiction within the same sentence. What&#39;s happened? Have both his ganglia fired at the same moment?,20210222,BBC
if you believe all this then you all must believe in father christmas,20210222,BBC
"i imagine we will get a little taste of freedom, then lockdown will be back in place straight after this roadmap. all the while our taxes won&#39;t be delayed, they will be taken on time and distributed as normal funnily enough... <br><br>if everyone refused lockdown it will end in days. but peoples lack of unity will stop that...",20210222,BBC
Don&#39;t read the comments if you want to keep your sanity.,20210222,BBC
Why are you still going on about vaccine passports?,20210222,BBC
"Put politicians in jail, then the virus will disappear",20210222,BBC
"Boris says that he won&#39;t go by dates but by data, well haven&#39;t they been manipulating it to suit their agenda? hardly trustworthy is it!?!",20210222,BBC
Imagine queuing for 4 hours only to find what your looking for is out of stock,20200601,Independent
<i>NPC&#39;s resuming their daily programming to consume without question.</i>,20200601,Independent
"imagine queuing for hours to get in, just to come out with a cushion. 🤦‍♂️",20200601,Independent
oh just an excuse to Q up.Our favourite national pastime.,20200601,Independent
Queuing for hours to decorate your home that you’ve been stuck in for 2 months lmao,20200601,Independent
"When I see this, I lose all hope for humanity.",20200601,Independent
What a pack of absolute bellends these people are,20200601,Independent
hours for IKEA? <br><br>hilarious,20200601,Independent
They&#39;re after the place. They don&#39;t know why; they just remember. Remember that they want to be in here.,20200601,Independent
What did you do when lockdown was lifted?<br>Guy 1: I went to see family<br>Guy 2: I went back to work<br>Guy 3: I went to get flatpack furniture,20200601,Independent
Just proves that as a whole Brits are not most logical and smart nation ;),20200601,Independent
Why would an Ikea be the first thing on your mind after lockdown,20200601,Independent
"As George A. Romero said &#39;When theres no more room in Ikea, the daft will walk the earth&#39;.",20200601,Independent
Shall we go to the park or shall we go back to consumer shopping? Shopping! Shopping!Shopping! Gimme stuff now!!,20200601,Independent
"Wait til DFS open, they have sales u know.",20200601,Independent
SHEEPLE,20200601,Independent
When you run out of furniture in two months ...,20200601,Independent
How sad. Great way to waste a day of your life people.,20200601,Independent
"When you see that guy on here ranting &quot;wake up sheeple&quot;, these are the sheeple he&#39;s on about.",20200601,Independent
"Walking dead,, wandering around like cattle,, Have they actually got nothing else to do.. Crazy.. Anyone heard of work...",20200601,Independent
"We in India are doing more than you lmao <br>We have closed the schools , colleges , cinema halls , sports event , public gathering. We have suspended Visa to ALL countries till 15th April and banned ALL exports of medical goods.<br><br>Put lives above money for godsake",20200312,Independent
"“It’s not possible to stop everyone from getting it.” Taiwan did. And they’re a stones throw from China. They acted fast and didn’t mess around. Taiwan has 47 cases and Britain could potentially have 10,000 at this point?<br><br>Stop pretending you have this under control.",20200312,Independent
He may as well have just showed a slide saying ‘we are fooked’.,20200312,Independent
So the argument for not closing the school was that kids are less likely to be seriously affected. They seem to forget the fact that we teachers are not kids and we are not necessarily going to be less seriously affected. Couple that with the fact that they said the people with mild symptoms are likely to infect more people and I suspect the teacher crisis is going to get worse pretty soon.,20200312,Independent
Too late to respond failed government you left the doors open to everyone,20200312,Independent
Close the dam schools this is ridiculous!!!!,20200312,Independent
That&#39;s stupid I&#39;m a teenager and they say kids don&#39;t get that bad but we can still carry corona virus which can lead us giving it to teachers and even visitors and if us kids had days off our attendance would go down leading into parents getting fined etc.,20200312,Independent
Everyone should relax.. take good care of your families and loved one.. work from home if you can and look after the elderly.. try to avoid overcrowded areas.. wash your hands.. improve your immune system.. take VitC 500mg or 1000mg 3 times a day.. VitC have shown to great improve your chance of not getting sick or dying of this diseases... Your immune system can defeat this .. Trust in GOD and don&#39;t listen to lies or scaremongering tactics .. stay at home if you suspect you are infects and try to wear a mask to prevent others getting sick in your household.. if you have hard time breathing call 111 follow the directions they give you. You will need to visit the hospital if your symptoms get worse DONT STAY AT HOME IF YOU ARE VERY SICK!!!... apply common sense and you will be fine. This is not as bad as these scientist are claiming .. wash your hands and wear gloves if you need to go out and do shopping.. stay safe and DON&quot;T BE SCARED!,20200312,Independent
That fact is everyone is going crazy like you don’t need to buy 50 toilet rolls 😂😂😂,20200312,Independent
A broken Britain WIth a Broken NHS and a Govt full of lies - They have no idea what is coming and how they will be able to contain it - People are unhygienic in this country to begin with -  no or overpriced masks the govt is utterly joking with these statements. It seems like they are talking to a country that has 1000&#39;s dead already.,20200312,Independent
Everyone’s an expert in disease control looking at the comments.,20200312,Independent
close the schools it is more likely to get there,20200312,Independent
You’ll be remembered as a killer. Here in Italy we are fighting with all our forces and don’t you expect to make your citizens come to our country.. in the uk this will never end if you don’t take measures (the virus can be contracted a lot of times),20200312,Independent
"this man does not think rationally.  There are no virus-related security measures in England.England may understand this when it comes to the same situation as in Italy but it will be too late<br>schools should be closed a long time ago, there is nothing to wait for",20200312,Independent
close all the schools,20200312,Independent
<b>Boris Johnson the new Idiot of the Year 2020 after Trump.</b>,20200312,Independent
Thank you everyone for voting for this person. See you in heaven.,20200312,Independent
"Cobra can stop nothing! Close the borders! Britain is free and an independent country and can take back control fo own country - British people have voted for. But if British people have to pay the Brexit price now with there lives then I ask me: is Britain free, is this Brexit or is Britain an EU slave country and nothing has changed: Brexit betrayal?",20200312,Independent
"I’d love to help neighbours who are unfortunate enough to have to stay home by buying things for them for example. However, that will involve talking to them and moreover taking money from them. Money that might carry the virus. Is that safe?",20200312,Independent
Government 🇬🇧: We got this under control       Meanwhile in a real world: Breaking new 596 cases has been confirmed today .                                                                   <b>Directed by Robert B Weide</b>,20200312,Independent
It looks as if the Government found a use for the cancelled school dinners.,20210215,Independent
"So they’re only literally a year late implementing this scheme, and the airlines and travel companies are still complaining about it anyway.",20210215,Independent
Korea did this when the pandemic starter and we&#39;re only now implementing this? Shameful,20210215,Independent
The thumbnail dosent appears in the video. You never see someone lying barefoot on a bed with a cup of tea,20210215,Independent
Paying money to be a prisoner...,20210215,Independent
If you can afford it. Pathetic country. Should’ve closed down the borders last March. Would’ve been way easier.,20210215,Independent
The music on this is so loud you can&#39;t hear the report,20210215,Independent
Don&#39;t do the ping pong music louder than you voice! Duh!,20210215,Independent
"Let the truth be told stock are very good no doubt, but investing in Forex and crypto market is not a bad idea with its current status, I was skeptical when I started investing but no more, it&#39;s has really proven to be very profitable",20210215,Independent
Never spoiled the &#39;flu&#39; with a expensive holiday,20210215,Independent
The problem with quarantine in UK is that hotel rooms here are so small :-/ also the food sucks comparing to other countries... In China 14 days cost around £500 including 3 meals whereas here it costs £1750... almost as expensive as a all inclusive 4 star holiday overseas. Looks like gov is trying to make mandatory quarantine a profitable business.,20210215,Independent
"Had they implemented this system a year ago, we would probably be out of lockdown by a now",20210215,Independent
“If I had a friend” Oh you do make me laugh Simon....😂,20210215,Independent
What a world we now live in. Prison for non criminals,20210215,Independent
"I am looking forward to seeing Matt Hancock in one of those rooms after his holiday , that he in his words booked in several months ago . <br><br>Ow wait he won’t, because he is a special cookie",20210215,Independent
Ok it makes sense now you go to jail and you have to pay for it but if you can&#39;t afford it you go to another jail and if you try to escape because you have no money to pay you end up in a different jail.. Very clever and very thoughtful of the government,20210215,Independent
What about people who work in those hotels? Do they have to quarantine as well? Until this ends?,20210215,Independent
&quot;Security guards outside&quot; 👀,20210215,Independent
"Comment section:<br><br>&quot;It&#39;s prison&quot;, &quot;call it what it is, it&#39;s a cell&quot;, &quot;we&#39;re being locked up&quot;..<br><br>...yes because I&#39;m sure prisoners rue the days they&#39;re given 12 day sentences in a room like that...",20210215,Independent
Just say it it’s like prison 😂😂😂😂,20210215,Independent
🏴󠁧󠁢󠁳󠁣󠁴󠁿Nicola handling coronavirus pandemic better than England?🐵,20200529,Guardian
My concerns are that these new additional Semi-Lockdown measures will be so very restrictive in nature that any movements allowed within the Dos and Don&#39;t do Instructions will feel more like no real Lockdown measures have been lifted at all.,20200529,Guardian
Very detailed very clear unlike england,20200529,Guardian
Yah see at least the Scottish ACTUALLY LISTENS UNLIKE US!,20200529,Guardian
"Wee Nike (just do it) in trouble about her hair.<br>Common we all know her husband (😜) does it, don&#39;t we?",20200529,Guardian
"I’m convinced this woman is really jimmy crankie, I mean since nicola came on the scene jimmy has been suspiciously absent from the tv",20200529,Guardian
"Why does she talk and explain things as if she was talking to a classroom of 6 year olds. She goes on and on when a short explanation of the rules would suffice. She is  trying too hard to cover all the eventualities of her exit out of the lockdown so nothing comes back on her. Too late, most of us have sussed out her political point scoring act at the daily update podium. Bet she can’t wait to get that independence record out again and play it non stop. We will be back to hearing - we were dragged out of Europe against our will - for the millionth time.",20200529,Guardian
the virus is not highly infectious and the mortality rates are tiny....what ever this is about it&#39;s not about a virus,20200529,Guardian
The nwo is active they are using the virus to control you the virus is not in the general population.,20200529,Guardian
"What is wrong with the recording? So much of it missing, with jumps and questions cut off and answers clipped. Very annoying.",20200529,Guardian
Anyone know When the family courts in Scotland will be dealing with contact application&#39;s nicola doesn&#39;t seem to mention the courts closing doors to family matters or  anyone know why no one has mentioned the impact this has on children or familys ????,20200529,Guardian
"Stay safe, stay home, wash hands, wear masks, keep social distance.",20200529,Guardian
